{
  "interaction_number": 10,
  "interaction_summary": "=== Purchase Information ===\nProduct Title: Mineral Sheer Tint Foundation Spf 20, New Makeup Tinted Moisturizer (Natural Glow) - 1 fl oz\nReview Date: 2022/01/30\nStore: Beauty Basics\nProduct Description: ['SPF 20. Hypoallergenic. Clinically engineered to multi-task as a foundation, sunscreen and antioxidant lotion. This ultra-sheer cr\u00e8me features an extra boost - our Multi-Mineral Complex of Magnesium, Potassium, Sodium, Zinc, Lysine and other vital elements. Potent antioxidants, Ginkgo Biloba, Ginseng and Vitamins A and E, protect against free radical damage while moisturizing skin. Glides on effortlessly to create a water-resistant veil of natural-looking coverage.']\nAverage Rating: 4.5\nProduct Details: {'Item Form': 'Lotion', 'Color': 'Natural Glow', 'Finish Type': 'Sheer', 'Package Information': 'Tube', 'Brand': 'Beauty Basics', 'Is Discontinued By Manufacturer': 'No', 'Package Dimensions': '7.01 x 5.91 x 0.98 inches; 1.76 Ounces', 'Item model number': 'SG_B008FR532U_US', 'UPC': '025132912731', 'Manufacturer': 'Your Name cosmetics'}\nReview Text: Evens out complexion.\nReview Title: Produces natural glow on face.\nRating: 5.0\n--------------------------------------------------",
  "reference_summary": "Mineral Sheer Tint Foundation Spf 20, New Makeup Tinted Moisturizer (Natural Glow) - 1 fl oz\nBeauty Basics\n['SPF 20. Hypoallergenic. Clinically engineered to multi-task as a foundation, sunscreen and antioxidant lotion. This ultra-sheer cr\u00e8me features an extra boost - our Multi-Mineral Complex of Magnesium, Potassium, Sodium, Zinc, Lysine and other vital elements. Potent antioxidants, Ginkgo Biloba, Ginseng and Vitamins A and E, protect against free radical damage while moisturizing skin. Glides on effortlessly to create a water-resistant veil of natural-looking coverage.']\n{'Item Form': 'Lotion', 'Color': 'Natural Glow', 'Finish Type': 'Sheer', 'Package Information': 'Tube', 'Brand': 'Beauty Basics', 'Is Discontinued By Manufacturer': 'No', 'Package Dimensions': '7.01 x 5.91 x 0.98 inches; 1.76 Ounces', 'Item model number': 'SG_B008FR532U_US', 'UPC': '025132912731', 'Manufacturer': 'Your Name cosmetics'}\nEvens out complexion.\nProduces natural glow on face.\nMineral Sheer Tint Foundation Spf 20, New Makeup Tinted Moisturizer (Natural Glow) - 1 fl oz\nBeauty Basics\n['SPF 20. Hypoallergenic. Clinically engineered to multi-task as a foundation, sunscreen and antioxidant lotion. This ultra-sheer cr\u00e8me features an extra boost - our Multi-Mineral Complex of Magnesium, Potassium, Sodium, Zinc, Lysine and other vital elements. Potent antioxidants, Ginkgo Biloba, Ginseng and Vitamins A and E, protect against free radical damage while moisturizing skin. Glides on effortlessly to create a water-resistant veil of natural-looking coverage.']\n{'Item Form': 'Lotion', 'Color': 'Natural Glow', 'Finish Type': 'Sheer', 'Package Information': 'Tube', 'Brand': 'Beauty Basics', 'Is Discontinued By Manufacturer': 'No', 'Package Dimensions': '7.01 x 5.91 x 0.98 inches; 1.76 Ounces', 'Item model number': 'SG_B008FR532U_US', 'UPC': '025132912731', 'Manufacturer': 'Your Name cosmetics'}\nEvens out complexion.\nProduces natural glow on face.\nMineral Sheer Tint Foundation Spf 20, New Makeup Tinted Moisturizer (Natural Glow) - 1 fl oz\nBeauty Basics\n['SPF 20. Hypoallergenic. Clinically engineered to multi-task as a foundation, sunscreen and antioxidant lotion. This ultra-sheer cr\u00e8me features an extra boost - our Multi-Mineral Complex of Magnesium, Potassium, Sodium, Zinc, Lysine and other vital elements. Potent antioxidants, Ginkgo Biloba, Ginseng and Vitamins A and E, protect against free radical damage while moisturizing skin. Glides on effortlessly to create a water-resistant veil of natural-looking coverage.']\n{'Item Form': 'Lotion', 'Color': 'Natural Glow', 'Finish Type': 'Sheer', 'Package Information': 'Tube', 'Brand': 'Beauty Basics', 'Is Discontinued By Manufacturer': 'No', 'Package Dimensions': '7.01 x 5.91 x 0.98 inches; 1.76 Ounces', 'Item model number': 'SG_B008FR532U_US', 'UPC': '025132912731', 'Manufacturer': 'Your Name cosmetics'}\nEvens out complexion.\nProduces natural glow on face.\nMineral Sheer Tint Foundation Spf 20, New Makeup Tinted Moisturizer (Natural Glow) - 1 fl oz\nBeauty Basics\n['SPF 20. Hypoallergenic. Clinically engineered to multi-task as a foundation, sunscreen and antioxidant lotion. This ultra-sheer cr\u00e8me features an extra boost - our Multi-Mineral Complex of Magnesium, Potassium, Sodium, Zinc, Lysine and other vital elements. Potent antioxidants, Ginkgo Biloba, Ginseng and Vitamins A and E, protect against free radical damage while moisturizing skin. Glides on effortlessly to create a water-resistant veil of natural-looking coverage.']\n{'Item Form': 'Lotion', 'Color': 'Natural Glow', 'Finish Type': 'Sheer', 'Package Information': 'Tube', 'Brand': 'Beauty Basics', 'Is Discontinued By Manufacturer': 'No', 'Package Dimensions': '7.01 x 5.91 x 0.98 inches; 1.76 Ounces', 'Item model number': 'SG_B008FR532U_US', 'UPC': '025132912731', 'Manufacturer': 'Your Name cosmetics'}\nEvens out complexion.\nProduces natural glow on face.\nMineral Sheer Tint Foundation Spf 20, New Makeup Tinted Moisturizer (Natural Glow) - 1 fl oz\nBeauty Basics\n['SPF 20. Hypoallergenic. Clinically engineered to multi-task as a foundation, sunscreen and antioxidant lotion. This ultra-sheer cr\u00e8me features an extra boost - our Multi-Mineral Complex of Magnesium, Potassium, Sodium, Zinc, Lysine and other vital elements. Potent antioxidants, Ginkgo Biloba, Ginseng and Vitamins A and E, protect against free radical damage while moisturizing skin. Glides on effortlessly to create a water-resistant veil of natural-looking coverage.']\n{'Item Form': 'Lotion', 'Color': 'Natural Glow', 'Finish Type': 'Sheer', 'Package Information': 'Tube', 'Brand': 'Beauty Basics', 'Is Discontinued By Manufacturer': 'No', 'Package Dimensions': '7.01 x 5.91 x 0.98 inches; 1.76 Ounces', 'Item model number': 'SG_B008FR532U_US', 'UPC': '025132912731', 'Manufacturer': 'Your Name cosmetics'}\nEvens out complexion.\nProduces natural glow on face.\nMineral Sheer Tint Foundation Spf 20, New Makeup Tinted Moisturizer (Natural Glow) - 1 fl oz\nBeauty Basics\n['SPF 20. Hypoallergenic. Clinically engineered to multi-task as a foundation, sunscreen and antioxidant lotion. This ultra-sheer cr\u00e8me features an extra boost - our Multi-Mineral Complex of Magnesium, Potassium, Sodium, Zinc, Lysine and other vital elements. Potent antioxidants, Ginkgo Biloba, Ginseng and Vitamins A and E, protect against free radical damage while moisturizing skin. Glides on effortlessly to create a water-resistant veil of natural-looking coverage.']\n{'Item Form': 'Lotion', 'Color': 'Natural Glow', 'Finish Type': 'Sheer', 'Package Information': 'Tube', 'Brand': 'Beauty Basics', 'Is Discontinued By Manufacturer': 'No', 'Package Dimensions': '7.01 x 5.91 x 0.98 inches; 1.76 Ounces', 'Item model number': 'SG_B008FR532U_US', 'UPC': '025132912731', 'Manufacturer': 'Your Name cosmetics'}\nEvens out complexion.\nProduces natural glow on face.\nMineral Sheer Tint Foundation Spf 20, New Makeup Tinted Moisturizer (Natural Glow) - 1 fl oz\nBeauty Basics\n['SPF 20. Hypoallergenic. Clinically engineered to multi-task as a foundation, sunscreen and antioxidant lotion. This ultra-sheer cr\u00e8me features an extra boost - our Multi-Mineral Complex of Magnesium, Potassium, Sodium, Zinc, Lysine and other vital elements. Potent antioxidants, Ginkgo Biloba, Ginseng and Vitamins A and E, protect against free radical damage while moisturizing skin. Glides on effortlessly to create a water-resistant veil of natural-looking coverage.']\n{'Item Form': 'Lotion', 'Color': 'Natural Glow', 'Finish Type': 'Sheer', 'Package Information': 'Tube', 'Brand': 'Beauty Basics', 'Is Discontinued By Manufacturer': 'No', 'Package Dimensions': '7.01 x 5.91 x 0.98 inches; 1.76 Ounces', 'Item model number': 'SG_B008FR532U_US', 'UPC': '025132912731', 'Manufacturer': 'Your Name cosmetics'}\nEvens out complexion.\nProduces natural glow on face.\nMineral Sheer Tint Foundation Spf 20, New Makeup Tinted Moisturizer (Natural Glow) - 1 fl oz\nBeauty Basics\n['SPF 20. Hypoallergenic. Clinically engineered to multi-task as a foundation, sunscreen and antioxidant lotion. This ultra-sheer cr\u00e8me features an extra boost - our Multi-Mineral Complex of Magnesium, Potassium, Sodium, Zinc, Lysine and other vital elements. Potent antioxidants, Ginkgo Biloba, Ginseng and Vitamins A and E, protect against free radical damage while moisturizing skin. Glides on effortlessly to create a water-resistant veil of natural-looking coverage.']\n{'Item Form': 'Lotion', 'Color': 'Natural Glow', 'Finish Type': 'Sheer', 'Package Information': 'Tube', 'Brand': 'Beauty Basics', 'Is Discontinued By Manufacturer': 'No', 'Package Dimensions': '7.01 x 5.91 x 0.98 inches; 1.76 Ounces', 'Item model number': 'SG_B008FR532U_US', 'UPC': '025132912731', 'Manufacturer': 'Your Name cosmetics'}\nEvens out complexion.\nProduces natural glow on face.\nMineral Sheer Tint Foundation Spf 20, New Makeup Tinted Moisturizer (Natural Glow) - 1 fl oz\nBeauty Basics\n['SPF 20. Hypoallergenic. Clinically engineered to multi-task as a foundation, sunscreen and antioxidant lotion. This ultra-sheer cr\u00e8me features an extra boost - our Multi-Mineral Complex of Magnesium, Potassium, Sodium, Zinc, Lysine and other vital elements. Potent antioxidants, Ginkgo Biloba, Ginseng and Vitamins A and E, protect against free radical damage while moisturizing skin. Glides on effortlessly to create a water-resistant veil of natural-looking coverage.']\n{'Item Form': 'Lotion', 'Color': 'Natural Glow', 'Finish Type': 'Sheer', 'Package Information': 'Tube', 'Brand': 'Beauty Basics', 'Is Discontinued By Manufacturer': 'No', 'Package Dimensions': '7.01 x 5.91 x 0.98 inches; 1.76 Ounces', 'Item model number': 'SG_B008FR532U_US', 'UPC': '025132912731', 'Manufacturer': 'Your Name cosmetics'}\nEvens out complexion.\nProduces natural glow on face.\nMineral Sheer Tint Foundation Spf 20, New Makeup Tinted Moisturizer (Natural Glow) - 1 fl oz\nBeauty Basics\n['SPF 20. Hypoallergenic. Clinically engineered to multi-task as a foundation, sunscreen and antioxidant lotion. This ultra-sheer cr\u00e8me features an extra boost - our Multi-Mineral Complex of Magnesium, Potassium, Sodium, Zinc, Lysine and other vital elements. Potent antioxidants, Ginkgo Biloba, Ginseng and Vitamins A and E, protect against free radical damage while moisturizing skin. Glides on effortlessly to create a water-resistant veil of natural-looking coverage.']\n{'Item Form': 'Lotion', 'Color': 'Natural Glow', 'Finish Type': 'Sheer', 'Package Information': 'Tube', 'Brand': 'Beauty Basics', 'Is Discontinued By Manufacturer': 'No', 'Package Dimensions': '7.01 x 5.91 x 0.98 inches; 1.76 Ounces', 'Item model number': 'SG_B008FR532U_US', 'UPC': '025132912731', 'Manufacturer': 'Your Name cosmetics'}\nEvens out complexion.\nProduces natural glow on face.",
  "actual_interaction": {
    "rating": 5.0,
    "title": "Produces natural glow on face.",
    "text": "Evens out complexion.",
    "images": [],
    "asin": "B008FR532U",
    "parent_asin": "B07CKTWB2N",
    "user_id": "AHK3S32VWSXOBIYYF2MKGXUDRDBA",
    "timestamp": "2022-01-30 17:27:11.330000",
    "helpful_vote": 0,
    "verified_purchase": true,
    "main_category": "All Beauty",
    "title_meta": "Mineral Sheer Tint Foundation Spf 20, New Makeup Tinted Moisturizer (Natural Glow) - 1 fl oz",
    "average_rating": 4.5,
    "rating_number": 283,
    "features": [
      "Clinically engineered to multi-task as a foundation",
      "This ultra-sheer cr\u00e8me features an extra boost",
      "our Multi-Mineral Complex of Magnesium, Potassium, Sodium, Zinc, Lysine and other vital elements. Potent antioxidants, Ginkgo Biloba, Ginseng and Vitamins A and E, protect against free radical damage while moisturizing skin.",
      "Glides on effortlessly to create a water-resistant veil of natural-looking coverage"
    ],
    "description": [
      "SPF 20. Hypoallergenic. Clinically engineered to multi-task as a foundation, sunscreen and antioxidant lotion. This ultra-sheer cr\u00e8me features an extra boost - our Multi-Mineral Complex of Magnesium, Potassium, Sodium, Zinc, Lysine and other vital elements. Potent antioxidants, Ginkgo Biloba, Ginseng and Vitamins A and E, protect against free radical damage while moisturizing skin. Glides on effortlessly to create a water-resistant veil of natural-looking coverage."
    ],
    "price": 25.99,
    "images_meta": [
      {
        "thumb": "https://m.media-amazon.com/images/I/11vCT-OJiWL._SS40_.jpg",
        "large": "https://m.media-amazon.com/images/I/11vCT-OJiWL.jpg",
        "variant": "MAIN",
        "hi_res": null
      }
    ],
    "videos": [],
    "store": "Beauty Basics",
    "categories": [],
    "details": {
      "Item Form": "Lotion",
      "Color": "Natural Glow",
      "Finish Type": "Sheer",
      "Package Information": "Tube",
      "Brand": "Beauty Basics",
      "Is Discontinued By Manufacturer": "No",
      "Package Dimensions": "7.01 x 5.91 x 0.98 inches; 1.76 Ounces",
      "Item model number": "SG_B008FR532U_US",
      "UPC": "025132912731",
      "Manufacturer": "Your Name cosmetics"
    },
    "bought_together": null
  }
}