{
  "interaction_number": 11,
  "interaction_summary": "=== Purchase Information ===\nProduct Title: SinfulColors Kylie Matte Denim & Bling - Kloud 9 (Blue Iridescent Glitter)\nReview Date: 2021/05/13\nStore: SinfulColors\nProduct Description: ['Nail polish']\nAverage Rating: 4.0\nProduct Details: {'Brand': 'SinfulColors', 'Item Form': 'Liquid', 'Color': 'Blue', 'Finish Type': 'Shimmery', 'Unit Count': '1.00 Fl Oz', 'Number of Items': '1', 'Number of Pieces': '1', 'Liquid Volume': '0.5 Fluid Ounces', 'Is Discontinued By Manufacturer': 'No', 'Package Dimensions': '4 x 2 x 1.2 inches; 3.99 Ounces', 'UPC': '099500103212'}\nReview Text: goes on well and sparkles. it's a pretty color.\nReview Title: awesome color\nRating: 5.0\n--------------------------------------------------",
  "reference_summary": "1 Kleancolor Nail Polish Lacquer #166 Metallic Fuschia Manicure + Free Earring Gift\nKleancolor\n{'Brand': 'Kleancolor', 'Item Form': 'Liquid', 'Finish Type': 'Metallic', 'Special Feature': 'Long-lasting', 'Unit Count': '1.00 Fl Oz', 'Number of Items': '1', 'Number of Pieces': '1', 'Liquid Volume': '0.5 Fluid Ounces', 'UPC': '634145845556'}\nawesome color.it goes on thick,so I only have to apply one coat.\ngood quality\n1 Kleancolor Nail Polish Lacquer #199 Hot Stuff Manicure + Free ZipBag\nKleancolor\n{'Brand': 'Kleancolor', 'Item Form': 'Liquid', 'Special Feature': 'Long-lasting', 'Age Range (Description)': 'Adult', 'Unit Count': '1.00 Count', 'Liquid Volume': '0.5 Fluid Ounces', 'UPC': '634145845884'}\nby itself no good. over another color maybe. not happy.\njust sparkles\nAIFAIFA Maroon Nail Polish, Metallic Nail Polish, Infinite Shine Nail Polish, Long-Lasting Winter Nail Polish, Dress Call, 0.4 Fl Oz\nAIFAIFA\n{'Brand': 'AIFAIFA', 'Item Form': 'Liquid', 'Color': 'Red', 'Finish Type': 'Metallic', 'Age Range (Description)': 'Adult', 'Number of Items': '1', 'Liquid Volume': '0.4 Fluid Ounces', 'Package Dimensions': '2.99 x 2.13 x 1.14 inches; 2.12 Ounces'}\nI didn't like this at all. it goes on like a thick goey mess. the color is not great either.\ntoo goey\nWet n Wild Fantasy Makers 'RIP Nail Polish' Spooky Nails, Rest in Pieces\nWet n' Wild\n{'Item Weight': '0.01 Ounces'}\na little too dark for me, but good for halloween.\nvery dark\nHard Candy Glitteratzi Nail Polish #670 Glamour Girl\nHard Candy\n{'Item Weight': '0.01 Ounces'}\nwhen I put this on, all it was is pink dots. I don't like it.\ndots\nWET N WILD Fergie Heavy Metal Nail Polish - Mazel Tov Madness\nWet 'n' Wild\n{'Brand': \"Wet 'n' Wild\", 'Item Form': 'Liquid', 'Age Range (Description)': 'Adult', 'Unit Count': '1.00 Count', 'Liquid Volume': '0.42 Fluid Ounces', 'Item Weight': '7.76 Ounces', 'UPC': '794437267579 077802342669'}\nI was hoping for a midnight blue, where you could tell it had some blue in it. it's closer to black.\ntoo dark\nWet n Wild Fergie Nail Color, Kaleidoscope Eyes 0.42 fl oz (12.5 ml) by AB\nWet n Wild\n{'Brand': 'Wet n Wild', 'Item Form': 'Liquid', 'Type': 'base', 'Age Range (Description)': 'Adult', 'Unit Count': '1.00 Count', 'Liquid Volume': '0.42 Fluid Ounces'}\nI thought it would be just sparkles, but there's this red tint to it. very ugly color.\nhate it\n1 Kleancolor Nail Polish Lacquer #170 Midnight Seduction Manicure + Free ZipBag Gift\nKleancolor\n{'Brand': 'Kleancolor', 'Item Form': 'Liquid', 'Special Feature': 'Long-lasting', 'Age Range (Description)': 'Adult', 'Unit Count': '1.00 Count', 'Number of Items': '1', 'Number of Pieces': '1', 'Liquid Volume': '0.5 Fluid Ounces', 'UPC': '634145845594'}\nI don't like it. I even tried putting it over another color and couldn't even see the sparkles. very disappointed.\nclear with sparkles\nFormula X Clix Mini 4 Piece Nail Polish Set for Sephora.Happy Hour.Take It to Go\n['Formula X Clix Mini 4 Piece Nail Polish Set for Sephora.Happy Hour.Take It to Go']\n{'Item Form': 'Liquid', 'Finish Type': 'Glossy', 'Material Feature': 'Formaldehyde free, Cruelty Free', 'Unit Count': '1.6 Fl Oz', 'Number of Items': '4'}\ngreat colors and it goes on thick so you only need one coat.\nawesome colors\nEssie Nail Polish, Beyond Cozy\nessie\n['Discontinued and Retired']\n{'Brand': 'Essie', 'Item Form': 'Liquid', 'Special Feature': 'Durability', 'Age Range (Description)': 'Adult', 'Number of Items': '1', 'UPC': '095008003672'}\nyou can barely tell it's on. it's only nice if you like light colors\ntoo light\nSinfulColors Kylie Matte Denim & Bling - Kloud 9 (Blue Iridescent Glitter)\nSinfulColors\n['Nail polish']\n{'Brand': 'SinfulColors', 'Item Form': 'Liquid', 'Color': 'Blue', 'Finish Type': 'Shimmery', 'Unit Count': '1.00 Fl Oz', 'Number of Items': '1', 'Number of Pieces': '1', 'Liquid Volume': '0.5 Fluid Ounces', 'Is Discontinued By Manufacturer': 'No', 'Package Dimensions': '4 x 2 x 1.2 inches; 3.99 Ounces', 'UPC': '099500103212'}\ngoes on well and sparkles. it's a pretty color.\nawesome color",
  "actual_interaction": {
    "rating": 5.0,
    "title": "awesome color",
    "text": "goes on well and sparkles. it's a pretty color.",
    "images": [],
    "asin": "B01ICU1ALW",
    "parent_asin": "B01ICU1ALW",
    "user_id": "AFGHWIK2E4ETVNOCG7ONQVUNE2AQ",
    "timestamp": "2021-05-13 14:25:55.025000",
    "helpful_vote": 0,
    "verified_purchase": true,
    "main_category": "All Beauty",
    "title_meta": "SinfulColors Kylie Matte Denim & Bling - Kloud 9 (Blue Iridescent Glitter)",
    "average_rating": 4.0,
    "rating_number": 13,
    "features": [],
    "description": [
      "Nail polish"
    ],
    "price": 9.75,
    "images_meta": [
      {
        "thumb": "https://m.media-amazon.com/images/I/31RHrUY2iIL._SS40_.jpg",
        "large": "https://m.media-amazon.com/images/I/31RHrUY2iIL.jpg",
        "variant": "MAIN",
        "hi_res": null
      }
    ],
    "videos": [],
    "store": "SinfulColors",
    "categories": [],
    "details": {
      "Brand": "SinfulColors",
      "Item Form": "Liquid",
      "Color": "Blue",
      "Finish Type": "Shimmery",
      "Unit Count": "1.00 Fl Oz",
      "Number of Items": "1",
      "Number of Pieces": "1",
      "Liquid Volume": "0.5 Fluid Ounces",
      "Is Discontinued By Manufacturer": "No",
      "Package Dimensions": "4 x 2 x 1.2 inches; 3.99 Ounces",
      "UPC": "099500103212"
    },
    "bought_together": null
  }
}