{
  "interaction_number": 10,
  "interaction_summary": "=== Purchase Information ===\nReview Date: 2020/01/30\nAverage Rating: 4.3\nProduct Details: {'Content advisory': ['Violence', 'alcohol use', 'smoking', 'foul language'], 'Audio languages': ['English Dialogue Boost: High', 'English', 'English Dialogue Boost: Medium'], 'Subtitles': ['English [CC]'], 'Directors': ['Adam McKay'], 'Producers': ['Chelsea Barnard', 'Maeve Cullinane', 'Megan Ellison', 'Will Ferrell', 'Dede Gardner', 'Jason George', 'Jeremy Kleiner', 'Jillian Longnecker', 'Jennifer Madeloff'], 'Starring': ['Christian Bale'], 'Studio': ['Lionsgate']}\nReview Text: Dick Cheney is Evil, but the movie went easy on him, in my opinion. That said, it was a good movie.\nReview Title: Great movie\nRating: 4.0\n--------------------------------------------------",
  "reference_summary": "Inception (Blu-ray)\nLeonardo DiCaprio  (Actor),     Ken Watanabe  (Actor),     Christopher Nolan  (Director)    &                   0                  more   Rated:    PG-13    Format: Blu-ray\nMovies & TV, Blu-ray, Movies\n['Product Description', 'Acclaimed filmmaker Christopher Nolan directs an international cast in this sci-fi actioner that travels around the globe and into the world of dreams. Dom Cobb (Leonardo DiCaprio) is the best there is at extraction: stealing valuable secrets inside the subconscious during the mind\u2019s vulnerable dream state. His skill has made him a coveted player in industrial espionage but also has made him a fugitive and cost him dearly. Now he may get a second chance if he can do the impossible: inception, planting an idea rather than stealing one. If they succeed, Cobb and his team could pull off the perfect crime. But no planning or expertise can prepare them for a dangerous enemy that seems to predict their every move. An enemy only Cobb could have seen coming.', 'Review', \"In terms of sheer originality, ambition and achievement, Inception is the movie of the summer, the movie of the year and the movie of our dreams --Pete Hammond, Boxoffice MagazineAs engrossing and logic-resistant as the state of dreaming it seeks to replicate, Christopher Nolan's audacious new creation demands further study to fully absorb the multiple, simultaneous stories Nolan finagles into one narrative experience. --Lisa Schwarzbaum, Entertainment WeeklyThis is a deeply felt work of art in the form of a big, brassy movie-movie. --Shawn Levy, Portland Oregonian\"]\n{'Genre': 'Science Fiction & Fantasy, Action & Adventure', 'Format': 'Multiple Formats, Blu-ray, AC-3, Color, Dolby, Widescreen, Subtitled, DTS Surround Sound', 'Contributor': 'Marion Cotillard, Christopher Nolan, Leonardo DiCaprio, Michael Caine, Ken Watanabe, Joseph Gordon-Levitt, Ellen Page, Tom Hardy, Cillian Murphy, Tom BerengerMarion Cotillard, Christopher Nolan, Leonardo DiCaprio, Michael Caine, Ken Watanabe, Joseph Gordon-Levitt, Ellen Page, Tom Hardy, Cillian Murphy, Tom Berenger  See more', 'Language': 'French (Dolby Digital 5.1), English (DTS-HD Master Audio 5.1), Unqualified (DTS-HD Master Audio 5.1), Spanish (Dolby Digital 5.1)', 'Runtime': '2 hours and 28 minutes', 'Digital Copy Expiration Date': 'November 20, 2014', 'Aspect Ratio': '2.40:1', 'Is Discontinued By Manufacturer': 'No', 'MPAA rating': 'PG-13 (Parents Strongly Cautioned)', 'Product Dimensions': '6.75 x 5.3 x 0.5 inches; 5.6 Ounces', 'Director': 'Christopher Nolan', 'Media Format': 'Multiple Formats, AC-3, Color, Dolby, Widescreen, Subtitled, Blu-ray, DTS Surround Sound', 'Run time': '2 hours and 28 minutes', 'Release date': 'December 7, 2010', 'Actors': 'Leonardo DiCaprio, Ken Watanabe, Joseph Gordon-Levitt, Marion Cotillard, Ellen Page', 'Subtitles': 'English, French, Spanish', 'Studio': 'WarnerBrothers', 'Number of discs': '2'}\nGREAT MOVIE!\nFive Stars\n{'Content advisory': ['Nudity', 'violence', 'substance use', 'alcohol use', 'foul language', 'sexual content'], 'Subtitles': ['None available'], 'Directors': ['John Dahl'], 'Starring': ['Hugh Dancy', 'Mads Mikkelsen', 'Caroline Dhavernas'], 'Studio': ['Lionsgate']}\nHannibal is the Best!\nFive Stars\n{'Content advisory': ['Violence', 'frightening scenes', 'alcohol use', 'foul language'], 'Audio languages': ['English', 'English [Audio Description]'], 'Subtitles': ['English [CC]'], 'Directors': ['Sam Esmail', 'Jim McKay', 'Tricia Brock', 'Deborah Chow', 'Nisha Ganatra', 'Niels Arden Oplev', 'Christoph Schrewe'], 'Producers': ['Sam Esmail', 'Kyle Bradstreet', 'Steve Golin', 'Chad Hamilton'], 'Starring': ['Rami Malek', 'Christian Slater', 'Portia Doubleday'], 'Studio': ['USA']}\nSee it!\nFive Stars\n{'Content advisory': ['Violence', 'alcohol use', 'foul language', 'sexual content'], 'Audio languages': ['English'], 'Subtitles': ['English [CC]'], 'Directors': ['Stephen Hopkins', 'Matthew Carnahan', 'Daisy von Scherler Mayer', 'Don Cheadle', 'Adam Bernstein', 'John Dahl', 'Michael Uppendahl', 'Miguel Arteta', 'Seith Mann', 'Beth McCarthy-Miller'], 'Starring': ['Don Cheadle', 'Kristen Bell', 'Ben Schwartz'], 'Studio': ['Showtime']}\nJust Watch it!\nFive Stars\n{'Audio languages': ['English'], 'Subtitles': ['English [CC]'], 'Directors': ['Greg Nicotero', 'Michael E. Satrazemis', 'David Boyd'], 'Starring': ['Norman Reedus : Daryl Dixon', 'Melissa McBride : Carol Peletier : Carol'], 'Studio': ['Starz']}\nJust Watch it!\nFive Stars\n{'Audio languages': ['English'], 'Subtitles': ['English [CC]'], 'Directors': ['TBD'], 'Producers': ['TBD'], 'Starring': ['TBD'], 'Studio': ['AMC']}\nJust Watch it!\nFive Stars\n{'Audio languages': ['English'], 'Subtitles': ['English [CC]'], 'Directors': ['Marcus Wilson'], 'Producers': ['Marcus Wilson', 'Elizabeth Kilgarriff'], 'Starring': ['Laura Haddock', 'Dermot Crowley', 'Patrick Malahide'], 'Studio': ['BritBox']}\nJust Watch it!\nFive Stars\n{'Audio languages': ['English'], 'Subtitles': ['English [CC]'], 'Producers': ['Laura Benson', 'Carla Kettner', 'J.R. Orci', 'Lukas Reiter', 'James Spader', 'John Davis', 'John Fox', 'Jon Bokenkamp', 'John Eisendrath'], 'Studio': ['NBC Network']}\nGreat show\nReddington\n{'Content advisory': ['Violence', 'foul language'], 'Audio languages': ['English', 'English [Audio Description]'], 'Subtitles': ['English [CC]'], 'Directors': ['Donovan Marsh'], 'Producers': ['Xu Bin', 'Christa Campbell'], 'Starring': ['Corey Johnson', 'Adam James', 'Common']}\nSee headline\nGood Movie\n{'Content advisory': ['Violence', 'alcohol use', 'smoking', 'foul language'], 'Audio languages': ['English Dialogue Boost: High', 'English', 'English Dialogue Boost: Medium'], 'Subtitles': ['English [CC]'], 'Directors': ['Adam McKay'], 'Producers': ['Chelsea Barnard', 'Maeve Cullinane', 'Megan Ellison', 'Will Ferrell', 'Dede Gardner', 'Jason George', 'Jeremy Kleiner', 'Jillian Longnecker', 'Jennifer Madeloff'], 'Starring': ['Christian Bale'], 'Studio': ['Lionsgate']}\nDick Cheney is Evil, but the movie went easy on him, in my opinion. That said, it was a good movie.\nGreat movie",
  "actual_interaction": {
    "rating": 4.0,
    "title": "Great movie",
    "text": "Dick Cheney is Evil, but the movie went easy on him, in my opinion. That said, it was a good movie.",
    "images": [],
    "asin": "B07MGSGK67",
    "parent_asin": "B07MGSGK67",
    "user_id": "AFEJ2MZWR7O64X2S3ZI2J7BFKTYA",
    "timestamp": "2020-01-30 03:34:12.625000",
    "helpful_vote": 1,
    "verified_purchase": true,
    "main_category": "Prime Video",
    "title_meta": null,
    "average_rating": 4.3,
    "rating_number": 8014,
    "features": null,
    "description": null,
    "price": null,
    "images_meta": [
      {
        "360w": "https://images-na.ssl-images-amazon.com/images/S/pv-target-images/9770bc76821ffb221de644715d3c44a2354bc1db0852ea10cee6023ec398fc99._RI_TTW_SX360_FMwebp_.jpg",
        "480w": "https://images-na.ssl-images-amazon.com/images/S/pv-target-images/9770bc76821ffb221de644715d3c44a2354bc1db0852ea10cee6023ec398fc99._RI_TTW_SX480_FMwebp_.jpg",
        "720w": "https://images-na.ssl-images-amazon.com/images/S/pv-target-images/9770bc76821ffb221de644715d3c44a2354bc1db0852ea10cee6023ec398fc99._RI_TTW_SX720_FMwebp_.jpg",
        "1080w": "https://images-na.ssl-images-amazon.com/images/S/pv-target-images/9770bc76821ffb221de644715d3c44a2354bc1db0852ea10cee6023ec398fc99._RI_TTW_SX1080_FMwebp_.jpg",
        "1440w": "https://images-na.ssl-images-amazon.com/images/S/pv-target-images/9770bc76821ffb221de644715d3c44a2354bc1db0852ea10cee6023ec398fc99._RI_TTW_SX1440_FMwebp_.jpg",
        "1920w": "https://images-na.ssl-images-amazon.com/images/S/pv-target-images/9770bc76821ffb221de644715d3c44a2354bc1db0852ea10cee6023ec398fc99._RI_TTW_SX1920_FMwebp_.jpg",
        "variant": "MAIN"
      }
    ],
    "videos": [],
    "store": null,
    "categories": null,
    "details": {
      "Content advisory": [
        "Violence",
        "alcohol use",
        "smoking",
        "foul language"
      ],
      "Audio languages": [
        "English Dialogue Boost: High",
        "English",
        "English Dialogue Boost: Medium"
      ],
      "Subtitles": [
        "English [CC]"
      ],
      "Directors": [
        "Adam McKay"
      ],
      "Producers": [
        "Chelsea Barnard",
        "Maeve Cullinane",
        "Megan Ellison",
        "Will Ferrell",
        "Dede Gardner",
        "Jason George",
        "Jeremy Kleiner",
        "Jillian Longnecker",
        "Jennifer Madeloff"
      ],
      "Starring": [
        "Christian Bale"
      ],
      "Studio": [
        "Lionsgate"
      ]
    },
    "bought_together": null,
    "subtitle": null,
    "author": NaN
  }
}