{
  "interaction_number": 20,
  "interaction_summary": "=== Purchase Information ===\nReview Date: 2020/05/16\nAverage Rating: 4.1\nProduct Details: {'Content advisory': ['Nudity', 'violence', 'frightening scenes', 'alcohol use', 'smoking', 'foul language', 'sexual content'], 'Audio languages': ['English', 'English [Audio Description]', 'Espa\u00f1ol (Espa\u00f1a)', 'Italiano', 'Espa\u00f1ol (Latinoam\u00e9rica)', '\u65e5\u672c\u8a9e', 'Portugu\u00eas', 'Deutsch', 'Fran\u00e7ais'], 'Subtitles': ['English [CC]', '\u0627\u0644\u0639\u0631\u0628\u064a\u0629', '\u010ce\u0161tina', 'Dansk', 'Deutsch', '\u0395\u03bb\u03bb\u03b7\u03bd\u03b9\u03ba\u03ac', 'Espa\u00f1ol (Latinoam\u00e9rica)', 'Espa\u00f1ol (Espa\u00f1a)', 'Suomi', 'Filipino', 'Fran\u00e7ais', '\u05e2\u05d1\u05e8\u05d9\u05ea', '\u0939\u093f\u0928\u094d\u0926\u0940', 'Magyar', 'Indonesia', 'Italiano', '\u65e5\u672c\u8a9e', '\ud55c\uad6d\uc5b4', 'Bahasa Melayu', 'Norsk Bokm\u00e5l', 'Nederlands', 'Polski', 'Portugu\u00eas (Brasil)', 'Portugu\u00eas (Portugal)', 'Rom\u00e2n\u0103', '\u0420\u0443\u0441\u0441\u043a\u0438\u0439', 'Svenska', '\u0ba4\u0bae\u0bbf\u0bb4\u0bcd', '\u0c24\u0c46\u0c32\u0c41\u0c17\u0c41', '\u0e44\u0e17\u0e22', 'T\u00fcrk\u00e7e', '\u4e2d\u6587\uff08\u7b80\u4f53\uff09', '\u4e2d\u6587\uff08\u7e41\u9ad4\uff09'], 'Directors': ['Jodie Foster', 'So Yong Kim', 'Charlie McDowell', 'Tim Mielants', 'Mark Romanek', 'Andrew Stanton', 'Dearbhla Walsh', 'Ti West'], 'Producers': ['Nathaniel Halpern', 'Matt Reeves', 'Rafi Crohn', 'Adam Kassan', 'Mark Romanek', 'Mattias Montero', 'Samantha Taylor Pickett', 'Adam Berg', 'Robert Petrovicz', 'Simon Stalenhag', 'Mark Lafferty', 'Ellen Rutter'], 'Starring': ['Rebecca Hall', 'Paul Schneider', 'Duncan Joiner']}\nReview Text: This show comes precariously close to pointless mystery box territory. But ultimately, it's an entertaining mind f!ck. It will make you think. It will also likely frustrate you. I wanted more story and a bit less 'then this happens.' I'd watch a season 2, but I won't hold my breath for substantial answers. It's almost like if the Twilight Zone pretended to have a plot.\nReview Title: Endlessly Fascinating, but frustrating\nRating: 4.0\n--------------------------------------------------",
  "reference_summary": "The After\nScience Fiction\n['A new Amazon Original Series: From Chris Carter, creator of The X-Files. Eight strangers are thrown together by mysterious forces and must help each other survive in a violent world that defies explanation. More episodes coming soon exclusively on Prime Instant Video.']\n{'Subtitles': ['None available'], 'Directors': ['Chris Carter'], 'Producers': ['Chris Carter', 'Marc Rosen', 'Gabe Rotter'], 'Starring': ['Aldis Hodge', 'Andrew Howard', 'Arielle Kebbel']}\nI really wanted to like this. But this isn't a show so much as a series of somewhat related scenes.<br /><br />A rather attractive woman gets nude after IT happens (whatever IT is)...so if that's your thing, at least there's that. To be clear...the girl skinny dips in front of strangers after IT happens because....ratings?<br /><br />I guess ratings are immaterial here. But it's just a very strange thing to shoe-horn into a show about the end of the world.<br /><br />Anyway, cliches ahoy, matey! I think we pretty much have every modern stereotype covered here, and it's all terribly boring.<br /><br />This show is like The Walking Dead with a much smaller budget, worse actors, a much smaller budget and a terrible script.<br /><br />If you do watch it, consider it a comedy going in and you might enjoy it.\nI really wanted to like this. But this isn't a show so much ...\n{'Content advisory': ['Violence', 'substance use', 'smoking', 'foul language'], 'Subtitles': ['None available'], 'Directors': ['Christian Tureaud', 'David Salzberg'], 'Producers': ['Christian Tureaud', 'David Salzberg', 'Mike Boettcher', 'Carlos Boettcher'], 'Starring': ['Mike Boettcher', 'Carlos Boettcher'], 'Studio': ['Anderson Digital']}\nGreat film, but why was the son allowed to tag along? That seems really weird and irresponsible. It's an extra person that the soldiers have to babysit.\nGreat film, but why was the son allowed to ...\n{'Audio languages': ['English'], 'Subtitles': ['English [CC]'], 'Directors': [\"Thaddeus O'Sullivan\"], 'Producers': ['Julie Payne', 'Ann Wingate', 'Frank Doelger', 'Tracey Scoffield', 'David M. Thompson'], 'Starring': ['Brendan Gleeson', 'Janet McTeer', 'Len Cariou'], 'Studio': ['HBO']}\nI prefer the first actor, but the film is still great!\nA unique view on Churchill as a person\n{'Audio languages': ['English'], 'Subtitles': ['English [CC]'], 'Directors': ['Ellen Goosenberg Kent'], 'Starring': ['Beth Carpenter'], 'Studio': ['Fisher Klingenstein Films']}\nGreat show.<br /><br />The woman's defense attorney is so sleazy, lol. It's really sad.\nGreat show. The woman's defense attorney is so sleazy\n{'Audio languages': ['English'], 'Subtitles': ['English [CC]'], 'Directors': ['Ed Bianchi', 'Daniel Minahan', 'Davis Guggenheim', 'Gregg Fienberg', 'Mark Tinker', 'Steve Shill', 'Alan Taylor', 'Michael Engler', 'Walter Hill', 'Michael Almereyda'], 'Producers': ['David Milch', 'Davis Guggenheim', 'Scott Stephens'], 'Starring': ['Timothy Olyphant', 'Ian McShane', 'Molly Parker'], 'Studio': ['HBO']}\nOne of the most dangerous places on Earth in the 1870s, without a doubt :P. A great show, if you can suspend disbelief just a tad.\nA great show, if you can suspend disbelief just a ...\n{'Audio languages': ['English'], 'Subtitles': ['English [CC]'], 'Directors': ['Ellen Goosenberg Kent'], 'Starring': ['Donna Trapani'], 'Studio': ['Fisher Klingenstein Films']}\nGood episode.<br /><br />The husband is clearly a psychopath too. He is just as responsible for what happened. Putting them in a room together.\nGood Episode\n{'Content advisory': ['Nudity', 'alcohol use', 'smoking', 'sexual content'], 'Audio languages': ['English'], 'Subtitles': ['None available'], 'Directors': ['Parrish Smith'], 'Starring': ['---'], 'Studio': ['Unscripted']}\nGood if you're doing research for fiction or something else. Just want to point that out. Looks like this is getting hate because the producer decided to get a bit...cheeky.\nGood if you're doing research for fiction or something else\n{'Audio languages': ['English'], 'Subtitles': ['English [CC]'], 'Directors': ['Robert Kiviat'], 'Producers': ['Robert Kiviat', 'Antonio Bardales', \"James 'Jim' Courant\", 'Don Ecker', 'Sean Fanton', 'David Kiviat', 'Matthew Kleinman', 'David Rajter', 'Jeff Sagansky', 'Scott Silver'], 'Starring': ['Buzz Aldrin', 'Mike Bara', 'Joshua P. Warren'], 'Studio': ['Gaia']}\nMeh. The woman is trying to explain to them that the &#34;pipe&#34; or &#34;bridge&#34; is just a lava tube or molten rock formation (The moon used to be part of the earth) but they are ignoring her. This is bad documentary film making. They are literally just speaking over her with their own interpretations. Why even bother bringing in an expert to look?\nThis is bad documentary film making\n{'Audio languages': ['English'], 'Subtitles': ['English [CC]'], 'Directors': ['Ellen Goosenberg Kent'], 'Starring': ['Andrea Yates'], 'Studio': ['Fisher Klingenstein Films']}\nTough one. She was acquitted in 2007 by reason of insanity. That should have been the first verdict. She was clearly quite insane Personally, I think the husband is more to blame than she is. He was an enabler. That female prosecutor clearly has no experience with mental illness.\nGood episode, tragic case.\n{'Audio languages': ['English'], 'Subtitles': ['English [CC]'], 'Directors': ['Ellen Goosenberg Kent'], 'Starring': ['David Koresh'], 'Studio': ['Fisher Klingenstein Films']}\nTough one. The government overreacted, but those people were definitely brainwashed, and it was hardly fair to the kids. Good documentary.\nGood documentary.\n{'Content advisory': ['Violence', 'foul language'], 'Audio languages': ['English'], 'Subtitles': ['English [CC]'], 'Directors': ['Charlie Minn'], 'Producers': ['Charlie Minn'], 'Starring': ['Robert Caldwell', 'John Hook'], 'Studio': ['Unscripted']}\nPretty good overview of the case. Worth watching, though I deducted one star for including the 'psychic' toward the end.\nWorth a watch\n{'Subtitles': ['None available'], 'Directors': ['Lyn Goldfarb', 'Margaret Koval'], 'Producers': ['PBS'], 'Studio': ['PBS']}\nTook several points off because they mention Jesus as if he were a historical person when there is no evidence of this being the case.\nTook several points off because they mention Jesus as if ...\n{'Content advisory': ['Nudity', 'violence', 'substance use', 'alcohol use', 'smoking', 'foul language', 'sexual content'], 'Audio languages': ['English'], 'Subtitles': ['English [CC]'], 'Directors': ['Vanessa Caswill', 'China Moo-Young'], 'Producers': ['Hugh Warren', 'Elizabeth Kilgarriff'], 'Starring': ['Jodie Comer', 'Natasha Little', 'Stuart Graham'], 'Studio': ['BBC America']}\nI can give it 4 stars because I got it for free with my Prime membership. It's entertaining, but some things about the way the police interact with her are unrealistic.\nWorth a watch if you have Prime\n{'Audio languages': ['English'], 'Subtitles': ['English [CC]'], 'Directors': ['Annamaria Talas'], 'Producers': ['Annamaria Talas']}\nAmazing. Great graphics. Lots of information conveyed efficiently and simply.<br /><br />I would love to watch Howie Mandel watch this.\nAmazing. Great graphics\n{'Subtitles': ['None available'], 'Directors': ['Neil Johnson'], 'Starring': ['E.J. De la Pena', 'Walter Koenig', 'Chris Judge'], 'Studio': ['Distribber']}\nReally, really bad. The 5 star reviews are clearly from people associated with the production. Family/friends, etc.<br /><br />Don't waste your time. Sad to see Chris Judge and Koenig getting roped into this.\nNot worth a watch\n{'Content advisory': ['Foul language', 'sexual content'], 'Audio languages': ['English'], 'Subtitles': ['English [CC]', 'Deutsch [UT]', 'Espa\u00f1ol (Latinoam\u00e9rica) [CC]', 'Espa\u00f1ol (Espa\u00f1a) [CC]', 'Fran\u00e7ais [CC]', 'Italiano [CC]', 'Portugu\u00eas [SDH]'], 'Directors': ['Frida Barkfors', 'Lasse Barkfors'], 'Producers': ['Frida Barkfors', 'Anders Bruus', 'Anne K\u00f6hncke'], 'Studio': ['Journeyman Pictures']}\nSo yeah, this is depressing. But it's objectively a good documentary. The white dude in the beginning definitely should have done *some* time. That's just blatent negligence. Talk about white privilege. (I'm white).\nGood documentary, but sad\n{'Content advisory': ['Alcohol use', 'foul language'], 'Audio languages': ['English'], 'Subtitles': ['English [CC]'], 'Directors': ['Robert McCallum', 'Jordan C. Morris'], 'Producers': ['Robert McCallum', 'Jordan Christopher Morris', 'Marc Almond', 'Matt Miller', 'Sarah Mulholland', 'Kelly Tessier', 'Rodney Waschka II', 'Tim Wendel'], 'Starring': ['Robert McCallum', 'Chris Byford'], 'Studio': ['Pyre Productions']}\nI enjoyed it fine while watching it, but looking at the reviews afterward I have to agree with the points made in the 1 star reviews. The mom wasn't 'missing.' She walked out on her two kids and chose to not make contact again. She was found in a few days and wasn't living far from her parents. She wasn't abducted or anything like that as the title would imply.<br /><br />There is little to no mystery here. It's a feel-good documentary, but it has very little substance.<br /><br />I seriously wonder what awards this could have won.\nNot recommended\n{'Content advisory': ['Nudity', 'violence', 'alcohol use', 'foul language', 'sexual content'], 'Audio languages': ['English Dialogue Boost: High', 'English', 'English [Audio Description]', 'English Dialogue Boost: Medium', 'English Dialogue Boost: Low', '\u0c95\u0ca8\u0ccd\u0ca8\u0ca1', 'Italiano', 'Deutsch', '\u0ba4\u0bae\u0bbf\u0bb4\u0bcd', '\u05e2\u05d1\u05e8\u05d9\u05ea', 'Indonesia', 'Portugu\u00eas (Portugal)', 'Ti\u1ebfng Vi\u1ec7t', 'Espa\u00f1ol (Latinoam\u00e9rica)', '\u0395\u03bb\u03bb\u03b7\u03bd\u03b9\u03ba\u03ac', '\u0c24\u0c46\u0c32\u0c41\u0c17\u0c41', 'Fran\u00e7ais (France)', 'Bahasa Melayu', 'Fran\u00e7ais (Canada)', 'Filipino', '\u65e5\u672c\u8a9e', 'Portugu\u00eas (Brasil)', 'Nederlands', '\u0d2e\u0d32\u0d2f\u0d3e\u0d33\u0d02', 'Espa\u00f1ol (Espa\u00f1a)', '\u0939\u093f\u0928\u094d\u0926\u0940', '\u0627\u0644\u0639\u0631\u0628\u064a\u0629', 'Polski', '\u010ce\u0161tina', 'Magyar', 'T\u00fcrk\u00e7e', '\u0e44\u0e17\u0e22', 'Catal\u00e0', 'Rom\u00e2n\u0103', '\u0423\u043a\u0440\u0430\u0457\u043d\u0441\u044c\u043a\u0430'], 'Subtitles': ['English [CC]', '\u0627\u0644\u0639\u0631\u0628\u064a\u0629', 'Catal\u00e0', '\u010ce\u0161tina', 'Dansk', 'Deutsch', '\u0395\u03bb\u03bb\u03b7\u03bd\u03b9\u03ba\u03ac', 'Espa\u00f1ol (Latinoam\u00e9rica)', 'Espa\u00f1ol (Espa\u00f1a)', 'Euskara', 'Suomi', 'Filipino', 'Fran\u00e7ais (Canada)', 'Fran\u00e7ais (France)', 'Galego', '\u05e2\u05d1\u05e8\u05d9\u05ea', '\u0939\u093f\u0928\u094d\u0926\u0940', 'Magyar', 'Indonesia', 'Italiano', '\u65e5\u672c\u8a9e', '\u0c95\u0ca8\u0ccd\u0ca8\u0ca1', '\ud55c\uad6d\uc5b4', '\u0d2e\u0d32\u0d2f\u0d3e\u0d33\u0d02', 'Bahasa Melayu', 'Norsk Bokm\u00e5l', 'Nederlands', 'Polski', 'Portugu\u00eas (Brasil)', 'Portugu\u00eas (Portugal)', 'Rom\u00e2n\u0103', '\u0420\u0443\u0441\u0441\u043a\u0438\u0439', 'Svenska', '\u0ba4\u0bae\u0bbf\u0bb4\u0bcd', '\u0c24\u0c46\u0c32\u0c41\u0c17\u0c41', '\u0e44\u0e17\u0e22', 'Tl', 'T\u00fcrk\u00e7e', '\u0423\u043a\u0440\u0430\u0457\u043d\u0441\u044c\u043a\u0430', 'Ti\u1ebfng Vi\u1ec7t', '\u4e2d\u6587\uff08\u7b80\u4f53\uff09', '\u4e2d\u6587\uff08\u7e41\u9ad4\uff09'], 'Directors': ['Lukas Ettlin', 'Jann Turner', 'Shana Stein'], 'Producers': ['Carlton Cuse', 'Graham Roland', 'Daniel Sackheim', 'Morten Tyldum', 'Michael Bay', 'Brad Fuller', 'Andrew Form', 'John Krasinski', 'Tom Clancy', 'David Ellison', 'Dana Goldberg', 'Marcy Ross', 'Mace Neufeld', 'Lindsey Springer', 'Allyson Seeger', 'Patrick Aison', 'Annie Jacobsen', 'Nazrin Choudhury', 'Jose Luis Escolar', 'Robert Phillips', \"Ra'uf Glasgow\", 'Kiegan Downs'], 'Starring': ['Wendell Pierce', 'John Krasinski', 'Abbie Cornish'], 'Studio': ['Amazon Studios']}\nI was kind of leery about John Krasinski in an action role, but he's really good. The show itself has surprising depth and is well-written.\nSuprising Depth\n{'Content advisory': ['Nudity', 'violence', 'substance use', 'alcohol use', 'smoking', 'foul language', 'sexual content'], 'Audio languages': ['English Dialogue Boost: Low', 'English Dialogue Boost: Medium', 'English', 'English Dialogue Boost: High', 'English [Audio Description]', '\u0c95\u0ca8\u0ccd\u0ca8\u0ca1', 'Italiano', 'Deutsch', '\u0ba4\u0bae\u0bbf\u0bb4\u0bcd', '\u05e2\u05d1\u05e8\u05d9\u05ea', 'Indonesia', 'Portugu\u00eas (Portugal)', 'Ti\u1ebfng Vi\u1ec7t', 'Espa\u00f1ol (Latinoam\u00e9rica)', '\u0395\u03bb\u03bb\u03b7\u03bd\u03b9\u03ba\u03ac', '\u0c24\u0c46\u0c32\u0c41\u0c17\u0c41', 'Fran\u00e7ais (France)', 'Bahasa Melayu', 'Fran\u00e7ais (Canada)', 'Filipino', '\u65e5\u672c\u8a9e', 'Portugu\u00eas (Brasil)', 'Nederlands', '\u0d2e\u0d32\u0d2f\u0d3e\u0d33\u0d02', 'Espa\u00f1ol (Espa\u00f1a)', '\u0939\u093f\u0928\u094d\u0926\u0940', 'Polski', '\u010ce\u0161tina', 'Magyar', 'T\u00fcrk\u00e7e', '\u0e44\u0e17\u0e22', 'Rom\u00e2n\u0103'], 'Subtitles': ['English [CC]', '\u0627\u0644\u0639\u0631\u0628\u064a\u0629 (\u0627\u0644\u0639\u0627\u0644\u0645)', '\u0627\u0644\u0639\u0631\u0628\u064a\u0629 (\u0645\u0635\u0631)', 'Catal\u00e0', '\u010ce\u0161tina', 'Dansk', 'Deutsch', '\u0395\u03bb\u03bb\u03b7\u03bd\u03b9\u03ba\u03ac', 'Espa\u00f1ol (Latinoam\u00e9rica)', 'Espa\u00f1ol (Espa\u00f1a)', 'Euskara', 'Suomi', 'Filipino', 'Fran\u00e7ais (Canada)', 'Fran\u00e7ais (France)', 'Galego', '\u05e2\u05d1\u05e8\u05d9\u05ea', '\u0939\u093f\u0928\u094d\u0926\u0940', 'Magyar', 'Indonesia', 'Italiano', '\u65e5\u672c\u8a9e', '\u0c95\u0ca8\u0ccd\u0ca8\u0ca1', '\ud55c\uad6d\uc5b4', '\u0d2e\u0d32\u0d2f\u0d3e\u0d33\u0d02', 'Bahasa Melayu', 'Norsk Bokm\u00e5l', 'Nederlands', 'Polski', 'Portugu\u00eas (Brasil)', 'Portugu\u00eas (Portugal)', 'Rom\u00e2n\u0103', '\u0420\u0443\u0441\u0441\u043a\u0438\u0439', 'Svenska', '\u0ba4\u0bae\u0bbf\u0bb4\u0bcd', '\u0c24\u0c46\u0c32\u0c41\u0c17\u0c41', '\u0e44\u0e17\u0e22', 'T\u00fcrk\u00e7e', '\u0423\u043a\u0440\u0430\u0457\u043d\u0441\u044c\u043a\u0430', 'Ti\u1ebfng Vi\u1ec7t', '\u4e2d\u6587\uff08\u7b80\u4f53\uff09', '\u4e2d\u6587\uff08\u7e41\u9ad4\uff09'], 'Directors': ['Douglas Mackinnon'], 'Producers': ['Rob Wilkins', 'Chris Sussman'], 'Starring': ['Michael Sheen', 'David Tennant', 'Jon Hamm'], 'Studio': ['Amazon Studios']}\nI would give 3.5 stars if that was an option.<br /><br />It's a good watch if you have a sense of humor and some imagination. But I'm taking a point off for the Adam sub plot. The kids are well cast, but the acting is meh and the dialogue is very cringe.<br /><br />I'm taking a further half point off for the overall quality. It's...quite uneven. Overall, it's okay. But the there is a lot of deus ex machina, and sometimes nothing makes any sense. Things just kind of happen. Then the narrator comes in and explains it...as if that's good story telling. \"Now this happened, so just accept it and move on.\" This is typical of Mr. Gaiman's stories, but it works better on the page. On TV, it just makes you say, \"Wait...what?\"<br /><br />Finally, the gender swapping (from Biblical texts) gets to be a tad on the nose. 1 or 2 changes is innovative...by 4 and 5, they're just trying to trigger the anti-SJWs. It's obnoxious. I'm not Christian and don't care at all about that part of it...but it is kind of obvious that they are trying to piss a certain demographic off. Just stop.\nImaginative but Uneven\n{'Content advisory': ['Nudity', 'violence', 'frightening scenes', 'alcohol use', 'smoking', 'foul language', 'sexual content'], 'Audio languages': ['English', 'English [Audio Description]', 'Espa\u00f1ol (Espa\u00f1a)', 'Italiano', 'Espa\u00f1ol (Latinoam\u00e9rica)', '\u65e5\u672c\u8a9e', 'Portugu\u00eas', 'Deutsch', 'Fran\u00e7ais'], 'Subtitles': ['English [CC]', '\u0627\u0644\u0639\u0631\u0628\u064a\u0629', '\u010ce\u0161tina', 'Dansk', 'Deutsch', '\u0395\u03bb\u03bb\u03b7\u03bd\u03b9\u03ba\u03ac', 'Espa\u00f1ol (Latinoam\u00e9rica)', 'Espa\u00f1ol (Espa\u00f1a)', 'Suomi', 'Filipino', 'Fran\u00e7ais', '\u05e2\u05d1\u05e8\u05d9\u05ea', '\u0939\u093f\u0928\u094d\u0926\u0940', 'Magyar', 'Indonesia', 'Italiano', '\u65e5\u672c\u8a9e', '\ud55c\uad6d\uc5b4', 'Bahasa Melayu', 'Norsk Bokm\u00e5l', 'Nederlands', 'Polski', 'Portugu\u00eas (Brasil)', 'Portugu\u00eas (Portugal)', 'Rom\u00e2n\u0103', '\u0420\u0443\u0441\u0441\u043a\u0438\u0439', 'Svenska', '\u0ba4\u0bae\u0bbf\u0bb4\u0bcd', '\u0c24\u0c46\u0c32\u0c41\u0c17\u0c41', '\u0e44\u0e17\u0e22', 'T\u00fcrk\u00e7e', '\u4e2d\u6587\uff08\u7b80\u4f53\uff09', '\u4e2d\u6587\uff08\u7e41\u9ad4\uff09'], 'Directors': ['Jodie Foster', 'So Yong Kim', 'Charlie McDowell', 'Tim Mielants', 'Mark Romanek', 'Andrew Stanton', 'Dearbhla Walsh', 'Ti West'], 'Producers': ['Nathaniel Halpern', 'Matt Reeves', 'Rafi Crohn', 'Adam Kassan', 'Mark Romanek', 'Mattias Montero', 'Samantha Taylor Pickett', 'Adam Berg', 'Robert Petrovicz', 'Simon Stalenhag', 'Mark Lafferty', 'Ellen Rutter'], 'Starring': ['Rebecca Hall', 'Paul Schneider', 'Duncan Joiner']}\nThis show comes precariously close to pointless mystery box territory. But ultimately, it's an entertaining mind f!ck. It will make you think. It will also likely frustrate you. I wanted more story and a bit less 'then this happens.' I'd watch a season 2, but I won't hold my breath for substantial answers. It's almost like if the Twilight Zone pretended to have a plot.\nEndlessly Fascinating, but frustrating",
  "actual_interaction": {
    "rating": 4.0,
    "title": "Endlessly Fascinating, but frustrating",
    "text": "This show comes precariously close to pointless mystery box territory. But ultimately, it's an entertaining mind f!ck. It will make you think. It will also likely frustrate you. I wanted more story and a bit less 'then this happens.' I'd watch a season 2, but I won't hold my breath for substantial answers. It's almost like if the Twilight Zone pretended to have a plot.",
    "images": [],
    "asin": "B084NSNCK6",
    "parent_asin": "B084NSNCK6",
    "user_id": "AE4SWXQVBC3AHLCKMAADWNPP6M3A",
    "timestamp": "2020-05-16 02:53:15.870000",
    "helpful_vote": 0,
    "verified_purchase": false,
    "main_category": "Prime Video",
    "title_meta": null,
    "average_rating": 4.1,
    "rating_number": 3895,
    "features": null,
    "description": null,
    "price": null,
    "images_meta": [
      {
        "360w": "https://images-na.ssl-images-amazon.com/images/S/pv-target-images/9484868b04e29f923801bd6f7a33070c32ff7ca8dacfb0cb60bd26303868b5d1._RI_SX360_FMwebp_.jpg",
        "480w": "https://images-na.ssl-images-amazon.com/images/S/pv-target-images/9484868b04e29f923801bd6f7a33070c32ff7ca8dacfb0cb60bd26303868b5d1._RI_SX480_FMwebp_.jpg",
        "720w": "https://images-na.ssl-images-amazon.com/images/S/pv-target-images/9484868b04e29f923801bd6f7a33070c32ff7ca8dacfb0cb60bd26303868b5d1._RI_SX720_FMwebp_.jpg",
        "1080w": "https://images-na.ssl-images-amazon.com/images/S/pv-target-images/9484868b04e29f923801bd6f7a33070c32ff7ca8dacfb0cb60bd26303868b5d1._RI_SX1080_FMwebp_.jpg",
        "1440w": "https://images-na.ssl-images-amazon.com/images/S/pv-target-images/9484868b04e29f923801bd6f7a33070c32ff7ca8dacfb0cb60bd26303868b5d1._RI_SX1440_FMwebp_.jpg",
        "1920w": "https://images-na.ssl-images-amazon.com/images/S/pv-target-images/9484868b04e29f923801bd6f7a33070c32ff7ca8dacfb0cb60bd26303868b5d1._RI_SX1920_FMwebp_.jpg",
        "variant": "MAIN"
      }
    ],
    "videos": [],
    "store": null,
    "categories": null,
    "details": {
      "Content advisory": [
        "Nudity",
        "violence",
        "frightening scenes",
        "alcohol use",
        "smoking",
        "foul language",
        "sexual content"
      ],
      "Audio languages": [
        "English",
        "English [Audio Description]",
        "Espa\u00f1ol (Espa\u00f1a)",
        "Italiano",
        "Espa\u00f1ol (Latinoam\u00e9rica)",
        "\u65e5\u672c\u8a9e",
        "Portugu\u00eas",
        "Deutsch",
        "Fran\u00e7ais"
      ],
      "Subtitles": [
        "English [CC]",
        "\u0627\u0644\u0639\u0631\u0628\u064a\u0629",
        "\u010ce\u0161tina",
        "Dansk",
        "Deutsch",
        "\u0395\u03bb\u03bb\u03b7\u03bd\u03b9\u03ba\u03ac",
        "Espa\u00f1ol (Latinoam\u00e9rica)",
        "Espa\u00f1ol (Espa\u00f1a)",
        "Suomi",
        "Filipino",
        "Fran\u00e7ais",
        "\u05e2\u05d1\u05e8\u05d9\u05ea",
        "\u0939\u093f\u0928\u094d\u0926\u0940",
        "Magyar",
        "Indonesia",
        "Italiano",
        "\u65e5\u672c\u8a9e",
        "\ud55c\uad6d\uc5b4",
        "Bahasa Melayu",
        "Norsk Bokm\u00e5l",
        "Nederlands",
        "Polski",
        "Portugu\u00eas (Brasil)",
        "Portugu\u00eas (Portugal)",
        "Rom\u00e2n\u0103",
        "\u0420\u0443\u0441\u0441\u043a\u0438\u0439",
        "Svenska",
        "\u0ba4\u0bae\u0bbf\u0bb4\u0bcd",
        "\u0c24\u0c46\u0c32\u0c41\u0c17\u0c41",
        "\u0e44\u0e17\u0e22",
        "T\u00fcrk\u00e7e",
        "\u4e2d\u6587\uff08\u7b80\u4f53\uff09",
        "\u4e2d\u6587\uff08\u7e41\u9ad4\uff09"
      ],
      "Directors": [
        "Jodie Foster",
        "So Yong Kim",
        "Charlie McDowell",
        "Tim Mielants",
        "Mark Romanek",
        "Andrew Stanton",
        "Dearbhla Walsh",
        "Ti West"
      ],
      "Producers": [
        "Nathaniel Halpern",
        "Matt Reeves",
        "Rafi Crohn",
        "Adam Kassan",
        "Mark Romanek",
        "Mattias Montero",
        "Samantha Taylor Pickett",
        "Adam Berg",
        "Robert Petrovicz",
        "Simon Stalenhag",
        "Mark Lafferty",
        "Ellen Rutter"
      ],
      "Starring": [
        "Rebecca Hall",
        "Paul Schneider",
        "Duncan Joiner"
      ]
    },
    "bought_together": null,
    "subtitle": null,
    "author": NaN
  }
}