{
  "interaction_number": 11,
  "interaction_summary": "=== Purchase Information ===\nReview Date: 2022/08/09\nAverage Rating: 4.1\nProduct Details: {'Audio languages': ['English Dialogue Boost: High', 'English', 'English Dialogue Boost: Medium', 'Espa\u00f1ol'], 'Subtitles': ['English [CC]', 'Espa\u00f1ol [CC]'], 'Directors': ['Brian Cates'], 'Producers': ['Darren Moorman p.g.a.', 'Trey Reynolds p.g.a.', 'Justin Tolley', 'Jay Howver'], 'Starring': ['Tommy Woodard', 'Eddie James', 'Leigh-Allyn Baker'], 'Studio': ['Lionsgate']}\nReview Text: super funny and many lessons learn\nReview Title: hilarious!\nRating: 5.0\n--------------------------------------------------",
  "reference_summary": "Way We Were, The\nDrama, Passionate, Sad, Sentimental\n['Set during the politically charged time of pre-WWII McCarthyism, a young couple with diametrically opposing views of politics, friendships and careers find it difficult to balance their private love and desires with their very public lives.']\n{'Content advisory': ['Nudity', 'violence', 'alcohol use', 'smoking', 'foul language', 'sexual content'], 'Audio languages': ['English'], 'Subtitles': ['English [CC]'], 'Directors': ['Pollack', 'Sydney'], 'Producers': ['Ray Stark'], 'Starring': ['Barbra Streisand', 'Robert Redford', 'Bradford Dillman']}\nMost movies have happy endings. The ending is not horible but its not a good one. I wish the main character would had fought for his wife, specialy because it is because of her that he got to the top! Never even notice him being depress or ask for a second opportunity or do anything to save the marriage. It broke my heart!\nUpset! No happy ending to an amazong movie!\n{'Audio languages': ['English'], 'Subtitles': ['English [CC]'], 'Directors': ['Radha Bharadwaj'], 'Producers': ['Radha Bharadwaj', 'Gregory Cascante', 'Mike Cline', 'Christian Slater'], 'Starring': ['Jared Leto', 'Christian Slater', 'Claire Forlani'], 'Studio': ['Multicom Entertainment Group (MEG)']}\nThe only reason why i gave this movie a 4 n not a  5 star is because basil didnt mary clara at the end.\nAmazing movie.\nThe Song\nDrama, Romance, Inspiring, Mystical\n['An aspiring singer-songwriter is struggling to catch a break and escape the long shadow of his famous father until he writes a love song that catapults him to stardom.']\n{'Audio languages': ['English', 'English [Audio Description]'], 'Subtitles': ['English [CC]'], 'Directors': ['Richard Ramsey'], 'Producers': ['Shane Sooter', 'Cassandra Pelan'], 'Starring': ['Ali Faulkner', 'Alan Powell', 'Caitlin Nicol-Thomas']}\nI love the lessons this movie teaches! Most humans are just worried about providing, they forget to protect the most important things Love (God) and family!!!!!!\nSooo worth it!\n{'Audio languages': ['English'], 'Subtitles': ['English [CC]'], 'Directors': ['John Korty'], 'Producers': ['David V. Picker'], 'Starring': [\"Ryan O'Neal\", 'Candice Bergen', 'Nicola Pagett'], 'Studio': ['Paramount']}\nNot enough plot. Is nice to see that oliver at the end realise that he needs to live a living life againg, but theres not a true happy ending of maybe him remarrying n living happely ever after.\nIts ok\n{'Audio languages': ['English', 'English [Audio Description]'], 'Subtitles': ['English [CC]'], 'Directors': ['Sam Mendes'], 'Producers': ['Sam Mendes', 'Gina Amoroso', 'Bobby Cohen', 'Henry Fernaine', 'Pippa Harris', 'John Hart', 'Peter Kalmbach', 'Marion Rosenberg', 'Ann Ruark', 'Scott Rudin'], 'Starring': ['Leonardo DiCaprio', 'Kate Winslet', 'Michael Shannon'], 'Studio': ['Paramount Pictures Corp.']}\nThe plot was not big neither interesting, no surprises to make this movie exited.\nNot my cup of tea!\n{'Audio languages': ['English'], 'Subtitles': ['English [CC]'], 'Directors': ['Bryan Carzan'], 'Producers': ['Bryan Carzan', 'Anthony Straga'], 'Starring': ['Brad Johnson', 'Shona Kay'], 'Studio': ['SunWorld Pictures']}\nAwwww\nNice clean\nJust a Little Chemistry\nComedy, Arthouse, Romance, International\n['Nineteen year old Oli falls for her TV idol and embarks on a Cinderella-like romance filled with luxury, fame, success and money. It seems she has found her fairy tale ending, until she learns good chemistry and true love are not one and the same.']\n{'Content advisory': ['Violence', 'alcohol use', 'smoking', 'foul language', 'sexual content'], 'Audio languages': ['Espa\u00f1ol'], 'Subtitles': ['English [CC]'], 'Directors': ['Alfonso Albacete'], 'Producers': ['Mar Targarona', 'Joaquin Padro'], 'Starring': ['Ana Fernandez', 'Alejo Sauras', 'Rodrigo Guirao']}\nyou just have to see it\nFive Stars\nUnbroken: Path to Redemption\nDrama, Compelling, Emotional, Tense\n[\"Beginning where the hit movie Unbroken concludes, the next chapter brings the rest of Louis Zamperini's inspirational true story to life.\"]\n{'Audio languages': ['English', 'English [Audio Description]'], 'Subtitles': ['English [CC]'], 'Directors': ['Harold Cronk'], 'Producers': ['Matthew Baer', 'Mike Elliott'], 'Starring': ['Samuel Hunt', 'Merritt Patterson', 'Vincenzo Amato']}\nThis movie is amazing! Dude to diferent kind of child hood abuses  n having a big trigger as an adult I also had ptsd! Once I started to hear preachers on how important it is to be fill with Gods spirit, and to renew my mind my focusing on him not on my pain , so i started to focus on  Jesus and Jesus heal me! I used to go all around college crying.  Many people use to stop me and ask me what was wrong. I used to lied and said I had a bad case of sinuses! NOw i go around college, telling people my testimony and a healing Christian program call celebrate recovery!  this is a must watch story!\nWOW!\n{'Audio languages': ['English'], 'Subtitles': ['English [CC]'], 'Directors': ['Tim Hill'], 'Producers': ['Marvin Peart', 'Rosa Morris Peart', 'Phillip Glasser'], 'Starring': ['Robert De Niro', 'Uma Thurman', 'Rob Riggle'], 'Studio': ['101 Films', 'LLC']}\nUnless is for free don't paid to rent it.\nBoring , doesn't have an exiting plot! Waste of money\n{'Content advisory': ['Violence', 'substance use', 'alcohol use', 'smoking', 'foul language', 'sexual content'], 'Audio languages': ['English'], 'Subtitles': ['English [CC]'], 'Directors': ['Joe Wright'], 'Producers': ['Tim Bevan', 'Eric Fellner', 'Paul Webster'], 'Starring': ['Saoirse Ronan', 'Ailidh Mackay', 'Brenda Blethyn']}\naccording to psychology the main reason why people like to watch movies is because they like to feel the happy ending to a horible ploblem which most movies have but not this one. It leave u with an ugly feeling\ndisapointed.\n{'Audio languages': ['English Dialogue Boost: High', 'English', 'English Dialogue Boost: Medium', 'Espa\u00f1ol'], 'Subtitles': ['English [CC]', 'Espa\u00f1ol [CC]'], 'Directors': ['Brian Cates'], 'Producers': ['Darren Moorman p.g.a.', 'Trey Reynolds p.g.a.', 'Justin Tolley', 'Jay Howver'], 'Starring': ['Tommy Woodard', 'Eddie James', 'Leigh-Allyn Baker'], 'Studio': ['Lionsgate']}\nsuper funny and many lessons learn\nhilarious!",
  "actual_interaction": {
    "rating": 5.0,
    "title": "hilarious!",
    "text": "super funny and many lessons learn",
    "images": [],
    "asin": "B09V2N5S93",
    "parent_asin": "B09V2N5S93",
    "user_id": "AG2LZSJSXLJYLU4OCMPN3DZG3T5Q",
    "timestamp": "2022-08-09 19:02:12.256000",
    "helpful_vote": 0,
    "verified_purchase": true,
    "main_category": "Prime Video",
    "title_meta": null,
    "average_rating": 4.1,
    "rating_number": 2925,
    "features": null,
    "description": null,
    "price": null,
    "images_meta": [
      {
        "360w": "https://images-na.ssl-images-amazon.com/images/S/pv-target-images/667e5234dc073fbeb1539ab05c70c6ba9443c22d2ed856a9174f5808d8e54c1c._RI_TTW_SX360_FMwebp_.jpg",
        "480w": "https://images-na.ssl-images-amazon.com/images/S/pv-target-images/667e5234dc073fbeb1539ab05c70c6ba9443c22d2ed856a9174f5808d8e54c1c._RI_TTW_SX480_FMwebp_.jpg",
        "720w": "https://images-na.ssl-images-amazon.com/images/S/pv-target-images/667e5234dc073fbeb1539ab05c70c6ba9443c22d2ed856a9174f5808d8e54c1c._RI_TTW_SX720_FMwebp_.jpg",
        "1080w": "https://images-na.ssl-images-amazon.com/images/S/pv-target-images/667e5234dc073fbeb1539ab05c70c6ba9443c22d2ed856a9174f5808d8e54c1c._RI_TTW_SX1080_FMwebp_.jpg",
        "1440w": "https://images-na.ssl-images-amazon.com/images/S/pv-target-images/667e5234dc073fbeb1539ab05c70c6ba9443c22d2ed856a9174f5808d8e54c1c._RI_TTW_SX1440_FMwebp_.jpg",
        "1920w": "https://images-na.ssl-images-amazon.com/images/S/pv-target-images/667e5234dc073fbeb1539ab05c70c6ba9443c22d2ed856a9174f5808d8e54c1c._RI_TTW_SX1920_FMwebp_.jpg",
        "variant": "MAIN"
      }
    ],
    "videos": [],
    "store": null,
    "categories": null,
    "details": {
      "Audio languages": [
        "English Dialogue Boost: High",
        "English",
        "English Dialogue Boost: Medium",
        "Espa\u00f1ol"
      ],
      "Subtitles": [
        "English [CC]",
        "Espa\u00f1ol [CC]"
      ],
      "Directors": [
        "Brian Cates"
      ],
      "Producers": [
        "Darren Moorman p.g.a.",
        "Trey Reynolds p.g.a.",
        "Justin Tolley",
        "Jay Howver"
      ],
      "Starring": [
        "Tommy Woodard",
        "Eddie James",
        "Leigh-Allyn Baker"
      ],
      "Studio": [
        "Lionsgate"
      ]
    },
    "bought_together": null,
    "subtitle": null,
    "author": NaN
  }
}