{
  "interaction_number": 13,
  "interaction_summary": "=== Purchase Information ===\nReview Date: 2019/02/04\nAverage Rating: 3.4\nProduct Details: {'Content advisory': ['Violence', 'alcohol use', 'smoking', 'foul language', 'sexual content'], 'Audio languages': ['English', 'English [Audio Description]', 'English Dialogue Boost: High', 'English Dialogue Boost: Medium'], 'Subtitles': ['English [CC]'], 'Directors': ['Alex Gabassi'], 'Producers': ['Mammoth Screen LTD', 'Agatha Christie Productions LTD', 'Farah Abushwesha'], 'Starring': ['John Malkovich', 'Rupert Grint', 'Andrew Buchan']}\nReview Text: I was excitedly awaiting this series but, alas, was very disappointed.  We have watched 2 episodes and don't know if we'll even finish the third.<br />If you're going to re-created Poirot after David Suchet has represented him to the pinnacle of the character, at least choose someone who can at least do the character justice.  Malkovich is a very sad and not even brilliant Poirot who can't even get the accent down.  I even noticed a few French words (I know Poirot is Belgian) that were not pronounced correctly.<br />A poor series, sadly.\nReview Title: Poor Poirot Representation\nRating: 1.0\n--------------------------------------------------",
  "reference_summary": "American Hustle\nDrama, Strange, Fun, Serious\n['From the director of Silver Linings Playbook and The Fighter, AMERICAN HUSTLE is outrageously entertaining and one of the most acclaimed films of the year.']\n{'Audio languages': ['English', 'English [Audio Description]'], 'Subtitles': ['English [CC]'], 'Directors': ['David Russell'], 'Producers': ['Charles Roven', 'Richard Suckle', 'Megan Ellison', 'Jonathan Gordon'], 'Starring': ['Christian Bale', 'Bradley Cooper', 'Amy Adams']}\nI didn't like it.....it was a great story and could have  been intense and exciting.  Instead, it was hokey.  Just not my cup of tea.\nHokey\n{'Audio languages': ['English'], 'Subtitles': ['English'], 'Directors': ['Stephen Gyllenhaal', 'Billy Gierhart', 'Ray McKinnon', 'Nicole Kassell', 'Jim McKay', 'Scott Teems', 'Keith Gordon', 'Romeo Tirone', 'Andrew Bernstein', 'Dennie Gordon'], 'Producers': ['Mark Johnson', 'Melissa Bernstein', 'Ray McKinnon'], 'Studio': ['Sundance', 'AMC Plus Drama']}\nOne of the most compelling dramas I've ever seen on tv.  The study of a man who has been in prison for 20 yrs. and then tries to readjust to &#34;normalcy&#34; outside the confines of the prison, is in-depth, smart, and compelling - sorry for the use of that adjective again.\nsmart, and compelling - sorry for the use of ...\n{'Content advisory': ['Nudity', 'violence', 'substance use', 'alcohol use', 'smoking', 'foul language', 'sexual content'], 'Audio languages': ['English Dialogue Boost: High', 'English', 'English [Audio Description]', 'English Dialogue Boost: Medium', 'Espa\u00f1ol', 'Deutsch'], 'Subtitles': ['English [CC]', 'Deutsch', 'Espa\u00f1ol'], 'Directors': ['Alex Zakrzewski', 'Ernest R. Dickerson', 'Patrick Cady', 'Aaron Lipstadt', 'Kevin Dowling', 'Adam Davidson', 'Daisy von Scherler Mayer', 'Tim Hunter', 'Christine Moore', 'Zetna Fuentes'], 'Producers': ['Eric Overmyer', 'Michael Connelly', 'Henrik Bastin', 'Pieter Jan Brugge'], 'Starring': ['\u30bf\u30a4\u30bf\u30b9\u30fb\u30a6\u30a7\u30ea\u30d0\u30fc', '\u30b8\u30a7\u30a4\u30df\u30fc\u30fb\u3078\u30af\u30bf\u30fc', '\u30a8\u30a4\u30df\u30fc\u30fb\u30a2\u30ad\u30ce'], 'Studio': ['Amazon Studios']}\nLike the character, the writing, the story.....really fun.\nFour Stars\nI AM\nTom Shadyac  (Actor, Director),     Thom Hartmann  (Actor)    Rated:    Unrated    Format: DVD\nMovies & TV, Genre for Featured Categories, Documentary\n['Product Description', 'I AM is the story of a successful Hollywood director, Tom Shadyac (LIAR LIAR, NUTTY PROFESSOR, BRUCE ALMIGHTY), who experienced a life threatening head injury, and his ensuing journey to try and answer two very basic questions:  What s wrong with our world? and What can we do about it? With a film crew of four, Tom visits some of today s great minds, including authors, poets, teachers, religious leaders, and scientists (Howard Zinn, Lynn McTaggart, Desmond Tutu, Thom Harmann, Coleman Barks) searching for the fundamental endemic problem that causes all of the other problems, while simultaneously reflecting on this own life choices of excess, greed and eventual healing. We started by asking what s wrong wit the world, and ended up discovering what s right with it. Tom Shadyac', 'Review', \"'Amazing...' --Ellen DegeneresEveryone needs to see this film! --Bruce Cohen, Academy Award Winning Producer (American Beauty)Entertaining and enlightening. The I AM Documentary is a spark of light and a work of love. --Marianne Williamson, New York Times Best Seller\"]\n{'Format': 'Multiple Formats, Color, NTSC, Widescreen', 'Contributor': 'Thom Hartmann, Tom Shadyac', 'Language': 'English', 'Runtime': '1 hour and 18 minutes', 'Is Discontinued By Manufacturer': 'No', 'MPAA rating': 'Unrated (Not Rated)', 'Product Dimensions': '0.7 x 7.5 x 5.4 inches; 2.72 Ounces', 'Item model number': '05-58876', 'Director': 'Tom Shadyac', 'Media Format': 'Multiple Formats, Color, NTSC, Widescreen', 'Run time': '1 hour and 18 minutes', 'Release date': 'February 7, 2012', 'Actors': 'Tom Shadyac, Thom Hartmann', 'Studio': 'Gaiam - Entertainment', 'Number of discs': '1'}\nI really like this although you can argue some of what is presented.  The message is positive and uplifting,  Can you ask more?\nI really like this although you can argue some of what is ...\n{'Content advisory': ['Nudity', 'violence', 'alcohol use', 'smoking', 'foul language', 'sexual content'], 'Audio languages': ['English'], 'Subtitles': ['English [CC]'], 'Starring': ['Paul Giamatti', 'Laura Linney', 'Stephen Dilane'], 'Studio': ['HBO']}\nWell done. Good script and the actors bring our history to life.  Pleased.\nGood script and the actors bring our history to life\n{'Content advisory': ['Violence', 'alcohol use', 'foul language', 'sexual content'], 'Audio languages': ['English', 'English [Audio Description]'], 'Subtitles': ['English [CC]'], 'Directors': ['Ciaran Donnelly', 'Ken Girotti'], 'Producers': ['Michael Hirst', \"Morgan O'Sullivan\", 'John Weber', 'James Flynn', 'Sherry Marsh', 'Alan Gasmer', 'Shelia Hockin', 'Steve Wakefield', 'Keith Thompson'], 'Starring': ['Travis Fimmel', 'Katheryn Winnick', 'Gabriel Byrne']}\nEnjoyed each season and looking forward to the 5th!\nFive Stars\n{'Audio languages': ['English'], 'Subtitles': ['English [CC]'], 'Directors': ['Rodrigo Garc\u00eda', 'Jeremy Podeswa', 'Jack Bender', 'Tim Hunter', 'John Patterson', 'Scott Winant', 'Alison Maclean', 'Peter Medak', 'Todd Field', 'Tucker Gates'], 'Producers': ['Ronald D. Moore', 'Howard Klein', 'Daniel Knauf', 'Kelly McCarthy', 'Scott Winant', 'Anthony Santa Croce'], 'Starring': ['Nick Stahl', 'Clancy Brown', 'Amy Madigan'], 'Studio': ['HBO']}\nQuirky but innovative.  The classic struggle of good vs. evil but done in an unique way.  Great job!\nThe classic struggle of good vs. evil but done in an unique way\n{'Content advisory': ['Violence', 'alcohol use', 'foul language', 'sexual content'], 'Audio languages': ['English', 'English [Audio Description]'], 'Subtitles': ['English [CC]'], 'Directors': ['Ciaran Donnelly', 'Ken Girotti', 'Steve Saint Leger', 'Jeff Woolnough', 'Helen Shaver', 'Daniel Grou', 'David Frazee', 'Joshua Zimmerman', 'David Wellington', 'Johan Renck'], 'Starring': ['Travis Fimmel', 'Katheryn Winnick', 'Clive Standen']}\nI thoroughly enjoyed the each season!  What an epic!\nFive Stars\n{'Audio languages': ['English'], 'Subtitles': ['English [CC]'], 'Directors': ['Rodrigo Garc\u00eda', 'Jeremy Podeswa', 'Jack Bender', 'Tim Hunter', 'John Patterson', 'Scott Winant', 'Alison Maclean', 'Peter Medak', 'Todd Field', 'Tucker Gates'], 'Producers': ['Howard Klein', 'Daniel Knauf', 'Bernie Caulfield'], 'Starring': ['Nick Stahl', 'Clancy Brown', 'Amy Madigan'], 'Studio': ['HBO']}\nI have 2 more episodes to watch and don't want it to end.  I have enjoyed both seasons - kind of Fellini-esque but compelling!  My only criticism is that once you've seen the boobs, we've seen enough.  And there's one scene in Season 1 of full exposure of the strippers genitals and, ya know, enough is enough.  We all have good imaginations.\nGreat but greater without the boobs!\n{'Content advisory': ['Nudity', 'violence', 'alcohol use', 'smoking', 'foul language', 'sexual content'], 'Subtitles': ['None available'], 'Directors': ['Michael Rymer', 'Guillermo Navarro', 'Vincenzo Natali', 'David Slade', 'Tim Hunter', 'John Dahl', 'Peter Medak', 'James Foley', 'David Semel', 'Marc Jobst'], 'Starring': ['Hugh Dancy', 'Mads Mikkelsen', 'Caroline Dhavernas'], 'Studio': ['Lionsgate']}\nCreepy good!  I can't watch movies in which an animal dies but this dark stuff is my cup of tea!  Well written script.  Acting is really good.  Story line is diabolically good!  They put in just the right hooks to keep me watching!\nGood eats!\n{'Audio languages': ['English'], 'Subtitles': ['English [CC]'], 'Directors': ['Bob Balaban'], 'Producers': ['Bob Balaban', 'Jonathan Cavendish', 'Adam Kassen', 'Mark Kassen', 'Kevin Spacey', 'Dana Brunetti'], 'Starring': ['Susan Sarandon', 'Ralph Fiennes', 'James Rebhorn'], 'Studio': ['HBO']}\nInteresting cause this is about Doris Duke.....the philanthropist.\nFour Stars\n{'Content advisory': ['Violence', 'smoking', 'foul language', 'sexual content'], 'Audio languages': ['English Dialogue Boost: Low', 'English Dialogue Boost: High', 'English', 'English [Audio Description]', 'English Dialogue Boost: Medium', 'Espa\u00f1ol (Espa\u00f1a)', 'Italiano', 'Espa\u00f1ol (Latinoam\u00e9rica)', '\u65e5\u672c\u8a9e', 'Portugu\u00eas', 'Deutsch', 'Fran\u00e7ais'], 'Subtitles': ['English [CC]', 'Deutsch', 'Espa\u00f1ol (Latinoam\u00e9rica)', 'Espa\u00f1ol (Espa\u00f1a)', 'Fran\u00e7ais', 'Italiano', '\u65e5\u672c\u8a9e', 'Portugu\u00eas'], 'Directors': ['Woody Allen'], 'Producers': ['Erika Aronson', 'Helen Robin'], 'Starring': ['Woody Allen', 'Miley Cyrus', 'Elaine May']}\nWoody Allen style comedy.  Cute.  Not his best.\nNot his best.\n{'Content advisory': ['Violence', 'alcohol use', 'smoking', 'foul language', 'sexual content'], 'Audio languages': ['English', 'English [Audio Description]', 'English Dialogue Boost: High', 'English Dialogue Boost: Medium'], 'Subtitles': ['English [CC]'], 'Directors': ['Alex Gabassi'], 'Producers': ['Mammoth Screen LTD', 'Agatha Christie Productions LTD', 'Farah Abushwesha'], 'Starring': ['John Malkovich', 'Rupert Grint', 'Andrew Buchan']}\nI was excitedly awaiting this series but, alas, was very disappointed.  We have watched 2 episodes and don't know if we'll even finish the third.<br />If you're going to re-created Poirot after David Suchet has represented him to the pinnacle of the character, at least choose someone who can at least do the character justice.  Malkovich is a very sad and not even brilliant Poirot who can't even get the accent down.  I even noticed a few French words (I know Poirot is Belgian) that were not pronounced correctly.<br />A poor series, sadly.\nPoor Poirot Representation",
  "actual_interaction": {
    "rating": 1.0,
    "title": "Poor Poirot Representation",
    "text": "I was excitedly awaiting this series but, alas, was very disappointed.  We have watched 2 episodes and don't know if we'll even finish the third.<br />If you're going to re-created Poirot after David Suchet has represented him to the pinnacle of the character, at least choose someone who can at least do the character justice.  Malkovich is a very sad and not even brilliant Poirot who can't even get the accent down.  I even noticed a few French words (I know Poirot is Belgian) that were not pronounced correctly.<br />A poor series, sadly.",
    "images": [],
    "asin": "B07M5HWD5J",
    "parent_asin": "B07M5HWD5J",
    "user_id": "AHRGECR373HHVT7MMP44QYOL44OQ",
    "timestamp": "2019-02-04 00:36:24.065000",
    "helpful_vote": 3,
    "verified_purchase": false,
    "main_category": "Prime Video",
    "title_meta": null,
    "average_rating": 3.4,
    "rating_number": 2532,
    "features": null,
    "description": null,
    "price": null,
    "images_meta": [
      {
        "360w": "https://images-na.ssl-images-amazon.com/images/S/pv-target-images/be07027c38d51f3ce4e6e31a146b6e2450c2ce02aac4e390e514fc62588803d9._RI_SX360_FMwebp_.jpg",
        "480w": "https://images-na.ssl-images-amazon.com/images/S/pv-target-images/be07027c38d51f3ce4e6e31a146b6e2450c2ce02aac4e390e514fc62588803d9._RI_SX480_FMwebp_.jpg",
        "720w": "https://images-na.ssl-images-amazon.com/images/S/pv-target-images/be07027c38d51f3ce4e6e31a146b6e2450c2ce02aac4e390e514fc62588803d9._RI_SX720_FMwebp_.jpg",
        "1080w": "https://images-na.ssl-images-amazon.com/images/S/pv-target-images/be07027c38d51f3ce4e6e31a146b6e2450c2ce02aac4e390e514fc62588803d9._RI_SX1080_FMwebp_.jpg",
        "1440w": "https://images-na.ssl-images-amazon.com/images/S/pv-target-images/be07027c38d51f3ce4e6e31a146b6e2450c2ce02aac4e390e514fc62588803d9._RI_SX1440_FMwebp_.jpg",
        "1920w": "https://images-na.ssl-images-amazon.com/images/S/pv-target-images/be07027c38d51f3ce4e6e31a146b6e2450c2ce02aac4e390e514fc62588803d9._RI_SX1920_FMwebp_.jpg",
        "variant": "MAIN"
      }
    ],
    "videos": [],
    "store": null,
    "categories": null,
    "details": {
      "Content advisory": [
        "Violence",
        "alcohol use",
        "smoking",
        "foul language",
        "sexual content"
      ],
      "Audio languages": [
        "English",
        "English [Audio Description]",
        "English Dialogue Boost: High",
        "English Dialogue Boost: Medium"
      ],
      "Subtitles": [
        "English [CC]"
      ],
      "Directors": [
        "Alex Gabassi"
      ],
      "Producers": [
        "Mammoth Screen LTD",
        "Agatha Christie Productions LTD",
        "Farah Abushwesha"
      ],
      "Starring": [
        "John Malkovich",
        "Rupert Grint",
        "Andrew Buchan"
      ]
    },
    "bought_together": null,
    "subtitle": null,
    "author": NaN
  }
}