{
  "interaction_number": 17,
  "interaction_summary": "=== Purchase Information ===\nReview Date: 2021/04/18\nAverage Rating: 4.6\nProduct Details: {'Audio languages': ['English Dialogue Boost: High', 'English', 'English Dialogue Boost: Medium'], 'Subtitles': ['English [CC]'], 'Directors': ['Kevin MacDonald'], 'Producers': ['Jonathan Chinn', 'Simon Chinn', 'Will Clarke', 'Nicole David', 'Zanne Devine', 'Sam Dwyer', 'Lisa Erspamer', 'Patricia Houston', 'Rosanne Korenberg'], 'Starring': ['Whitney Houston'], 'Studio': ['Viacom']}\nReview Text: Very heartbreaking true story of a fabulous talent.\nReview Title: Heartbreaking\nRating: 5.0\n--------------------------------------------------",
  "reference_summary": "Intouchables\nFran\u00e7ois Cluzet  (Actor),     Omar Sy  (Actor),     Eric Toledano  (Director),     Olivier Nakache  (Director)    &                   1                  more   Rated:    R    Format: DVD\nMovies & TV, Studio Specials, Sony Pictures Home Entertainment, All Sony Pictures Titles\n['Product Description', 'When Driss, an ex-con from the projects, is hired to take care of an eccentric French aristocrat named Philippe, his newfound job quickly becomes an unpredictable adventure. Speeding a Maserati through Paris, seducing women and paragliding over the Alps is just the beginning, as Driss turns the often humorous world of upper-class Parisian society upside-down. As this unlikely duo overcome adversity of every flavor in this true story, they also shatter their preconceptions of love, life and each other. Based on the #1 international best-selling book, \u201cYou Changed My Life.\u201d', 'Amazon.com', \"Driss (Omar Sy), a Senegalese man living in a Paris slum, applies for a job as caretaker to a wealthy quadriplegic, but all he wants is to get his paper stamped so he can get benefits. Despite his lack of qualifications, he lands the job because of his attitude: Philippe (Fran\u00e7ois Cluzet), the quadriplegic, wants a caretaker who will look at him without pity. As Driss reluctantly learns to move, feed, and clean Philippe, the two men discover a blunt but vital humor that not only bridges the cultural and class divide between them, but gives Philippe a renewed joy in life. It's easy to see what made\", 'The Intouchables', \"such a massive success in France; the movie has the sweet sincerity and uplifting conclusion that make for a classic feel-good experience. The chemistry between the two leads is undeniable, and Sy--who won the French equivalent of the Oscar for his role--is a dynamic and charismatic performer, while Cluzet's understated performance conveys Philippe's frustrations. The movie doesn't dig too deeply into the struggles of life as a quadriplegic or the struggles of life among the inner-city poor, so when\", 'The Intouchables', \"ends it's not likely to leave a lasting impression, but that doesn't get in the way of its immediate charm and warmth.\", '--Bret Fetzer']\n{'Genre': 'Drama, Comedy', 'Format': 'Multiple Formats, AC-3, Closed-captioned, Color, Dolby, NTSC, Subtitled, Widescreen', 'Contributor': 'Omar Sy, Fran\u00e7ois Cluzet, Cyril Mendy, Eric Toledano, Olivier Nakache, Anne Le Ny, Salimata Kamate, Jos\u00e9phine de Meaux, Absa Diatou Toure, Dominique Daguier, Gr\u00e9goire Oestermann, Audrey Fleurot, Clotilde Mollet, Alba Ga\u00efa Kraghede BellugiOmar Sy, Fran\u00e7ois Cluzet, Cyril Mendy, Eric Toledano, Olivier Nakache, Anne Le Ny, Salimata Kamate, Jos\u00e9phine de Meaux, Absa Diatou Toure, Dominique Daguier, Gr\u00e9goire Oestermann, Audrey Fleurot, Clotilde Mollet, Alba Ga\u00efa Kraghede Bellugi  See more', 'Language': 'French (Dolby Digital 5.1)', 'Runtime': '1 hour and 52 minutes', 'Digital Copy Expiration Date': 'December 31, 2017', 'Aspect Ratio': '1.85:1', 'Is Discontinued By Manufacturer': 'No', 'MPAA rating': 'R (Restricted)', 'Product Dimensions': '0.7 x 7.5 x 5.4 inches; 2.47 Ounces', 'Item model number': '26256632', 'Director': 'Eric Toledano, Olivier Nakache', 'Media Format': 'Multiple Formats, AC-3, Closed-captioned, Color, Dolby, NTSC, Subtitled, Widescreen', 'Run time': '1 hour and 52 minutes', 'Release date': 'March 5, 2013', 'Actors': 'Fran\u00e7ois Cluzet, Omar Sy, Anne Le Ny, Audrey Fleurot, Jos\u00e9phine de Meaux', 'Subtitles': 'Spanish', 'Studio': 'Sony Pictures Home Entertainment', 'Number of discs': '1'}\nOne of the absolutly best movies that I have ever seen.  Could have watched  Omar Sy dance for hours and hours  When I think that my like is difficult, all I have to do is watch a few minutes of this movie to feel truly blessed.\nWonderful, wonderful movie\nFriendly Persuasion (DVD)\nGary Cooper  (Actor),     Dorothy McGuire  (Actor),     William Wyler  (Director, Producer)    &                   0                  more   Rated:    NR    Format: DVD\nMovies & TV, Today's Deals, Featured Deals & New Releases, The Big DVD & Blu-ray Blowout\n[\"For two years the Civil War has been elsewhere. Now Confederate forces are nearby, looting and burning. It is time to fight back, Jess Birdwell's neighbors insist. Yet Birdwell, a Quaker, knows there must be a better way to settle things.\"]\n{'Genre': 'Kids & Family, Westerns', 'Format': 'Multiple Formats, Closed-captioned, Color, NTSC, Subtitled, Widescreen', 'Contributor': 'Theodore Newton, John Smith, Edna Skinner, Jessamyn West, Dorothy McGuire, Richard Eyer, Walter Catlett, Robert Middleton, Michael Wilson, Gary Cooper, Richard Hale, Phyllis Love, Marjorie Main, Joel Fluellen, Marjorie Durant, William Wyler, Peter Mark Richman, Anthony Perkins, Frances FarwellTheodore Newton, John Smith, Edna Skinner, Jessamyn West, Dorothy McGuire, Richard Eyer, Walter Catlett, Robert Middleton, Michael Wilson, Gary Cooper, Richard Hale, Phyllis Love, Marjorie Main, Joel Fluellen, Marjorie Durant, William Wyler, Peter Mark Richman, Anthony\u2026  See more', 'Initial release date': '2005-07-12', 'Language': 'English (Mono), Unqualified (DTS ES 6.1), French (Dolby Digital 1.0)', 'Is Discontinued By Manufacturer': 'No', 'MPAA rating': 'NR (Not Rated)', 'Product Dimensions': '0.7 x 7.5 x 5.4 inches; 2.72 Ounces', 'Item model number': 'Relay Time: 137 min', 'Director': 'William Wyler', 'Media Format': 'Multiple Formats, Closed-captioned, Color, NTSC, Subtitled, Widescreen', 'Run time': '2 hours and 31 minutes', 'Release date': 'July 12, 2005', 'Actors': 'Gary Cooper, Dorothy McGuire, Anthony Perkins, Richard Eyer, Robert Middleton', 'Dubbed': 'French', 'Subtitles': 'English, French', 'Producers': 'William Wyler', 'Studio': 'Studio Distribution Services', 'Writers': 'Michael Wilson', 'Number of discs': '1'}\nBought it for a friend who said that this was her all time favorite movie.  Naturally, she was quite pleased.  You just can't go wrong with Gary Cooper.\n... friend who said that this was her all time favorite movie. Naturally\nPsycho: Complete 4-Movie Collection [DVD]\nAnthony Perkins  (Actor, Director),     Janet Leigh  (Actor),     Mick Garris  (Director),     Richard Franklin  (Director)    &                   1                  more   Rated:    R    Format: DVD\nMovies & TV, Featured Categories, DVD, Horror\n['Check into the motel where guests never check out in the Psycho: Complete 4-Movie Collection, featuring all four thrillers starring Anthony Perkins as the notorious Norman Bates \u2013 including the iconic original directed by the Master of Suspense, Alfred Hitchcock. In Psycho, a secretary (Janet Leigh) checks into the remote Bates Motel run by a shy young man (Perkins) with what appears to be a domineering mother. In Psycho II, Norman returns to his family home after 22 years only to be haunted by his past. Old habits die hard when Norman falls for a former nun and angers his jealous mother in Psycho III. Finally, in Psycho IV: The Beginning, Norman calls in to a late-night radio show and shares disturbing memories of his childhood with Mother.', 'Bonus Content:', 'Disc 1 - Psycho (1960):', 'Theatrical Trailer', 'Theatrical Trailer', 'Re-Release Trailers', 'Re-Release Trailers', 'Newsreel Footage: The Release of Psycho', 'Newsreel Footage: The Release of Psycho', 'The Shower Scene', 'The Shower Scene', 'The Psycho Archives', 'The Psycho Archives', 'Production Photographs', 'Production Photographs', 'Behind-the-Scenes Photographs', 'Behind-the-Scenes Photographs', 'The Shower Scene: Storyboards by Saul Bass', 'The Shower Scene: Storyboards by Saul Bass', 'Lobby Cards', 'Lobby Cards', 'Posters and Psycho Ads', 'Posters and Psycho Ads', 'Production Notes', 'Production Notes', 'Disc 2 - Psycho II:', 'Theatrical Trailer', 'Theatrical Trailer', 'Disc 3 - Psycho III:', 'Theatrical Trailer', 'Theatrical Trailer', ']]>']\n{'Genre': 'Horror, Suspense', 'Format': 'DVD, NTSC, Subtitled', 'Contributor': 'Charles Edward Pogue, Meg Tilly, Olivia Hussey, Vera Miles, John Gavin, Martin Balsam, Janet Leigh, Jeff Fahey, Roberta Maxwell, Joseph Stefano, Robert Loggia, Richard Franklin, Alfred Hitchcock, Hilton A. Green, John L. Russell, Diana Scarwid, Tom Holland, Mick Garris, John McIntire, Anthony Perkins, Henry Thomas, Dennis FranzCharles Edward Pogue, Meg Tilly, Olivia Hussey, Vera Miles, John Gavin, Martin Balsam, Janet Leigh, Jeff Fahey, Roberta Maxwell, Joseph Stefano, Robert Loggia, Richard Franklin, Alfred Hitchcock, Hilton A. Green, John L. Russell, Diana Scarwid, Tom Holland, Mick Garris, John M\u2026   See more', 'Initial release date': '2017-09-12', 'Language': 'English (Dolby Digital 4.0), English (Dolby Digital 2.0), Spanish (Dolby Digital 2.0), French (Dolby Digital 2.0)', 'Aspect Ratio': '1.78:1, 1.85:1', 'Is Discontinued By Manufacturer': 'No', 'MPAA rating': 'R (Restricted)', 'Product Dimensions': '0.7 x 7.5 x 5.4 inches; 0.01 Ounces', 'Director': 'Mick Garris, Anthony Perkins, Richard Franklin, Alfred Hitchcock', 'Media Format': 'DVD, NTSC, Subtitled', 'Run time': '6 hours and 52 minutes', 'Release date': 'September 12, 2017', 'Actors': 'Anthony Perkins, Janet Leigh, Meg Tilly, Diana Scarwid, Henry Thomas', 'Subtitles': 'Spanish, French', 'Producers': 'Hilton A. Green, Alfred Hitchcock', 'Studio': 'Studio Distribution Services', 'Writers': 'Charles Edward Pogue, Tom Holland, Joseph Stefano', 'Country of Origin': 'USA', 'Number of discs': '3'}\nGiven as a gift to a fellow scary movie fan.  She loved them!\nGood  Collection of Scary Films\nThunderpants\nNed Beatty  (Actor),     Stephen Fry  (Actor),     Peter Hewitt  (Director)    &                   0                  more   Rated:    PG    Format: DVD\nMovies & TV, Featured Categories, DVD, Comedy\n[\"A nerdy schoolboy's exceptional farts propel him to improbable places in THUNDERPANTS, including, in the film's explosive finale, a rescue mission in outer space. Director Peter Hewitt Star Bruce Cook, Rupert Grint, Adam Godley Special Features: Full Frame Format.\"]\n{'Genre': 'Kids & Family', 'Format': 'Multiple Formats, Closed-captioned, Color, NTSC, Widescreen', 'Contributor': 'Rupert Grint, Anna Popplewell, Victor McGuire, Paul Giamatti, Bronagh Gallagher, Simon Callow, Celia Imrie, Leslie Phillips, Ned Beatty, Robert Hardy, Peter Hewitt, Bruce Cook, Stephen Fry, Adam GodleyRupert Grint, Anna Popplewell, Victor McGuire, Paul Giamatti, Bronagh Gallagher, Simon Callow, Celia Imrie, Leslie Phillips, Ned Beatty, Robert Hardy, Peter Hewitt, Bruce Cook, Stephen Fry, Adam Godley   See more', 'Language': 'Unqualified', 'Runtime': '1 hour and 27 minutes', 'Is Discontinued By Manufacturer': 'No', 'MPAA rating': 'PG (Parental Guidance Suggested)', 'Product Dimensions': '7.5 x 0.7 x 5.4 inches; 2.88 Ounces', 'Item model number': 'WENC80345DVD', 'Director': 'Peter Hewitt', 'Media Format': 'Multiple Formats, Closed-captioned, Color, NTSC, Widescreen', 'Run time': '1 hour and 27 minutes', 'Release date': 'July 10, 2007', 'Actors': 'Ned Beatty, Stephen Fry, Bronagh Gallagher, Paul Giamatti, Robert Hardy', 'Studio': 'The Weinstein Company', 'Number of discs': '1'}\nAwesomely funny movie starring the young Ron Weasley aka Rupert Grint.\nFunny, funny, funny\n{'Audio languages': ['English'], 'Subtitles': ['English [CC]'], 'Directors': ['Sandra Nettelbeck'], 'Producers': ['Christine Haebler', 'Judy Tossell'], 'Starring': ['Ashley Judd', 'Goran Visnjic', 'Lauren Lee Smith'], 'Studio': ['Insight Film Studios']}\nVery good movie about mental illness.  Ashley Judd does a great job\nIntense!\n{'Content advisory': ['Violence', 'alcohol use', 'smoking', 'foul language'], 'Audio languages': ['English'], 'Subtitles': ['English [CC]'], 'Directors': ['Henry King'], 'Producers': ['Jerry Wald'], 'Starring': ['Gregory Peck', 'Deborah Kerr', 'Eddie Albert'], 'Studio': ['20th Century Fox']}\nWonderful movie.  Two great stars portraying two great personalities.  Who could ask for more?\nGreat movie\n{'Content advisory': ['Nudity', 'violence', 'frightening scenes', 'alcohol use', 'smoking', 'foul language', 'sexual content'], 'Audio languages': ['English', 'English [Audio Description]'], 'Subtitles': ['English', 'English [CC]'], 'Directors': ['Andy Muschietti'], 'Producers': ['Richard Brener', 'Gary Dauberman', 'Marty P. Ewing', 'Jason Fuchs', 'Seth Grahame-Smith', 'David Katzenberg', 'Roy Lee', 'Dan Lin', 'Barbara Muschietti'], 'Starring': ['Jessica Chastain', 'James McAvoy', 'Bill Hader'], 'Studio': ['New Line']}\nOh, so scary and good!!!  Get ready for a great ride.\nAwesome\n{'Content advisory': ['Alcohol use', 'smoking', 'foul language', 'sexual content'], 'Audio languages': ['English'], 'Subtitles': ['English [CC]'], 'Directors': ['---'], 'Producers': ['David Livingstone'], 'Starring': ['Ren\u00e9e Zellweger', 'Rufus Sewell', 'Michael Gambon'], 'Studio': ['Epix']}\nIt was awesome. I enjoyed every second of it!!\nRenee does a fabulous job\n{'Audio languages': ['English'], 'Subtitles': ['English [CC]'], 'Directors': ['Franc Roddam'], 'Producers': ['Herb Jaffe', 'Gabriel Katzka', 'Basil Rayburn']}\nExcellent movie taken from Pat Conroy's book by the same name.\nVery enjoyable\nThe Mirror Has Two Faces/ The Prince of Tides/ The Way We Were\nBarbra Streisand  (Actor, Director),     Jeff Bridges  (Actor),     Sydney Pollack  (Director)    &                   0                  more   Rated:    R    Format: DVD\nMovies & TV, Studio Specials, Sony Pictures Home Entertainment, All Sony Pictures Titles\n['Mirror/Prince/Way We']\n{'Genre': 'Kids & Family', 'Format': 'NTSC, Subtitled, Multiple Formats', 'Contributor': 'Prince of Tides, Robert Redford, Nick Nolte, Barbra Streisand, Sydney Pollack, Mirror Has Two Faces, Bradford Dillman, Way We Were, Jeff BridgesPrince of Tides, Robert Redford, Nick Nolte, Barbra Streisand, Sydney Pollack, Mirror Has Two Faces, Bradford Dillman, Way We Were, Jeff Bridges  See more', 'Language': 'English', 'Runtime': '4 hours and 20 minutes', 'Aspect Ratio': '2.35:1, 1.85:1', 'Is Discontinued By Manufacturer': 'No', 'MPAA rating': 'R (Restricted)', 'Package Dimensions': '7.4 x 5.3 x 0.6 inches; 4.8 Ounces', 'Item model number': '43396284685', 'Director': 'Barbra Streisand, Sydney Pollack', 'Media Format': 'NTSC, Subtitled, Multiple Formats', 'Run time': '4 hours and 20 minutes', 'Release date': 'November 4, 2008', 'Actors': 'Barbra Streisand, Jeff Bridges, Nick Nolte, Robert Redford, Bradford Dillman', 'Dubbed': 'Portuguese, French, Spanish', 'Subtitles': 'Thai, Mandarin Chinese, Korean, English, Portuguese, French, Spanish', 'Studio': 'Sony Pictures Home Entertainment', 'Country of Origin': 'USA', 'Number of discs': '3'}\nThree great movies at an awesome price.\nGood deal\n{'Audio languages': ['English'], 'Subtitles': ['English [CC]'], 'Directors': ['Henry King'], 'Producers': ['Henry T. Weinstein', 'Peter Levathes'], 'Starring': ['Jennifer Jones', 'Jason Robards', 'Joan Fontaine'], 'Studio': ['20th Century Fox']}\nThoroughly enjoyed watching an old favorite again.\nGood movie\n{'Content advisory': ['Violence', 'substance use', 'alcohol use', 'smoking', 'foul language', 'sexual content'], 'Audio languages': ['English', 'English [Audio Description]'], 'Subtitles': ['English [CC]'], 'Directors': ['Dexter Fletcher'], 'Producers': ['Matthew Vaughn', 'David Furnish', 'Adam Bohling', 'David Reid', 'Elton John', 'Claudia Vaughn', 'Brian Oliver', 'Steve Hamilton Shaw', 'Michael Gracey'], 'Starring': ['Taron Egerton', 'Jamie Bell', 'Richard Madden'], 'Studio': ['Hit Movies']}\nIt was wonderful.  Enjoyed it so very much\nGreat movie\n{'Audio languages': ['English'], 'Subtitles': ['English [CC]'], 'Directors': ['Michael Engler'], 'Producers': ['Gareth Neame', 'Julian Fellowes', 'Liz Trubridge', 'Nigel Marchant', 'Brian Percival'], 'Starring': ['Hugh Bonneville', 'Jim Carter', 'Michelle Dockery'], 'Studio': ['Focus Features']}\nJust how good can a movie be?  Well, this one is every bit that good!!!\nTerrific\nRebecca\nLaurence Olivier  (Actor),     Joan Fontaine  (Actor),     Alfred Hitchcock  (Director)    &                   0                  more   Rated:    Unrated    Format: DVD\nMovies & TV, Featured Categories, DVD, Drama\n[\"A British gentleman's innocent bride grapples with intrusive reminders of his deceased wife. Directed by Alfred Hitchcock. Oscar for best picture.\"]\n{'Format': 'Multiple Formats, NTSC, Black & White, Full Screen, Subtitled', 'Contributor': 'Edward Fielding, Lumsden Hare, Leyland Hodgson, Joan Fontaine, Franz Waxman, George Sanders, Laurence Olivier, Reginald Denny, Melville Cooper, Philip Winter, Alfred Hitchcock, Gladys Cooper, Forrester Harvey, Judith Anderson, C. Aubrey Smith, George BarnesEdward Fielding, Lumsden Hare, Leyland Hodgson, Joan Fontaine, Franz Waxman, George Sanders, Laurence Olivier, Reginald Denny, Melville Cooper, Philip Winter, Alfred Hitchcock, Gladys Cooper, Forrester Harvey, Judith Anderson, C. Aubrey Smith, George Barnes   See more', 'Language': 'Unqualified', 'Runtime': '2 hours and 11 minutes', 'Aspect Ratio': '1.33:1', 'Is Discontinued By Manufacturer': 'No', 'MPAA rating': 'Unrated (Not Rated)', 'Product Dimensions': '0.7 x 7.5 x 5.4 inches; 2.72 Ounces', 'Item model number': '883904109891', 'Director': 'Alfred Hitchcock', 'Media Format': 'Multiple Formats, NTSC, Black & White, Full Screen, Subtitled', 'Run time': '2 hours and 11 minutes', 'Release date': 'October 14, 2008', 'Actors': 'Laurence Olivier, Joan Fontaine, Judith Anderson, George Sanders, Gladys Cooper', 'Subtitles': 'English, French, Spanish', 'Studio': 'MGM (Video & DVD)', 'Number of discs': '1'}\nBeautiful copy of a classic favorite.\nGreat movie!\n{'Audio languages': ['English'], 'Subtitles': ['English [CC]'], 'Directors': ['William Dieterle'], 'Producers': ['Irving Asher'], 'Starring': ['Elizabeth Taylor', 'Dana Andrews', 'Peter Finch']}\nAn absolute old favorite of mine.Took my mind off of the current world situation.  Liz wears an incredible wardrobe!\nGreat Oldie\n{'Content advisory': ['Alcohol use', 'smoking', 'foul language'], 'Audio languages': ['English'], 'Subtitles': ['English [CC]'], 'Directors': ['George Stevens'], 'Producers': ['George Stevens', 'Ivan Moffat'], 'Starring': ['Montgomery Clift', 'Elizabeth Taylor', 'Shelley Winters'], 'Studio': ['Paramount']}\nLove this oldie but goodie!  Romantic, but also intriguing.  Highly recommend!\nWonderful movie\n{'Audio languages': ['English Dialogue Boost: High', 'English', 'English Dialogue Boost: Medium'], 'Subtitles': ['English [CC]'], 'Directors': ['Kevin MacDonald'], 'Producers': ['Jonathan Chinn', 'Simon Chinn', 'Will Clarke', 'Nicole David', 'Zanne Devine', 'Sam Dwyer', 'Lisa Erspamer', 'Patricia Houston', 'Rosanne Korenberg'], 'Starring': ['Whitney Houston'], 'Studio': ['Viacom']}\nVery heartbreaking true story of a fabulous talent.\nHeartbreaking",
  "actual_interaction": {
    "rating": 5.0,
    "title": "Heartbreaking",
    "text": "Very heartbreaking true story of a fabulous talent.",
    "images": [],
    "asin": "B07JD5Q9WQ",
    "parent_asin": "B07JD5Q9WQ",
    "user_id": "AFQ2NTJCN4CTIJIHHCHD5TRBQ3XA",
    "timestamp": "2021-04-18 20:01:43.350000",
    "helpful_vote": 0,
    "verified_purchase": true,
    "main_category": "Prime Video",
    "title_meta": null,
    "average_rating": 4.6,
    "rating_number": 1838,
    "features": null,
    "description": null,
    "price": null,
    "images_meta": [
      {
        "360w": "https://images-na.ssl-images-amazon.com/images/S/pv-target-images/f8bcb71845bbeb43c7f1f9fe096bbefa24aae35982ad9be792fdaa28cbd88314._RI_TTW_SX360_FMwebp_.png",
        "480w": "https://images-na.ssl-images-amazon.com/images/S/pv-target-images/f8bcb71845bbeb43c7f1f9fe096bbefa24aae35982ad9be792fdaa28cbd88314._RI_TTW_SX480_FMwebp_.png",
        "720w": "https://images-na.ssl-images-amazon.com/images/S/pv-target-images/f8bcb71845bbeb43c7f1f9fe096bbefa24aae35982ad9be792fdaa28cbd88314._RI_TTW_SX720_FMwebp_.png",
        "1080w": "https://images-na.ssl-images-amazon.com/images/S/pv-target-images/f8bcb71845bbeb43c7f1f9fe096bbefa24aae35982ad9be792fdaa28cbd88314._RI_TTW_SX1080_FMwebp_.png",
        "1440w": "https://images-na.ssl-images-amazon.com/images/S/pv-target-images/f8bcb71845bbeb43c7f1f9fe096bbefa24aae35982ad9be792fdaa28cbd88314._RI_TTW_SX1440_FMwebp_.png",
        "1920w": "https://images-na.ssl-images-amazon.com/images/S/pv-target-images/f8bcb71845bbeb43c7f1f9fe096bbefa24aae35982ad9be792fdaa28cbd88314._RI_TTW_SX1920_FMwebp_.png",
        "variant": "MAIN"
      }
    ],
    "videos": [],
    "store": null,
    "categories": null,
    "details": {
      "Audio languages": [
        "English Dialogue Boost: High",
        "English",
        "English Dialogue Boost: Medium"
      ],
      "Subtitles": [
        "English [CC]"
      ],
      "Directors": [
        "Kevin MacDonald"
      ],
      "Producers": [
        "Jonathan Chinn",
        "Simon Chinn",
        "Will Clarke",
        "Nicole David",
        "Zanne Devine",
        "Sam Dwyer",
        "Lisa Erspamer",
        "Patricia Houston",
        "Rosanne Korenberg"
      ],
      "Starring": [
        "Whitney Houston"
      ],
      "Studio": [
        "Viacom"
      ]
    },
    "bought_together": null,
    "subtitle": null,
    "author": NaN
  }
}