{
  "interaction_number": 13,
  "interaction_summary": "=== Purchase Information ===\nProduct Title: The Man in the High Castle\nReview Date: 2017/01/10\nCategories: Suspense, Drama, Historical, Military and War\nProduct Description: ['After giving Joe the film, Juliana is forced to flee the fury of the Resistance while embarking on a new path to save her home from destruction. Joe confronts his absent father in Berlin, who is not as he seems. Smith wrestles with what to do about his ill son. Frank takes a gamble with his life in a bid to save Ed. Tagomi\\'s life is turned upside down by his \"travel\" to an alternative world.']\nAverage Rating: 4.6\nProduct Details: {'Content advisory': ['Violence', 'substance use', 'alcohol use', 'smoking', 'foul language'], 'Audio languages': ['English Dialogue Boost: High', 'English', 'English [Audio Description]', 'English Dialogue Boost: Medium', 'English Dialogue Boost: Low', 'Italiano', '\u65e5\u672c\u8a9e', 'Portugu\u00eas', 'Deutsch', 'Espa\u00f1ol (Espa\u00f1a)', 'Espa\u00f1ol (Latinoam\u00e9rica)', 'Polski', '\u010ce\u0161tina', 'Magyar', 'Fran\u00e7ais'], 'Subtitles': ['English [CC]', '\u0627\u0644\u0639\u0631\u0628\u064a\u0629', '\u010ce\u0161tina', 'Dansk', 'Deutsch', '\u0395\u03bb\u03bb\u03b7\u03bd\u03b9\u03ba\u03ac', 'Espa\u00f1ol (Latinoam\u00e9rica)', 'Espa\u00f1ol (Espa\u00f1a)', 'Suomi', 'Filipino', 'Fran\u00e7ais', '\u05e2\u05d1\u05e8\u05d9\u05ea', '\u0939\u093f\u0928\u094d\u0926\u0940', 'Magyar', 'Indonesia', 'Italiano', '\u65e5\u672c\u8a9e', '\ud55c\uad6d\uc5b4', 'Bahasa Melayu', 'Norsk Bokm\u00e5l', 'Nederlands', 'Polski', 'Portugu\u00eas (Brasil)', 'Portugu\u00eas (Portugal)', 'Rom\u00e2n\u0103', '\u0420\u0443\u0441\u0441\u043a\u0438\u0439', 'Svenska', '\u0ba4\u0bae\u0bbf\u0bb4\u0bcd', '\u0c24\u0c46\u0c32\u0c41\u0c17\u0c41', '\u0e44\u0e17\u0e22', 'T\u00fcrk\u00e7e', '\u4e2d\u6587\uff08\u7b80\u4f53\uff09', '\u4e2d\u6587\uff08\u7e41\u9ad4\uff09'], 'Directors': ['Dan Percival', 'Colin Bucksey', 'Dan Sackheim', 'David Petrarca', 'John Fawcett', 'Paul Holahan', 'Karyn Kusama', 'Alex Zakrzewski', 'Chris Long'], 'Producers': ['Ridley Scott', 'David W. Zucker', 'Frank Spotnitz', 'Isa Dick Hackett', 'Christopher Tricarico', 'Stewart Mackinnon', 'Chrtistian Baute', 'Jace Richdale', 'Richard Heus', 'Dan Percival', 'Jordan Sheehan', 'Kalen Egan', 'Erin Smith'], 'Starring': ['Alexa Davalos', 'Rupert Evans', 'Luke Kleintank']}\nReview Text: I love this show!  This is a series everyone should watch.  Especially the thirty and under group of Americans. The opening gives me chill bumps when I see the German swastica and the Japanese Flag in where we know to be the United States of America.  We American s take our freedom for granted too often.  Keep the shows coming!\nReview Title: Everyone Needs to See Ths Series!\nRating: 5.0\n--------------------------------------------------",
  "reference_summary": "The Good Wife\nDrama\n['Pushing aside the betrayal and crushing public humiliation caused by her husband, Peter, Alicia Florrick starts over by pursuing her original career as a defense attorney.  As a junior associate at a prestigious Chicago law firm, she joins her longtime friend, former law school classmate and firm partner Will Gardner, who is interested in rekindling their former relationship.']\n{'Content advisory': ['Violence', 'substance use', 'alcohol use', 'foul language', 'sexual content'], 'Audio languages': ['English'], 'Subtitles': ['English [CC]'], 'Directors': ['Rosemary Rodriguez', 'Michael Zinberg', 'Brooke Kennedy', 'James Whitmore Jr.', 'F\u00e9lix Enr\u00edquez Alcal\u00e1', 'Jim McKay', 'Frederick E.O. Toye', 'Robert King', 'Matt Shakman', 'Nelson McCormick']}\nI just started this series and it it hard to stop watching it!  I love the main character Alicia.  My next  favorite is Zack, her son.  Both of them are so smart and yet, vulnerable.  Strong women will love this.  If you want to be a strong woman you will love it too.  If men would like to be better men, they can pick up a few pointers from this series as well.  Enjoy!\nVery good program\n{'Audio languages': ['English'], 'Subtitles': ['English [CC]'], 'Directors': ['Bobby Quinn'], 'Starring': ['Johnny Carson', 'Ed McMahon', 'Bill Clinton'], 'Studio': ['Respond2 Entertainment']}\nCarson was a one of a kind, never to be duplicated.  I use to watch this program with my parents as a child.  Never a dull one.  You will like this video.\nGreat memories!\n{'Audio languages': ['English', 'English [Audio Description]'], 'Subtitles': ['English [CC]'], 'Directors': ['Sydney Pollack'], 'Producers': ['Joe Wizan'], 'Starring': ['Robert Redford', 'Will Geer', 'Stefan Gierasch'], 'Studio': ['WARNER BROS.']}\nClassic Redford movie.  A must watch for a fan of adventure and Redford.  It is the type of movie you watch several times and always see something new.\nClassic!\n{'Content advisory': ['Violence', 'alcohol use', 'smoking', 'foul language', 'sexual content'], 'Audio languages': ['English Dialogue Boost: High', 'English', 'English [Audio Description]', 'English Dialogue Boost: Medium'], 'Subtitles': ['English [CC]'], 'Directors': ['Joel Schumacher'], 'Producers': ['Andrew Lloyd Webber'], 'Starring': ['Gerard Butler', 'Emmy Rossum', 'Patrick Wilson'], 'Studio': ['Warner Bros.']}\nMy granddaughter and I have watched this together many times.  Such a bittersweet love story and beautiful music!  Love it!\nBest Musical!\nBreaking Bad\nSuspense, Drama\n['All bad things must come to an end.']\n{'Audio languages': ['English'], 'Subtitles': ['English [CC]'], 'Producers': ['Michelle MacLaren', 'Mark Johnson', 'Vince Gilligan']}\nThe first series we have watched entirely.  I had to purchase to finish!  I bought it for my husband really.  Great program but not for children!\nThe best!\n{'Content advisory': ['Violence', 'substance use', 'alcohol use', 'foul language', 'sexual content'], 'Audio languages': ['English Dialogue Boost: High', 'English', 'English Dialogue Boost: Medium'], 'Subtitles': ['English [CC]'], 'Directors': ['Rosemary Rodriguez', 'Michael Zinberg', 'Brooke Kennedy', 'James Whitmore Jr.', 'F\u00e9lix Enr\u00edquez Alcal\u00e1', 'Jim McKay', 'Frederick E.O. Toye', 'Robert King', 'Matt Shakman', 'Nelson McCormick'], 'Studio': ['CBS']}\nI always look forward to my special time watching this series.  The main character, Alicia, is smart, caring, and is wonderfully portrayed.  The supporting characters are all very dynamic and each have their own entertaining aspect.  The female actors in this series are the best I have seen I. A series.  Enjoy!\nExcellent!\n{'Audio languages': ['English'], 'Subtitles': ['English [CC]'], 'Directors': ['Kenneth Fink', 'J. Miller Tobin', 'Bobby Roth', 'Matt Earl Beesley', 'John Terlesky', 'Sanford Bookstaver', 'Colin Bucksey', 'Matt Shakman', 'John Scott', 'Randy Zisk'], 'Starring': ['Madeleine Stowe', 'Emily VanCamp', 'Gabriel Mann'], 'Studio': ['ABC']}\nI have become addicted to this Hampton tale.  If you like beautiful homes and elaborate schemes this is for you.\nWhat a surprise!\n{'Audio languages': ['English'], 'Subtitles': ['English [CC]'], 'Directors': ['Jeff Nichols'], 'Producers': ['Sarah Green', 'Aaron Ryder', 'Lisa Maria Falcone'], 'Starring': ['Matthew McConaughey', 'Tye Sheridan', 'Sam Shepard'], 'Studio': ['tribecashortlist']}\nPretty good movie.  The boys in the movie are great and the theme of innocence and trust takes you back to another time.\nWorth a watch\n{'Content advisory': ['Violence', 'alcohol use', 'smoking', 'foul language'], 'Audio languages': ['English'], 'Subtitles': ['English [CC]'], 'Directors': ['Oliver Hirschbiegel'], 'Producers': [\"Eoin O'Callaghan\", 'Stephen Wright'], 'Starring': ['Liam Neeson', 'James Nesbitt', 'Anamaria Marinca'], 'Studio': ['IFC Films']}\nI thought this would be good considering Liam Neeson was in it.  Wrong!  I made myself finish the movie just to make sure all of it was terrible.  A waste of time.\nHeaven or He'll to watch?\n{'Content advisory': ['Nudity', 'violence', 'alcohol use', 'smoking', 'foul language', 'sexual content'], 'Audio languages': ['English'], 'Subtitles': ['English [CC]'], 'Directors': ['Anthony Byrne', 'John Strickland', 'Jon Jones', 'Michael Keillor'], 'Producers': ['Jeremy Piven', 'Andrew Davies', 'Chrissy Skinns', 'Kate Lewis', 'Rebecca Eaton'], 'Starring': ['Aisling Loftus', \"Frances O'Connor\", 'Gregory Fitoussi'], 'Studio': ['PBS']}\nThe characters are very interesting and appealing.  The costumes and set are awesome.  Very realistic and entertaining.  I will continue to watch this series.\nVery good!\n{'Content advisory': ['Violence', 'alcohol use', 'foul language', 'sexual content'], 'Audio languages': ['English'], 'Subtitles': ['English [CC]'], 'Directors': ['Alexander Payne'], 'Producers': ['Albert Berger', 'Doug Mankoff', 'George Parra', 'Neil Tabatznik', 'Julie M. Thompson', 'Ron Yerxa'], 'Starring': ['Bruce Dern', 'Will Forte'], 'Studio': ['Paramount Pictures']}\nA depressing film about a subject most baby boomers are familiar with  Alzheimer's and dementia.  The caring sons try to make their father see reality but it only breaks his heart.  The boys try to make everything right but it never will be.  The youngest son finally sees the light and does what it takes to bring some peace and dignity to his fathers life.  The best scene is when the other tells her relatives to ______, themselves!  :-).\nGood ending, but slow.\n{'Content advisory': ['Nudity', 'violence', 'alcohol use', 'smoking', 'foul language', 'sexual content'], 'Audio languages': ['English', 'English [Audio Description]', 'Espa\u00f1ol (Espa\u00f1a)', 'Italiano', 'Espa\u00f1ol (Latinoam\u00e9rica)', 'Polski', '\u65e5\u672c\u8a9e', 'Portugu\u00eas', 'Deutsch', 'Fran\u00e7ais'], 'Subtitles': ['English [CC]', '\u0627\u0644\u0639\u0631\u0628\u064a\u0629', '\u010ce\u0161tina', 'Dansk', '\u0395\u03bb\u03bb\u03b7\u03bd\u03b9\u03ba\u03ac', 'Suomi', 'Filipino', '\u05e2\u05d1\u05e8\u05d9\u05ea', '\u0939\u093f\u0928\u094d\u0926\u0940', 'Magyar', 'Indonesia', '\u65e5\u672c\u8a9e', '\ud55c\uad6d\uc5b4', 'Bahasa Melayu', 'Norsk Bokm\u00e5l', 'Nederlands', 'Polski', 'Portugu\u00eas', 'Rom\u00e2n\u0103', '\u0420\u0443\u0441\u0441\u043a\u0438\u0439', 'Svenska', '\u0ba4\u0bae\u0bbf\u0bb4\u0bcd', '\u0c24\u0c46\u0c32\u0c41\u0c17\u0c41', '\u0e44\u0e17\u0e22', 'T\u00fcrk\u00e7e', '\u0423\u043a\u0440\u0430\u0457\u043d\u0441\u044c\u043a\u0430', 'Ti\u1ebfng Vi\u1ec7t', '\u4e2d\u6587\uff08\u7b80\u4f53\uff09', '\u4e2d\u6587\uff08\u7e41\u9ad4\uff09'], 'Directors': ['Joey Soloway', 'Andrea Arnold', 'Nisha Ganatra', 'Silas Howard', 'Jim Frohna', 'Stacie Passon', 'Marta Cunningham', 'Allison Liddi-Brown', 'Marielle Heller', 'So Yong Kim'], 'Producers': ['Joey Soloway', 'Nisha Ganatra', 'Andrea Sperling', 'Victor Hsu', 'Bridget Bedard', 'Rick Rosenthal', 'Jennifer Corey'], 'Starring': ['Jeffrey Tambor', 'Gaby Hoffmann', 'Jay Duplass'], 'Studio': ['Amazon Studios']}\nThis was a show that was repulsive in every area.  From the characters appearance, in the way they talk to each other and where the story seemed to be going.  Not subjects I want to be spending my time on.\nNot good\nThe Man in the High Castle\nSuspense, Drama, Historical, Military and War\n['After giving Joe the film, Juliana is forced to flee the fury of the Resistance while embarking on a new path to save her home from destruction. Joe confronts his absent father in Berlin, who is not as he seems. Smith wrestles with what to do about his ill son. Frank takes a gamble with his life in a bid to save Ed. Tagomi\\'s life is turned upside down by his \"travel\" to an alternative world.']\n{'Content advisory': ['Violence', 'substance use', 'alcohol use', 'smoking', 'foul language'], 'Audio languages': ['English Dialogue Boost: High', 'English', 'English [Audio Description]', 'English Dialogue Boost: Medium', 'English Dialogue Boost: Low', 'Italiano', '\u65e5\u672c\u8a9e', 'Portugu\u00eas', 'Deutsch', 'Espa\u00f1ol (Espa\u00f1a)', 'Espa\u00f1ol (Latinoam\u00e9rica)', 'Polski', '\u010ce\u0161tina', 'Magyar', 'Fran\u00e7ais'], 'Subtitles': ['English [CC]', '\u0627\u0644\u0639\u0631\u0628\u064a\u0629', '\u010ce\u0161tina', 'Dansk', 'Deutsch', '\u0395\u03bb\u03bb\u03b7\u03bd\u03b9\u03ba\u03ac', 'Espa\u00f1ol (Latinoam\u00e9rica)', 'Espa\u00f1ol (Espa\u00f1a)', 'Suomi', 'Filipino', 'Fran\u00e7ais', '\u05e2\u05d1\u05e8\u05d9\u05ea', '\u0939\u093f\u0928\u094d\u0926\u0940', 'Magyar', 'Indonesia', 'Italiano', '\u65e5\u672c\u8a9e', '\ud55c\uad6d\uc5b4', 'Bahasa Melayu', 'Norsk Bokm\u00e5l', 'Nederlands', 'Polski', 'Portugu\u00eas (Brasil)', 'Portugu\u00eas (Portugal)', 'Rom\u00e2n\u0103', '\u0420\u0443\u0441\u0441\u043a\u0438\u0439', 'Svenska', '\u0ba4\u0bae\u0bbf\u0bb4\u0bcd', '\u0c24\u0c46\u0c32\u0c41\u0c17\u0c41', '\u0e44\u0e17\u0e22', 'T\u00fcrk\u00e7e', '\u4e2d\u6587\uff08\u7b80\u4f53\uff09', '\u4e2d\u6587\uff08\u7e41\u9ad4\uff09'], 'Directors': ['Dan Percival', 'Colin Bucksey', 'Dan Sackheim', 'David Petrarca', 'John Fawcett', 'Paul Holahan', 'Karyn Kusama', 'Alex Zakrzewski', 'Chris Long'], 'Producers': ['Ridley Scott', 'David W. Zucker', 'Frank Spotnitz', 'Isa Dick Hackett', 'Christopher Tricarico', 'Stewart Mackinnon', 'Chrtistian Baute', 'Jace Richdale', 'Richard Heus', 'Dan Percival', 'Jordan Sheehan', 'Kalen Egan', 'Erin Smith'], 'Starring': ['Alexa Davalos', 'Rupert Evans', 'Luke Kleintank']}\nI love this show!  This is a series everyone should watch.  Especially the thirty and under group of Americans. The opening gives me chill bumps when I see the German swastica and the Japanese Flag in where we know to be the United States of America.  We American s take our freedom for granted too often.  Keep the shows coming!\nEveryone Needs to See Ths Series!",
  "actual_interaction": {
    "rating": 5.0,
    "title": "Everyone Needs to See Ths Series!",
    "text": "I love this show!  This is a series everyone should watch.  Especially the thirty and under group of Americans. The opening gives me chill bumps when I see the German swastica and the Japanese Flag in where we know to be the United States of America.  We American s take our freedom for granted too often.  Keep the shows coming!",
    "images": [],
    "asin": "B01IS2RDJ2",
    "parent_asin": "B01IS2RDJ2",
    "user_id": "AFQBBEOTS3BOIBTPLR3PWFKJJEDQ",
    "timestamp": "2017-01-10 01:45:34",
    "helpful_vote": 0,
    "verified_purchase": true,
    "main_category": "Prime Video",
    "title_meta": "The Man in the High Castle",
    "average_rating": 4.6,
    "rating_number": 39307,
    "features": [
      "IMDb 7.9",
      "2016",
      "10 episodes",
      "X-Ray",
      "HDR",
      "UHD",
      "18+"
    ],
    "description": [
      "After giving Joe the film, Juliana is forced to flee the fury of the Resistance while embarking on a new path to save her home from destruction. Joe confronts his absent father in Berlin, who is not as he seems. Smith wrestles with what to do about his ill son. Frank takes a gamble with his life in a bid to save Ed. Tagomi's life is turned upside down by his \"travel\" to an alternative world."
    ],
    "price": null,
    "images_meta": [
      {
        "360w": "https://images-na.ssl-images-amazon.com/images/S/pv-target-images/f60209a707ca75247b9a4a39e33297a64d43558a728b86acf2f0f9a780e6112f._RI_SX360_FMwebp_.jpg",
        "480w": "https://images-na.ssl-images-amazon.com/images/S/pv-target-images/f60209a707ca75247b9a4a39e33297a64d43558a728b86acf2f0f9a780e6112f._RI_SX480_FMwebp_.jpg",
        "720w": "https://images-na.ssl-images-amazon.com/images/S/pv-target-images/f60209a707ca75247b9a4a39e33297a64d43558a728b86acf2f0f9a780e6112f._RI_SX720_FMwebp_.jpg",
        "1080w": "https://images-na.ssl-images-amazon.com/images/S/pv-target-images/f60209a707ca75247b9a4a39e33297a64d43558a728b86acf2f0f9a780e6112f._RI_SX1080_FMwebp_.jpg",
        "1440w": "https://images-na.ssl-images-amazon.com/images/S/pv-target-images/f60209a707ca75247b9a4a39e33297a64d43558a728b86acf2f0f9a780e6112f._RI_SX1440_FMwebp_.jpg",
        "1920w": "https://images-na.ssl-images-amazon.com/images/S/pv-target-images/f60209a707ca75247b9a4a39e33297a64d43558a728b86acf2f0f9a780e6112f._RI_SX1920_FMwebp_.jpg",
        "variant": "MAIN"
      }
    ],
    "videos": [],
    "store": null,
    "categories": [
      "Suspense",
      "Drama",
      "Historical",
      "Military and War"
    ],
    "details": {
      "Content advisory": [
        "Violence",
        "substance use",
        "alcohol use",
        "smoking",
        "foul language"
      ],
      "Audio languages": [
        "English Dialogue Boost: High",
        "English",
        "English [Audio Description]",
        "English Dialogue Boost: Medium",
        "English Dialogue Boost: Low",
        "Italiano",
        "\u65e5\u672c\u8a9e",
        "Portugu\u00eas",
        "Deutsch",
        "Espa\u00f1ol (Espa\u00f1a)",
        "Espa\u00f1ol (Latinoam\u00e9rica)",
        "Polski",
        "\u010ce\u0161tina",
        "Magyar",
        "Fran\u00e7ais"
      ],
      "Subtitles": [
        "English [CC]",
        "\u0627\u0644\u0639\u0631\u0628\u064a\u0629",
        "\u010ce\u0161tina",
        "Dansk",
        "Deutsch",
        "\u0395\u03bb\u03bb\u03b7\u03bd\u03b9\u03ba\u03ac",
        "Espa\u00f1ol (Latinoam\u00e9rica)",
        "Espa\u00f1ol (Espa\u00f1a)",
        "Suomi",
        "Filipino",
        "Fran\u00e7ais",
        "\u05e2\u05d1\u05e8\u05d9\u05ea",
        "\u0939\u093f\u0928\u094d\u0926\u0940",
        "Magyar",
        "Indonesia",
        "Italiano",
        "\u65e5\u672c\u8a9e",
        "\ud55c\uad6d\uc5b4",
        "Bahasa Melayu",
        "Norsk Bokm\u00e5l",
        "Nederlands",
        "Polski",
        "Portugu\u00eas (Brasil)",
        "Portugu\u00eas (Portugal)",
        "Rom\u00e2n\u0103",
        "\u0420\u0443\u0441\u0441\u043a\u0438\u0439",
        "Svenska",
        "\u0ba4\u0bae\u0bbf\u0bb4\u0bcd",
        "\u0c24\u0c46\u0c32\u0c41\u0c17\u0c41",
        "\u0e44\u0e17\u0e22",
        "T\u00fcrk\u00e7e",
        "\u4e2d\u6587\uff08\u7b80\u4f53\uff09",
        "\u4e2d\u6587\uff08\u7e41\u9ad4\uff09"
      ],
      "Directors": [
        "Dan Percival",
        "Colin Bucksey",
        "Dan Sackheim",
        "David Petrarca",
        "John Fawcett",
        "Paul Holahan",
        "Karyn Kusama",
        "Alex Zakrzewski",
        "Chris Long"
      ],
      "Producers": [
        "Ridley Scott",
        "David W. Zucker",
        "Frank Spotnitz",
        "Isa Dick Hackett",
        "Christopher Tricarico",
        "Stewart Mackinnon",
        "Chrtistian Baute",
        "Jace Richdale",
        "Richard Heus",
        "Dan Percival",
        "Jordan Sheehan",
        "Kalen Egan",
        "Erin Smith"
      ],
      "Starring": [
        "Alexa Davalos",
        "Rupert Evans",
        "Luke Kleintank"
      ]
    },
    "bought_together": null,
    "subtitle": "Season 2",
    "author": NaN
  }
}