{
  "interaction_number": 11,
  "interaction_summary": "=== Purchase Information ===\nReview Date: 2022/04/09\nAverage Rating: 4.2\nProduct Details: {'Content advisory': ['Nudity', 'violence', 'substance use', 'foul language'], 'Subtitles': ['None available'], 'Directors': ['Scott Waugh'], 'Producers': ['Tom Lesinski', 'Louise Linton', 'Michael J. Mailis', 'Steven Mnuchin', 'Bradley Pilz', 'Greg P. Russell', 'Simon Swart', 'Tucker Tooley', 'Madison Turner', 'Scott Waugh'], 'Starring': ['Josh Hartnett', 'Mira Sorvino', 'Sarah Dumont'], 'Studio': ['Momentum']}\nReview Text: Just not believable in terms of when he was in the woods \"lost\"  &  kept panting through his mouth.  No one is going to survive  when it is that cold breathing through their mouth.. .  It just wasn't that interesting in the forest.. it was too lengthy. & the rest was  sort of okay.\nReview Title: Too long lost\nRating: 2.0\n--------------------------------------------------",
  "reference_summary": "Christmas Collection (The Yule Log DVD)\nIl Divo  (Actor),     Various  (Director)    Rated:    NR    Format: DVD\nMovies & TV, Studio Specials, Sony Pictures Home Entertainment, All Sony Pictures Titles\n[\"Featuring the world s greatest Christmas music set to your choice of three heart-warming holiday scenes, THE YULE LOG DVD lights up the holiday season. Perfect for entertaining, these songs and scenes instantly bring the good cheer and magic of Christmas to any holiday home.1. O Holy Night 2. White Christmas 3. Ave Maria4. When A Child Is Born5. Adeste Fideles 6. Over The Rainbow7. Panis Angelicus8. Rejoice 9. Silent Night 10. The Lord's Prayer\"]\n{'Genre': 'Kids & Family', 'Format': 'Multiple Formats, Classical, Color, NTSC', 'Contributor': 'Il Divo, Various', 'Language': 'English', 'Number Of Discs': '1', 'Aspect Ratio': '1.33:1', 'MPAA rating': 'NR (Not Rated)', 'Product Dimensions': '5.3 x 7.5 x 0.6 inches; 3.2 Ounces', 'Item model number': '88697782929', 'Director': 'Various', 'Media Format': 'Multiple Formats, Classical, Color, NTSC', 'Run time': '36 minutes', 'Release date': 'October 19, 2010', 'Actors': 'Il Divo', 'Studio': 'Sony Legacy', 'Number of discs': '1'}\nThis is a fun product. I wanted one for a long timeI It will be used thru out the Christmas and new year season. you won't be confused by the fire tho !<br />The music is nice.<br />I found it unfriendly to move around on the choices on the screen.\nIt's fun\nDeath Wish [DVD]\nVarious  (Actor, Director)    Rated:    R    Format: DVD\nMovies & TV, MGM Home Entertainment, All MGM Titles\n['Death Wish (2018) (DVD)', ']]>']\n{'Genre': 'Action & Adventure', 'Format': 'DVD, NTSC', 'Contributor': 'Various', 'Initial release date': '2018-06-05', 'Language': 'English (Dolby Digital 5.1), French (Dolby Digital 2.0 Surround), Spanish (Dolby Digital 2.0 Surround)', 'Aspect Ratio': '2.40:1', 'Is Discontinued By Manufacturer': 'No', 'MPAA rating': 'R (Restricted)', 'Product Dimensions': '0.7 x 7.5 x 5.4 inches; 2.72 Ounces', 'Director': 'Various', 'Media Format': 'DVD, NTSC', 'Run time': '1 hour and 47 minutes', 'Release date': 'June 5, 2018', 'Actors': 'Various', 'Dubbed': 'Spanish', 'Subtitles': 'English, French, Spanish', 'Studio': 'WarnerBrothers', 'Country of Origin': 'USA', 'Number of discs': '1'}\nHad the NRA produced this film, I would have expected this... I am very disappointed..\nVery disappointed in this movie\n{'Content advisory': ['Nudity', 'violence', 'alcohol use', 'smoking', 'foul language', 'sexual content'], 'Subtitles': ['None available'], 'Directors': ['B. Forbes'], 'Producers': ['Gustave M. Berne', 'Roger M. Rothstein', 'Edgar J. Scherick'], 'Studio': ['Binc']}\nChallenging the status quo of  what  is valued in terms of family and asking us all to think again, as we did when it was originally filmed about the roles of women in a family.  A classic that can be a communication starter. Relevant today.\nThe Stepford Wives is relevant  still.\n{'Content advisory': ['Violence', 'alcohol use', 'smoking', 'foul language', 'sexual content'], 'Audio languages': ['English Dialogue Boost: High', 'English', 'English [Audio Description]', 'English Dialogue Boost: Medium', 'English Dialogue Boost: Low', 'Italiano', '\u65e5\u672c\u8a9e', 'Portugu\u00eas', 'Deutsch', 'Espa\u00f1ol (Espa\u00f1a)', 'Espa\u00f1ol (Latinoam\u00e9rica)', 'Polski', '\u010ce\u0161tina', 'Magyar', 'T\u00fcrk\u00e7e', 'Fran\u00e7ais'], 'Subtitles': ['English [CC]', '\u0627\u0644\u0639\u0631\u0628\u064a\u0629', '\u010ce\u0161tina', 'Dansk', 'Deutsch', '\u0395\u03bb\u03bb\u03b7\u03bd\u03b9\u03ba\u03ac', 'Espa\u00f1ol (Latinoam\u00e9rica)', 'Espa\u00f1ol (Espa\u00f1a)', 'Suomi', 'Filipino', 'Fran\u00e7ais', '\u05e2\u05d1\u05e8\u05d9\u05ea', '\u0939\u093f\u0928\u094d\u0926\u0940', 'Magyar', 'Indonesia', 'Italiano', '\u65e5\u672c\u8a9e', '\ud55c\uad6d\uc5b4', 'Bahasa Melayu', 'Norsk Bokm\u00e5l', 'Nederlands', 'Polski', 'Portugu\u00eas (Brasil)', 'Portugu\u00eas (Portugal)', 'Rom\u00e2n\u0103', '\u0420\u0443\u0441\u0441\u043a\u0438\u0439', 'Svenska', '\u0ba4\u0bae\u0bbf\u0bb4\u0bcd', '\u0c24\u0c46\u0c32\u0c41\u0c17\u0c41', '\u0e44\u0e17\u0e22', 'T\u00fcrk\u00e7e', '\u0423\u043a\u0440\u0430\u0457\u043d\u0441\u044c\u043a\u0430', 'Ti\u1ebfng Vi\u1ec7t', '\u4e2d\u6587\uff08\u7b80\u4f53\uff09', '\u4e2d\u6587\uff08\u7e41\u9ad4\uff09'], 'Directors': ['Susanna Fogel', 'John Polson', 'Cherie Nowlan', 'Haifaa Al-Mansour', 'Alison MacLean', 'Ed Wild', 'Tara Nicole Weyr', 'Sydney Freeland'], 'Producers': ['Sarah Streicher', 'Amy B. Harris', 'Jamie Tarses', 'Dylan Clark', 'John Polson'], 'Starring': ['Sophia Ali', 'Shannon Berry', 'Jenna Clause'], 'Studio': ['Amazon Studios']}\nIt's like a page turning book.. what's next?  Will there be season 2 because it was NOT  through!\nCan't wait for Season 2?\n{'Content advisory': ['Nudity', 'violence', 'alcohol use', 'foul language', 'sexual content'], 'Subtitles': ['None available'], 'Directors': [\"Jim O'Hanlon\"], 'Starring': ['John Hannah', 'Suranne Jones', 'Navin Chowdhry']}\nI get it is suppose to be dry humor.  It  is however not funny.. When a man mouth kisses a cadaver... I am done.\nNot amusing\n{'Content advisory': ['Violence', 'substance use', 'alcohol use', 'smoking', 'foul language'], 'Subtitles': ['None available'], 'Directors': ['Joe Ahearne'], 'Producers': ['Hilary Martin', 'Ann Harrison-Baxter'], 'Starring': ['Maisie Williams', 'Tom Ellis', 'Olivia Cooke'], 'Studio': ['BBC']}\nThis story will keep you entertained & on the edge of your seat..  suspenseful & melancholy all spun through the great British actors we know & love.\nA wonderful story\n{'Content advisory': ['Violence', 'alcohol use', 'smoking', 'foul language'], 'Audio languages': ['English Dialogue Boost: High', 'English', 'English Dialogue Boost: Medium'], 'Subtitles': ['English [CC]'], 'Directors': ['Michael Apted'], 'Producers': ['Claudia Bluemhuber', 'Andrew Boswell', 'Barry Brooker', 'Florian Dargel', 'Lorenzo di Bonaventura', 'Irene Gall', 'Peter Hampden', 'Erik Howsam', 'Laura Julian'], 'Starring': ['Noomi Rapace', 'Orlando Bloom', 'Michael Douglas'], 'Studio': ['Lionsgate']}\nStrong woman character with  brains!\nGreat  show\n{'Content advisory': ['Violence', 'foul language', 'sexual content'], 'Audio languages': ['English Dialogue Boost: Low', 'English Dialogue Boost: High', 'English', 'English [Audio Description]', 'English Dialogue Boost: Medium'], 'Subtitles': ['English [CC]', '\u0627\u0644\u0639\u0631\u0628\u064a\u0629', '\u010ce\u0161tina', 'Dansk', 'Deutsch', '\u0395\u03bb\u03bb\u03b7\u03bd\u03b9\u03ba\u03ac', 'Espa\u00f1ol (Latinoam\u00e9rica)', 'Espa\u00f1ol (Espa\u00f1a)', 'Suomi', 'Filipino', 'Fran\u00e7ais', '\u05e2\u05d1\u05e8\u05d9\u05ea', '\u0939\u093f\u0928\u094d\u0926\u0940', 'Magyar', 'Indonesia', 'Italiano', '\u65e5\u672c\u8a9e', '\ud55c\uad6d\uc5b4', 'Bahasa Melayu', 'Norsk Bokm\u00e5l', 'Nederlands', 'Polski', 'Portugu\u00eas (Brasil)', 'Portugu\u00eas (Portugal)', 'Rom\u00e2n\u0103', '\u0420\u0443\u0441\u0441\u043a\u0438\u0439', 'Svenska', '\u0ba4\u0bae\u0bbf\u0bb4\u0bcd', '\u0c24\u0c46\u0c32\u0c41\u0c17\u0c41', '\u0e44\u0e17\u0e22', 'T\u00fcrk\u00e7e', '\u4e2d\u6587\uff08\u7b80\u4f53\uff09', '\u4e2d\u6587\uff08\u7e41\u9ad4\uff09'], 'Directors': ['Julie Cohen', 'Betsy West'], 'Producers': ['Talleah Bridges', 'Julie Cohen', 'Peggy Drexler', 'Elise Pearlstein', 'Betsy West'], 'Starring': ['Pauli Murray', 'Ruth Bader Ginsburg', 'Patricia Bell-Scott'], 'Studio': ['Amazon Studios Participant Storyville Drexler']}\nA must  for everyone!\nNot to be missed!\nCrisis Point\nSuspense, Horror, Compelling, Tense\n[\"Criminal psychologist Cameron Grainger is Detroit's go-to hostage negotiator. Blaming herself when a crisis she's handling goes wrong and a young man is killed, she removes herself from service only to be called back into sudden and terrifying action when her sister becomes a hostage and the assailants demand that Cameron be the one to negotiate her release.\"]\n{'Content advisory': ['Violence', 'foul language'], 'Audio languages': ['English'], 'Subtitles': ['English [CC]'], 'Directors': ['Adrian Wills'], 'Producers': ['Jean Bureau', 'Serge Denis', 'Jos\u00e9e Mauffette', 'Stephen Greenberg'], 'Starring': ['Rhona Mitra', 'Elias Toufexis', 'Patrick Costello']}\nA grade B- movie that only lasts a short while..  I am amazed Amazon had the nerve to ask for $ to see this. Even the .99 I paid for SD wasn't worth it.\nSave your $\n{'Content advisory': ['Violence', 'alcohol use', 'foul language', 'sexual content'], 'Audio languages': ['English Dialogue Boost: High', 'English', 'English [Audio Description]', 'English Dialogue Boost: Medium'], 'Subtitles': ['English [CC]'], 'Directors': ['Allan Harmon'], 'Producers': ['Cynde Harmon'], 'Starring': ['Emmanuelle Vaugier', 'Matthew MacCaull', 'Jordana Largy'], 'Studio': ['MarVista']}\ngiving it a 2 because..  so predictable..  way too predictable..\nActing is OK for a B\n{'Content advisory': ['Nudity', 'violence', 'substance use', 'foul language'], 'Subtitles': ['None available'], 'Directors': ['Scott Waugh'], 'Producers': ['Tom Lesinski', 'Louise Linton', 'Michael J. Mailis', 'Steven Mnuchin', 'Bradley Pilz', 'Greg P. Russell', 'Simon Swart', 'Tucker Tooley', 'Madison Turner', 'Scott Waugh'], 'Starring': ['Josh Hartnett', 'Mira Sorvino', 'Sarah Dumont'], 'Studio': ['Momentum']}\nJust not believable in terms of when he was in the woods \"lost\"  &  kept panting through his mouth.  No one is going to survive  when it is that cold breathing through their mouth.. .  It just wasn't that interesting in the forest.. it was too lengthy. & the rest was  sort of okay.\nToo long lost",
  "actual_interaction": {
    "rating": 2.0,
    "title": "Too long lost",
    "text": "Just not believable in terms of when he was in the woods \"lost\"  &  kept panting through his mouth.  No one is going to survive  when it is that cold breathing through their mouth.. .  It just wasn't that interesting in the forest.. it was too lengthy. & the rest was  sort of okay.",
    "images": [],
    "asin": "B08HGGYJB3",
    "parent_asin": "B08HGGYJB3",
    "user_id": "AFHY2FFJXDCKLKP7EQRTPHXILK6A",
    "timestamp": "2022-04-09 04:01:31.041000",
    "helpful_vote": 0,
    "verified_purchase": false,
    "main_category": "Prime Video",
    "title_meta": null,
    "average_rating": 4.2,
    "rating_number": 620,
    "features": null,
    "description": null,
    "price": null,
    "images_meta": [
      {
        "360w": "https://images-na.ssl-images-amazon.com/images/S/pv-target-images/26ea9a44d2943f6903fbddd7490f74b5796f4c754b388d138926400f9e8fd72f._RI_TTW_SX360_FMwebp_.png",
        "480w": "https://images-na.ssl-images-amazon.com/images/S/pv-target-images/26ea9a44d2943f6903fbddd7490f74b5796f4c754b388d138926400f9e8fd72f._RI_TTW_SX480_FMwebp_.png",
        "720w": "https://images-na.ssl-images-amazon.com/images/S/pv-target-images/26ea9a44d2943f6903fbddd7490f74b5796f4c754b388d138926400f9e8fd72f._RI_TTW_SX720_FMwebp_.png",
        "1080w": "https://images-na.ssl-images-amazon.com/images/S/pv-target-images/26ea9a44d2943f6903fbddd7490f74b5796f4c754b388d138926400f9e8fd72f._RI_TTW_SX1080_FMwebp_.png",
        "1440w": "https://images-na.ssl-images-amazon.com/images/S/pv-target-images/26ea9a44d2943f6903fbddd7490f74b5796f4c754b388d138926400f9e8fd72f._RI_TTW_SX1440_FMwebp_.png",
        "1920w": "https://images-na.ssl-images-amazon.com/images/S/pv-target-images/26ea9a44d2943f6903fbddd7490f74b5796f4c754b388d138926400f9e8fd72f._RI_TTW_SX1920_FMwebp_.png",
        "variant": "MAIN"
      }
    ],
    "videos": [],
    "store": null,
    "categories": null,
    "details": {
      "Content advisory": [
        "Nudity",
        "violence",
        "substance use",
        "foul language"
      ],
      "Subtitles": [
        "None available"
      ],
      "Directors": [
        "Scott Waugh"
      ],
      "Producers": [
        "Tom Lesinski",
        "Louise Linton",
        "Michael J. Mailis",
        "Steven Mnuchin",
        "Bradley Pilz",
        "Greg P. Russell",
        "Simon Swart",
        "Tucker Tooley",
        "Madison Turner",
        "Scott Waugh"
      ],
      "Starring": [
        "Josh Hartnett",
        "Mira Sorvino",
        "Sarah Dumont"
      ],
      "Studio": [
        "Momentum"
      ]
    },
    "bought_together": null,
    "subtitle": null,
    "author": NaN
  }
}