{
  "interaction_number": 7,
  "interaction_summary": "=== Purchase Information ===\nProduct Title: Orly Nail Lacquer - ELECTRIC ESCAPE Summer 2021 Collection - Pick Any Color .6oz/18ml (OR2000099 - Synthetic Symphony)\nReview Date: 2021/07/27\nStore: Orly\nProduct Description: ['Electric Escape Synthetic Symphony']\nAverage Rating: 4.6\nProduct Details: {'Brand': 'Orly', 'Item Form': 'Liquid', 'Type': 'Base', 'Material Type Free': 'Paraben Free', 'Finish Type': 'Creme', 'Special Feature': 'Chip Resistant', 'Material Feature': 'Cruelty Free', 'Age Range (Description)': 'Adult', 'Unit Count': '1.00 Count', 'Number of Items': '1', 'Product Dimensions': '1.97 x 1.97 x 3.94 inches; 1.06 Ounces', 'UPC': '096200015623'}\nReview Text: I am 55 years old and have used many many different brands of nail polish. This is the best I have ever used.\nReview Title: Stays on a long time.\nRating: 5.0\n--------------------------------------------------",
  "reference_summary": "African Pride Shea Miracle Co-Wash Conditioning Cleanser\nAfrican Pride\n{'Item Form': 'Liquid', 'Brand': 'African Pride', 'Special Ingredients': 'Shea', 'Number of Items': '1', 'Unit Count': '12.00 Fl Oz', 'Is Discontinued By Manufacturer': 'No', 'Product Dimensions': '3 x 3 x 3 inches; 13.6 Ounces', 'UPC': '802535489127'}\nWorks good\nGreat\nMicroblade Eyebrow Pencil for tat brow look, Microblading Eyebrow Pen make up, Tattoo Pen for Every Skin Type with Long Lasting Quality, Waterproof Brow Pen Chestnut-Dark Brown\nMusic Flower\n['Cloud Retailers Presents', 'Music Flower Eyebrow Tattoo Pen Microblading-3D Fork Tip', 'This new and revolutionary smudge-proof long lasting eyebrow pen features a micro fork tip applicator that creates hair-like strokes lasting all day to hopefully replace the old-school pencils.', 'Regarding Colors:', 'Dark Grey is recommended for Black/Dark Grey eyebrows.', 'Dark Grey is recommended for Black/Dark Grey eyebrows.', 'Brown is recommended for Brown/Auburn eyebrows (this is a Reddish Brown).', 'Brown is recommended for Brown/Auburn eyebrows (this is a Reddish Brown).', 'Chestnut is recommended for Brown/Dark Blonde eyebrows (Cool Brown).', 'Chestnut is recommended for Brown/Dark Blonde eyebrows (Cool Brown).', 'INSTRUCTIONS:', 'Note: After applying once you achieve the desired shape allow the pigmentation to dry.', 'Step 1: Start with clean and dry skin. Do not apply after putting lotion on, this will make the eyebrow pen less effective.', 'Step 1:', 'Start with clean and dry skin.', 'Do not apply after putting lotion on', ', this will make the eyebrow pen less effective.', \"Step 2: Use a light hand, don't press hard. Raise the pen tip 45 degrees and gently draw along the growth direction of the eyebrows (If your eyebrows are not sparse, you can also draw straight across your eyebrows to create a fuller look.)\", 'Step 2:', \"Use a light hand, don't press hard. Raise the pen tip 45 degrees and gently draw along the growth direction of the eyebrows (If your eyebrows are not sparse, you can also draw straight across your eyebrows to create a fuller look.)\", 'Step 3: Fill the eyebrows with the wide part of the pen.', 'Step 3:', 'Fill the eyebrows with the wide part of the pen.', 'Step 4: For the end of your brow, tilt the pen to fill the area with the narrower part of the pen.', 'Step 4:', 'For the end of your brow, tilt the pen to fill the area with the narrower part of the pen.', 'Step 5: Correct any mistakes to get your desired shape and then let it dry for a few seconds.', 'Step 5:', 'Correct any mistakes to get your desired shape and then let it dry for a few seconds.', 'Initially it will be slightly wet but that gives you the chance to fix any mistakes.', 'STORAGE', 'Use and store with the tip positioned lower than the end of the pen to ease and prolong its use as this is similar to a marker or pen. Also, always close cap tightly.', \"Enjoy this unique fork like design enabling you to get perfectly defined, naturally beautiful, hair-like brows that WOW. If you have any questions on how to use the product please don't hesitate to contact us.\"]\n{'Brand': 'Music Flower', 'Item Form': 'Pencil', 'Finish Type': 'Natural', 'Special Feature': 'Waterproof, Long Lasting, Smudge Pro', 'Material Feature': 'Natural', 'Is Discontinued By Manufacturer': 'No', 'Product Dimensions': '4.92 x 0.98 x 0.43 inches; 0.63 Ounces', 'UPC': '732068058937'}\nI disliked it because it was dried up and dry flakes were all over the place. I tried using it to try and fill in my missing eyebrows.\nVery dried up!!\nAussie Moist Shampoo and Conditioner, 13.5 Ounce Each, Plus 3 Minute Miracle Moist, 8 Ounce\nAussie\n{'Product Benefits': 'Moisturizing', 'Item Form': 'Liquid', 'Brand': 'Aussie', 'Number of Items': '1', 'Unit Count': '35 Fl Oz', 'Is Discontinued By Manufacturer': 'No', 'Package Dimensions': '9.29 x 6.73 x 3.19 inches; 2.6 Pounds', 'Item model number': '9818850', 'UPC': '697111193525 781549818850', 'Manufacturer': 'Aussie'}\nThis is great stuff . My hair is dry from coloring and bleaching my hair for over 35 years. This stuff is the only products I will use now. I have bought other products that were $35 dollars (each)!!! And this stuff works just as good...\nGreat products!!!\nBeauty HAO Eyebrow Tattoo Pen, Waterproof Natural Convenient Long-Lasting Eyebrow Pencil\nBeauty HAO\n{'Brand': 'Beauty HAO', 'Item Form': 'Pencil', 'Product Benefits': 'Long Lasting', 'Item Dimensions LxWxH': '4.92 x 0.98 x 0.39 inches', 'Package Information': 'Tube', 'Product Dimensions': '4.92 x 0.98 x 0.39 inches; 0.32 Ounces'}\nDidn\u2019t like it. It comes off to easy\nComes off easy\nAfrican Pride Black Castor Miracle Hold and Cover Edges Black, 2.25 oz\nAfrican Pride\n['African Pride Black Castor Miracle Hold & Cover Edges BLACK 2.25oz. Covers gray and holds down edges']\n{'Item Form': 'Gel', 'Brand': 'African Pride', 'Number of Items': '1', 'Unit Count': '1.00 Count', 'Product Dimensions': '3 x 3 x 1.25 inches; 3.21 Ounces'}\nGood stuff\nWorks great\nMessy Bun Hair Piece Scrunchy Hair Extensions Tousled Updo Ponytail With Synthetic Hair Elastic Rubber Band Accessories Lightest Blonde\nAileam\n{'Material': 'Rubber', 'Hair Type': 'Straight', 'Style': 'Modern', 'Brand': 'Aileam', 'Age Range (Description)': 'Adult', 'Package Dimensions': '5.8 x 3.4 x 0.9 inches; 3.21 Ounces', 'UPC': '780682649543'}\nOk\nOk\nOrly Nail Lacquer - ELECTRIC ESCAPE Summer 2021 Collection - Pick Any Color .6oz/18ml (OR2000099 - Synthetic Symphony)\nOrly\n['Electric Escape Synthetic Symphony']\n{'Brand': 'Orly', 'Item Form': 'Liquid', 'Type': 'Base', 'Material Type Free': 'Paraben Free', 'Finish Type': 'Creme', 'Special Feature': 'Chip Resistant', 'Material Feature': 'Cruelty Free', 'Age Range (Description)': 'Adult', 'Unit Count': '1.00 Count', 'Number of Items': '1', 'Product Dimensions': '1.97 x 1.97 x 3.94 inches; 1.06 Ounces', 'UPC': '096200015623'}\nI am 55 years old and have used many many different brands of nail polish. This is the best I have ever used.\nStays on a long time.",
  "actual_interaction": {
    "rating": 5.0,
    "title": "Stays on a long time.",
    "text": "I am 55 years old and have used many many different brands of nail polish. This is the best I have ever used.",
    "images": [],
    "asin": "B093Y8YSMS",
    "parent_asin": "B093Y8YSMS",
    "user_id": "AFZTCVIRWXM527I5X4VQTTIEQZSA",
    "timestamp": "2021-07-27 00:23:51.614000",
    "helpful_vote": 1,
    "verified_purchase": true,
    "main_category": "All Beauty",
    "title_meta": "Orly Nail Lacquer - ELECTRIC ESCAPE Summer 2021 Collection - Pick Any Color .6oz/18ml (OR2000099 - Synthetic Symphony)",
    "average_rating": 4.6,
    "rating_number": 106,
    "features": [],
    "description": [
      "Electric Escape Synthetic Symphony"
    ],
    "price": 7.45,
    "images_meta": [
      {
        "thumb": "https://m.media-amazon.com/images/I/31iAR+NCmuL._SS40_.jpg",
        "large": "https://m.media-amazon.com/images/I/31iAR+NCmuL.jpg",
        "variant": "MAIN",
        "hi_res": "https://m.media-amazon.com/images/I/51WH+uOoItL._SL1500_.jpg"
      }
    ],
    "videos": [],
    "store": "Orly",
    "categories": [],
    "details": {
      "Brand": "Orly",
      "Item Form": "Liquid",
      "Type": "Base",
      "Material Type Free": "Paraben Free",
      "Finish Type": "Creme",
      "Special Feature": "Chip Resistant",
      "Material Feature": "Cruelty Free",
      "Age Range (Description)": "Adult",
      "Unit Count": "1.00 Count",
      "Number of Items": "1",
      "Product Dimensions": "1.97 x 1.97 x 3.94 inches; 1.06 Ounces",
      "UPC": "096200015623"
    },
    "bought_together": null
  }
}