{
  "interaction_number": 16,
  "interaction_summary": "=== Purchase Information ===\nReview Date: 2016/11/09\nAverage Rating: 4.7\nProduct Details: {'Content advisory': ['Violence', 'frightening scenes', 'foul language'], 'Audio languages': ['English', 'English [Audio Description]'], 'Subtitles': ['English [CC]'], 'Directors': ['Mark Waters'], 'Producers': ['Frank Marshall', 'Kathleen Kennedy', 'Albie Hecht', 'Mark Canton', 'Larry Franco', 'Ellen Goldsmith Vein', 'Karey Kirkpatrick', 'Julia Pistor', 'Tony DiTerlizzi', 'Holly Black'], 'Starring': ['Freddie Highmore', 'Sarah Bolger', 'Mary-Louise Parker']}\nReview Text: I am a grandmother and enjoy sharing movies like this with my grandchildren.\nReview Title: A movie for all ages.\nRating: 5.0\n--------------------------------------------------",
  "reference_summary": "Haunted Castle\nJasper Steverlinck  (Actor),     Kyoko Baertsoen  (Actor),     Ben Stassen  (Director, Editor, Producer, Writer)    &                   0                  more   Rated:    PG    Format: DVD\nMovies & TV, Science Fiction & Fantasy, Science Fiction, Animation\n['Product Description', 'A young musician is summoned to his mother', 'Amazon.com', 'Without question, 3-D technology has come a long way since the days of red and green cardboard glasses, and', 'Haunted Castle', 'offers delectable proof. This half-hour digitally animated feature--also available in', 'The Ultimate 3-D Collection', ', which includes two other films and the H3D \"i-glasses\" hardware needed to generate the 3-D imaging--tells the story of a young rock star facing the Faustian offer to sell his soul for fame and fortune.', 'The tale is a foil for the effects, of course, but a decent foil with above-par music and excellent animation and effects, from torches to trees, gargoyles to guitars. The sound is terrific, enhancing the sense of depth with a seamless DTS surround-sound mix that works well even in headphones.', '--Michael Mikesell', 'From the Back Cover', \"A young musician is summoned to his mother's castle in accordance with her final wishes. Upon his arrival, Johnny quickly discovers that things are not as they appear. The castle begins to come alive as materializing spirits lead him to Mephisto (voiced by Harry Shearer), the ghoulish henchman to Mr. D (also Harry Shearer), who makes Johnny a tantalizing offer. The same offer that his mother accepted over twenty years earlier: surrender your soul in exchange for fame and fortune.\", 'Experience a whirling visual thrill ride as Johnny explores the underworld of the castle to the explosive climax where Johnny confronts Mr. D and fights to free his mother/s spirit.', 'See more']\n{'Aspect Ratio': '1.33:1', 'MPAA rating': 'PG (Parental Guidance Suggested)', 'Product Dimensions': '8 x 5.5 x 0.5 inches; 4 Ounces', 'Item model number': '17078926323', 'Director': 'Ben Stassen', 'Media Format': 'Color, Animated, DTS Surround Sound, NTSC, Live, Dolby, 3D', 'Run time': '38 minutes', 'Release date': 'October 16, 2001', 'Actors': 'Jasper Steverlinck, Kyoko Baertsoen, Harry Shearer', 'Producers': 'Ben Stassen, Caroline Van Iseghem, Charlotte Huggins', 'Language': 'English (Dolby Digital 5.1), English (DTS 5.1)', 'Studio': 'Sling Shot', 'Writers': 'Ben Stassen, Kurt Frey', 'Number of discs': '1'}\nI could not play it on my 3D player because it is not blu ray.  Was a little disapointed but got over it.\nLove this movie except ...\nThe Polar Express Presented in 3-D\nHanks, Tom  (Actor),     Deezen, Eddie  (Actor)    Rated:    G    Format: DVD\nMovies & TV, Studio Specials, Warner Home Video, All Titles\n['Product description', \"All aboard - 3-D! No matter if you enjoy The Polar Express every holiday or if you're a first-time passenger, get ready for a thrilling new adventure: Three-dimension viewing [Disc 1] - from careening up and down mountains to teetering across mile-high bridges to savoring hot chocolate served up by the world's most talented singing waiters to arriving at the North Pole on Christmas Eve. Experience an amazing new dimension of fun!. Tom Hanks stars in and Robert Zemeckis directs the instant holiday classic filmed in dazzling performance capture animation that makes every moment magical. And there's more: a two-dimension version [Disc 2] for you to enjoy without your 3-D glasses. Twice the adventure, many times the fun - all aboooooard!. ***4 Pairs of Special 3-D Glasses Inside!. Format: DVD MOVIE. Genre: FAMILY. Rating: G. Age: 883929036660. UPC: 883929036660. Manufacturer No: 1000042431\", 'Amazon.com', 'Destined to become a holiday perennial,', 'The Polar Express', 'also heralded a brave new world of all-digital filmmaking. Critics and audiences were divided between those who hailed it as an instant classic that captures the visual splendor and evocative innocence of Chris Van Allsburg\\'s popular children\\'s book, and those who felt that the innovative use of \"performance capture\"--to accurately translate live performances into all-digital characters--was an eerie and not-quite-lifelike distraction from the story\\'s epic-scale North Pole adventure. In any case it\\'s a benign, kind-hearted celebration of the yuletide spirit, especially for kids who have almost grown out of their need to believe in Santa Claus. Tom Hanks is the nominal \"star\" who performs five different computer-generated characters, but it\\'s the visuals that steal this show, as director Robert Zemeckis indulges his tireless pursuit of technological innovation. No matter how you respond to the many wonders on display, it\\'s clear that The Polar Express represents a significant milestone in the digital revolution of cinema. If it also fills you with the joy of Christmas (in spite of its Nuremberg-like rally of frantic elves), so much the better.', '--Jeff Shannon']\n{'Genre': 'Kids & Family, Animation, Action & Adventure, Performing Arts', 'Format': 'Color, Dolby, NTSC, Animated, Digital Sound', 'Contributor': 'Deezen, Eddie, Hanks, Tom, King, Brendan', 'Language': 'English', 'Is Discontinued By Manufacturer': 'No', 'MPAA rating': 'G (General Audience)', 'Product Dimensions': '7.5 x 5.5 x 0.75 inches; 4.8 Ounces', 'Media Format': 'Color, Dolby, NTSC, Animated, Digital Sound', 'Release date': 'October 28, 2008', 'Actors': 'Hanks, Tom, Deezen, Eddie, King, Brendan', 'Dubbed': 'French, Spanish', 'Subtitles': 'English, French, Spanish', 'Studio': 'Warner Home Video', 'Number of discs': '2'}\nMy granddaughter had the blue ray version and loves this one\nFive Stars\n{'Content advisory': ['Violence', 'frightening scenes', 'substance use', 'alcohol use', 'foul language', 'sexual content'], 'Audio languages': ['English', 'English [Audio Description]'], 'Subtitles': ['English [CC]'], 'Directors': ['Chris Fisher', 'Constantine Makris', 'Tawnia McKiernan', 'Jack Kenny', 'Stephen Surjik', 'Jace Alexander', 'Vincent Misiano', 'Michael W. Watkins', 'Millicent Shelton', 'Michael McMurray'], 'Starring': ['Eddie McClintock', 'Joanne Kelly', 'Saul Rubinek']}\nI love this show! !!!  It is so worth it to me!  Happy that I joined.  Can't wait to see the rest of the series!\nwarehouse 13, I am hooked\n{'Audio languages': ['English', 'English [Audio Description]'], 'Subtitles': ['English [CC]'], 'Directors': ['Wolfgang Petersen'], 'Producers': ['Dieter Geissler', 'Bernd Eichinger'], 'Starring': ['Alan Oppenheimer', 'Noah Hathaway', 'Barret Oliver']}\nClassic...love this!\nlove this!\n{'Audio languages': ['English'], 'Subtitles': ['English [CC]'], 'Directors': ['---'], 'Producers': ['Mark Johnson', 'Charles Newirth'], 'Starring': ['Tim Allen', 'Sigourney Weaver', 'Alan Rickman'], 'Studio': ['Epix']}\nAwesome comedy!\nFive Stars\n{'Content advisory': ['Violence', 'alcohol use', 'foul language', 'sexual content'], 'Audio languages': ['English'], 'Subtitles': ['English [CC]'], 'Directors': ['Matthew Vaughn'], 'Producers': ['Stephen Marks', 'Peter Morton', 'David Womark', 'Matthew Vaughn', 'Lorenzo Di Bonaventura', 'Michael Dreyer', 'Neil Gaiman'], 'Starring': ['Claire Danes', 'Charlie Cox', 'Sienna Miller']}\nMy favorite!!!!!\nFive Stars\n{'Content advisory': ['Violence', 'alcohol use', 'foul language', 'sexual content'], 'Audio languages': ['English Dialogue Boost: High', 'English', 'English [Audio Description]', 'English Dialogue Boost: Medium'], 'Subtitles': ['English [CC]'], 'Directors': ['Norberto Barba', \"Terrence O'Hara\", 'Eric Laneuville', 'Aaron Lipstadt', 'Peter Werner', 'David Solomon', 'Steven DePaul', 'John Behring', 'Darnell Martin', 'Karen Gaviola'], 'Starring': ['David Giuntoli', 'Bitsie Tulloch', 'Russell Hornsby'], 'Studio': ['NBC']}\nLove love love Grimm!\nGrimm?\n{'Audio languages': ['English'], 'Subtitles': ['English [CC]'], 'Directors': ['Robert Rodriguez'], 'Producers': ['Robert Rodriguez', 'Elizabeth Avellan'], 'Starring': ['Antonio Banderas', 'Carla Gugino', 'Alexa Penavega'], 'Studio': ['MIRAMAX']}\nLove the graphics and the characters.\nFive Stars\n{'Audio languages': ['English'], 'Subtitles': ['English [CC]'], 'Directors': ['Jon Cassar', 'Milan Cheylov', 'Adam Kane', 'Omar Madha'], 'Producers': ['Jon Cassar', 'Robert Cochran', 'Ashley Contino', 'Manny Coto', 'David Fury', 'Howard Gordon', 'Brian Grazer']}\nHad me at the edge of my seat.  Could not stop watching.\n24 a show up watch\n{'Content advisory': ['Violence', 'alcohol use', 'foul language', 'sexual content'], 'Audio languages': ['English'], 'Subtitles': ['English [CC]'], 'Directors': ['Jon Cassar', 'Brad Turner', 'Milan Cheylov', 'Bryan Spicer', 'Stephen Hopkins', 'Ian Toynton', 'Frederick King Keller', 'James Whitmore Jr.', 'Tim Iacofano', 'Kevin Hooks'], 'Starring': ['Kiefer Sutherland', 'Carlos Bernard', 'Mary Lynn Rajskub'], 'Studio': ['FOX']}\nEnjoyed watching 24\nFive Stars\n{'Content advisory': ['Nudity', 'violence', 'alcohol use', 'foul language', 'sexual content'], 'Audio languages': ['English Dialogue Boost: High', 'English', 'English Dialogue Boost: Medium'], 'Subtitles': ['English [CC]'], 'Directors': ['Jamie Payne', 'James Kent', 'Colin Teague'], 'Producers': ['John Griffin', 'Colin Callender', 'George Faber', 'Charles Pattinson', 'Philippa Gregory', 'Eurydice Gysel', 'Jan Vrints'], 'Starring': ['Rebecca Ferguson', 'James Frain', 'Amanda Hale'], 'Studio': ['Starz']}\nLove love love this show.  Did I mention that I loved it?\nFive Stars\n{'Content advisory': ['Nudity', 'violence', 'frightening scenes', 'substance use', 'alcohol use', 'foul language', 'sexual content'], 'Subtitles': ['None available'], 'Directors': ['Michael Rymer', 'Guillermo Navarro', 'Vincenzo Natali', 'David Slade', 'Tim Hunter', 'John Dahl', 'Peter Medak', 'James Foley', 'David Semel', 'Marc Jobst']}\nGreat show.  Love it\nFive Stars\n{'Audio languages': ['English'], 'Subtitles': ['English [CC]'], 'Directors': ['Dan Lerner', 'Christine Moore', 'Kevin Dowling', 'Adam Kane', 'Adam Arkin', 'Daniel Attias', 'Paris Barclay', 'Matt Earl Beesley', 'Allen Coulter', 'Holly Dale'], 'Studio': ['CBS']}\nGreat show.  Nice story line. Love watching this series.\nExtant\nEl Cantante\nJennifer Lopez  (Actor),     Marc Anthony  (Actor)    Rated:    R    Format: DVD\nMovies & TV, Musicals & Performing Arts, Musicals\n['Product Description', 'El Cantante (DVD) (WS)', \"Superstars Jennifer Lopez and Marc Anthony headline a film as emotional, powerful and driving as the man and music whose story it tells, H\u00e9ctor Lavoe and the Salsa his voice brought to the world -- El Cantante. It's the 1970s, and Salsa is exploding on the world with a Nuyorican sound from the streets of Spanish Harlem that blends Latin, Jazz and African American rhythms and harmonies. Riding the rocket of sudden stardom, Lavoe (Anthony) becomes the voice of the new sound, even as he struggles with personal demons and addictions. Only Lavoe's wife, Puchi (Lopez--Selena), whose devotion has put Lavoe on the path to superstardom may be able keep him from self-destruction in the face sudden fame.\", ']]>', 'Amazon.com', \"Though they don't look much alike, slight actor-singer Marc Anthony was born to play robust salsa sensation H\u00e9ctor Lavoe. In addition to similar ancestry and vocal skills, Anthony has been building a respectable cinematic resume with roles in\", 'Big Night', \"and Martin Scorsese's\", 'Bringing out the Dead', '. The title of', 'El Cantante', 'comes from a number Rub\u00e9n Blades wrote for', 'The Singer', \". Lavoe would make it his signature song. In the film, Anthony's wife, producer Jennifer Lopez, plays Puchi, the Nuyorican beauty who won Lavoe's heart. She narrates their story from the perspective of 2002 (the real-life Puchi passed away shortly afterwards). Leon Ichaso (\", 'Pi\u00f1ero', \") contrasts Lavoe's rise from Puerto Rican street singer to New York superstar with his fall from innocent immigrant to heroin-addicted ladies man. By the mid-1980s, Lavoe's popularity hit its peak, and Ichaso spends the rest of the time ticking off the tragedies of his final years: the break with trombonist Willie Col\u00f3n (John Ortiz), stay in a mental ward, etc. It's a dynamic portrait, and Anthony and Lopez work well together, but despite the urban setting and Latin-flavored soundtrack,\", 'El Cantante', 'follows virtually the same trajectory as', 'Ray', 'and', 'Walk the Line', \"(Ichaso has also directed biopics of Jimi Hendrix and Muhammad Ali). His movie looks and sounds authentic, but Lavoe's story might've been better served as nonfiction. There's a sense that there was more to the man than what appears on screen.\", '--Kathleen C. Fennessy']\n{'Genre': 'Musicals & Performing Arts, Drama, Documentary/Biography', 'Format': 'Multiple Formats, Closed-captioned, Color, Dolby, NTSC, Widescreen, DTS Surround Sound', 'Contributor': 'Jennifer Lopez, Marc Anthony', 'Language': 'English (DTS 5.1), Unqualified', 'Runtime': '1 hour and 56 minutes', 'Is Discontinued By Manufacturer': 'No', 'MPAA rating': 'R (Restricted)', 'Product Dimensions': '0.7 x 7.5 x 5.4 inches; 2.72 Ounces', 'Item model number': '1000032052', 'Media Format': 'Multiple Formats, Closed-captioned, Color, Dolby, NTSC, Widescreen, DTS Surround Sound', 'Run time': '1 hour and 56 minutes', 'Release date': 'January 8, 2008', 'Actors': 'Jennifer Lopez, Marc Anthony', 'Studio': 'WarnerBrothers', 'Number of discs': '1'}\nGreat movie.  Both as gift\nFive Stars\n{'Audio languages': ['English'], 'Subtitles': ['English [CC]'], 'Directors': ['Kenneth Branagh'], 'Producers': ['Simon Kinberg', 'Allison Shearmur', 'David Barron'], 'Starring': ['Lily James', 'Richard Madden', 'Cate Blanchett'], 'Studio': ['WALT DISNEY PICTURES']}\nLove this version.  Well done and to the heart\nFive Stars\n{'Content advisory': ['Violence', 'frightening scenes', 'foul language'], 'Audio languages': ['English', 'English [Audio Description]'], 'Subtitles': ['English [CC]'], 'Directors': ['Mark Waters'], 'Producers': ['Frank Marshall', 'Kathleen Kennedy', 'Albie Hecht', 'Mark Canton', 'Larry Franco', 'Ellen Goldsmith Vein', 'Karey Kirkpatrick', 'Julia Pistor', 'Tony DiTerlizzi', 'Holly Black'], 'Starring': ['Freddie Highmore', 'Sarah Bolger', 'Mary-Louise Parker']}\nI am a grandmother and enjoy sharing movies like this with my grandchildren.\nA movie for all ages.",
  "actual_interaction": {
    "rating": 5.0,
    "title": "A movie for all ages.",
    "text": "I am a grandmother and enjoy sharing movies like this with my grandchildren.",
    "images": [],
    "asin": "B009LL295I",
    "parent_asin": "B009LL295I",
    "user_id": "AGQATM7P5662CQBOFBKVCMXOR52Q",
    "timestamp": "2016-11-09 12:03:56",
    "helpful_vote": 0,
    "verified_purchase": true,
    "main_category": "Prime Video",
    "title_meta": null,
    "average_rating": 4.7,
    "rating_number": 5495,
    "features": null,
    "description": null,
    "price": null,
    "images_meta": [
      {
        "360w": "https://images-na.ssl-images-amazon.com/images/S/pv-target-images/7551324e0740180d8797713eda01b5b29bbe9935ebfdd97f6cd58eb05d94ac6e._RI_SX360_FMwebp_.jpg",
        "480w": "https://images-na.ssl-images-amazon.com/images/S/pv-target-images/7551324e0740180d8797713eda01b5b29bbe9935ebfdd97f6cd58eb05d94ac6e._RI_SX480_FMwebp_.jpg",
        "720w": "https://images-na.ssl-images-amazon.com/images/S/pv-target-images/7551324e0740180d8797713eda01b5b29bbe9935ebfdd97f6cd58eb05d94ac6e._RI_SX720_FMwebp_.jpg",
        "1080w": "https://images-na.ssl-images-amazon.com/images/S/pv-target-images/7551324e0740180d8797713eda01b5b29bbe9935ebfdd97f6cd58eb05d94ac6e._RI_SX1080_FMwebp_.jpg",
        "1440w": "https://images-na.ssl-images-amazon.com/images/S/pv-target-images/7551324e0740180d8797713eda01b5b29bbe9935ebfdd97f6cd58eb05d94ac6e._RI_SX1440_FMwebp_.jpg",
        "1920w": "https://images-na.ssl-images-amazon.com/images/S/pv-target-images/7551324e0740180d8797713eda01b5b29bbe9935ebfdd97f6cd58eb05d94ac6e._RI_SX1920_FMwebp_.jpg",
        "variant": "MAIN"
      }
    ],
    "videos": [],
    "store": null,
    "categories": null,
    "details": {
      "Content advisory": [
        "Violence",
        "frightening scenes",
        "foul language"
      ],
      "Audio languages": [
        "English",
        "English [Audio Description]"
      ],
      "Subtitles": [
        "English [CC]"
      ],
      "Directors": [
        "Mark Waters"
      ],
      "Producers": [
        "Frank Marshall",
        "Kathleen Kennedy",
        "Albie Hecht",
        "Mark Canton",
        "Larry Franco",
        "Ellen Goldsmith Vein",
        "Karey Kirkpatrick",
        "Julia Pistor",
        "Tony DiTerlizzi",
        "Holly Black"
      ],
      "Starring": [
        "Freddie Highmore",
        "Sarah Bolger",
        "Mary-Louise Parker"
      ]
    },
    "bought_together": null,
    "subtitle": null,
    "author": NaN
  }
}