{
  "interaction_number": 13,
  "interaction_summary": "=== Purchase Information ===\nReview Date: 2022/07/18\nAverage Rating: 4.3\nProduct Details: {'Content advisory': ['Nudity', 'violence', 'alcohol use', 'foul language', 'sexual content'], 'Audio languages': ['English Dialogue Boost: High', 'English', 'English Dialogue Boost: Medium'], 'Subtitles': ['English [CC]'], 'Directors': ['Rose Troche'], 'Producers': ['Richard Alan Reid', 'Michael Philip', 'Jason Moring'], 'Starring': ['Keiynan Lonsdale', 'Dylan Sprouse', 'Sarah Hyland'], 'Studio': ['Amazon Studios']}\nReview Text: While away an afternoon watching this silly rom-com.\nReview Title: While away an afternoon watching this silly rom-com.\nRating: 4.0\n--------------------------------------------------",
  "reference_summary": "Luther 3\nVarious  (Actor, Director)    Rated:    NR    Format: DVD\nMovies & TV, Award Winners in Movies & TV, Emmy Central, Emmy Nominees\n['Luther 3', 'Idris Elba (The Wire) won a Golden Globe for his depiction of John Luther in this gripping, smart, and riveting psychological thriller from the BBC. In this new mini-series, a twisted fetishist is targeting young women in London. As Luther is called to another case, will the killer escape his grips? Luther faces an even bigger threat as members of his own team will stop at nothing to bring him down. And as a vigilante killer takes justice into his own hands, Luther questions his own sense of morality. Can he continue to walk the thin line between right and wrong, or has he finally met his match?', ']]>']\n{'Genre': 'Drama', 'Format': 'Multiple Formats, Color, NTSC', 'Contributor': 'Various', 'Language': 'English', 'Number Of Discs': '2', 'Is Discontinued By Manufacturer': 'No', 'MPAA rating': 'NR (Not Rated)', 'Product Dimensions': '0.7 x 7.5 x 5.4 inches; 0.01 Ounces', 'Item model number': '27576722', 'Director': 'Various', 'Media Format': 'Multiple Formats, Color, NTSC', 'Run time': '4 hours', 'Release date': 'September 10, 2013', 'Actors': 'Various', 'Studio': 'BBC Home Entertainment', 'Number of discs': '2'}\nI loved seasons one and two and could not wait to watch season three. After having done so and recovered from the shock, I can honestly say I don't understand what the creators were thinking in having the characters make the choices they made. And the women, this season, were just two-dimensional victims for the most part. I'd probably re-watch seasons one and two but, sadly, not this one.\ni liked the previous two seasons better\nDorfman in Love\nComedy, Passionate, Sweet, Ambitious\n[\"When Deb Dorfman volunteers to cat sit at her unrequited love's new downtown LA loft, her world changes forever.  Over seven days, she embarks on a journey of self-discovery that leads her to find her true love.\"]\n{'Content advisory': ['Nudity', 'violence', 'alcohol use', 'smoking', 'foul language', 'sexual content'], 'Audio languages': ['English'], 'Subtitles': ['English [CC]'], 'Directors': ['Brad Leong'], 'Producers': ['Leonard Hill'], 'Starring': ['Sara Rue', 'Elliott Gould', 'Haaz Sleiman']}\ncute movie. different enough from the standard formula to keep me watching.\nsome surprising choices\n{'Content advisory': ['Nudity', 'violence', 'substance use', 'alcohol use', 'foul language', 'sexual content'], 'Audio languages': ['English', 'English [Audio Description]'], 'Subtitles': ['English [CC]'], 'Directors': ['Ryan Kwanten', 'Sara Canning'], 'Producers': ['Stephen Alix', 'Paula Devonshire', 'Tara Finegan', 'Michael Frislev', 'Ari Lantos', 'Robert Lantos', 'Ben Murray', 'Mark Musselman', 'Chad Oakes'], 'Starring': ['Ryan Kwanten', 'Kristen Hager', 'Maria Menounos']}\nas you can see from the other reviews, some people liked this; others didn't. this kept me from watching this movie for quite a while but i'm glad i eventually did. at first i couldn't decide whether or not i liked this movie but in the end i decided it was different enough from other rom-coms to be enjoyable. it was worth watching. the acting was great. the male lead seemed familiar and i recognized the bride's mother, of course, but i did not know any of the other actors. apparently, they have experience. i was pleasantly surprised.\nglad I watched\n{'Audio languages': ['English'], 'Subtitles': ['English [CC]'], 'Directors': ['Gillian Robespierre'], 'Producers': ['Elisabeth Holm', 'Julia Godzinskaya', 'David Kaplan', 'Stefan Nowicki', 'Gillian Robespierre', 'Michael Sackler', 'Jenny Slate', 'Brent Stiefel', 'Sophie Vickers'], 'Starring': ['Jenny Slate', 'Jake Lacy', 'Gaby Hoffmann'], 'Studio': ['A24 Distribution LLC']}\nFunny. Irreverent. Liked it.\nDifferent\n{'Content advisory': ['Nudity', 'violence', 'alcohol use', 'smoking', 'foul language', 'sexual content'], 'Audio languages': ['English Dialogue Boost: Low', 'English Dialogue Boost: High', 'English', 'English [Audio Description]', 'English Dialogue Boost: Medium', 'Espa\u00f1ol (Espa\u00f1a)', 'Italiano', 'Espa\u00f1ol (Latinoam\u00e9rica)', '\u65e5\u672c\u8a9e', 'Portugu\u00eas', 'Deutsch', 'Fran\u00e7ais'], 'Subtitles': ['English [CC]', '\u0627\u0644\u0639\u0631\u0628\u064a\u0629', '\u010ce\u0161tina', 'Dansk', 'Deutsch', '\u0395\u03bb\u03bb\u03b7\u03bd\u03b9\u03ba\u03ac', 'Espa\u00f1ol (Latinoam\u00e9rica)', 'Espa\u00f1ol (Espa\u00f1a)', 'Suomi', 'Filipino', 'Fran\u00e7ais', '\u05e2\u05d1\u05e8\u05d9\u05ea', '\u0939\u093f\u0928\u094d\u0926\u0940', 'Magyar', 'Indonesia', 'Italiano', '\u65e5\u672c\u8a9e', '\ud55c\uad6d\uc5b4', 'Bahasa Melayu', 'Norsk Bokm\u00e5l', 'Nederlands', 'Polski', 'Portugu\u00eas (Brasil)', 'Portugu\u00eas (Portugal)', 'Rom\u00e2n\u0103', '\u0420\u0443\u0441\u0441\u043a\u0438\u0439', 'Svenska', '\u0ba4\u0bae\u0bbf\u0bb4\u0bcd', '\u0c24\u0c46\u0c32\u0c41\u0c17\u0c41', '\u0e44\u0e17\u0e22', 'T\u00fcrk\u00e7e', '\u4e2d\u6587\uff08\u7b80\u4f53\uff09', '\u4e2d\u6587\uff08\u7e41\u9ad4\uff09'], 'Directors': ['Alex Zakrzewski', 'Ernest R. Dickerson', 'Patrick Cady', 'Aaron Lipstadt', 'Kevin Dowling', 'Adam Davidson', 'Daisy von Scherler Mayer', 'Tim Hunter', 'Christine Moore', 'Zetna Fuentes'], 'Producers': ['Eric Overmyer', 'Michael Connelly', 'Henrik Bastin', 'Mikkel Bondesen', 'Pieter Jan Brugge', 'Jan David Frouman'], 'Starring': ['Titus Welliver', 'Jamie Hector', 'Amy Aquino']}\nVery good writing. I enjoyed it.\ncharacter driven\nGrantchester\nSuspense, Drama\n['In GRANTCHESTER, a young vicar and a veteran cop join forces to solve baffling murders around a placid English village in 1953.']\n{'Content advisory': ['Violence', 'alcohol use', 'smoking', 'foul language', 'sexual content'], 'Audio languages': ['English', 'English [Audio Description]'], 'Subtitles': ['English [CC]'], 'Directors': ['Harry Bradbeer', 'Tim Fywell', 'Jim Robertson'], 'Producers': ['Diederick Santer'], 'Starring': ['James Norton', 'Robson Green', 'Morven Christie']}\nOnce you get to know the town and its characters, it is hard to walk away. Great writing. I don't watch this for the mystery but for everything else.\nLovely way to spend a rainy afternoon.\n{'Audio languages': ['English'], 'Subtitles': ['English [CC]'], 'Directors': ['Adriana Trigiani'], 'Producers': ['Donna Gigliotti', 'James Spies'], 'Starring': ['Ashley Judd', 'Patrick Wilson', 'Whoopi Goldberg'], 'Studio': ['Picturehouse']}\nI loved this film full of quirky characters. The chemistry among the cast was palpable. Four stars for the acting alone.\nGreat chemistry among the actors\n{'Content advisory': ['Violence', 'alcohol use', 'smoking', 'foul language', 'sexual content'], 'Audio languages': ['English'], 'Subtitles': ['English [CC]'], 'Directors': ['Max Adams'], 'Producers': ['Randall Emmet', 'George Furla', 'Barry Brooker', 'Stan Wertlieb'], 'Starring': ['Mark-Paul Gosselaar', 'Bruce Willis', 'Claire Forlani'], 'Studio': ['Lionsgate']}\nFun to watch.\nFour Stars\n{'Content advisory': ['Violence', 'substance use', 'alcohol use', 'smoking', 'foul language', 'sexual content'], 'Audio languages': ['English'], 'Subtitles': ['English [CC]'], 'Directors': ['Antoine Fuqua'], 'Producers': ['Erik Howsam', 'Lorenzo Di Bonaventura', 'Ric Kidney'], 'Starring': ['Mark Wahlberg', 'Michael Pe\u00f1a', 'Danny Glover'], 'Studio': ['Paramount']}\nOne of my all-time favorite movies. When I'm sick on the couch, this is what I turn to. I have no idea why, none of the actors are my particular favorites. It must be the story-line.\nWeirdly, one of my favorites\nDora and the Lost City of Gold\nComedy, Fantasy, Exciting, Fun\n['Having spent most of her life exploring the jungle, nothing prepared Dora for her most dangerous adventure yet - high school. Along with a group of teens and Boots the monkey.']\n{'Content advisory': ['Violence', 'foul language'], 'Audio languages': ['English', 'English [Audio Description]'], 'Subtitles': ['English [CC]'], 'Directors': ['James Bobin'], 'Producers': ['Kristin Burr', 'Julia Pistor', 'Eugenio Derbez', 'John G. Scotti'], 'Starring': ['Isabela Moner', 'Eugenio Derbez', 'Michael Pena']}\nSo cute. Entertaining for all. I heart the \"love yourself\" message without being childish. So much like the old Sesame Street.\n5 stars\n{'Content advisory': ['Violence', 'substance use', 'alcohol use', 'foul language', 'sexual content'], 'Audio languages': ['English'], 'Subtitles': ['English [CC]'], 'Directors': ['Sean Anders'], 'Producers': ['Mark Wahlberg', 'Steve Levinson', 'Sean Anders', 'John Morris', 'Marc Evans'], 'Starring': ['Mark Wahlberg', 'Rose Byrne', 'Isabela Moner']}\nI liked this movie more than I thought I would. The acting is good. The story entertaining. This movie showed healthy affection among people that seemed weird only because this is not portrayed on film or TV much. I loved the adoption message. I'm glad the movie pointed out all of the things that adoption would involve that is not hearts and rainbows. It looks like hard work that normal people can choose to partake in.\nI would watch this again\n{'Content advisory': ['Violence', 'alcohol use', 'smoking', 'foul language', 'sexual content'], 'Audio languages': ['English', 'English [Audio Description]'], 'Subtitles': ['English [CC]'], 'Directors': ['Brian Duffield'], 'Producers': ['Brian Duffield', 'Marc Bienstock', 'Don Dunn', 'Nicki Cortese', 'Max Siemers', 'Jordan Levin', 'Matthew Signer', 'Aaron Starmer', 'Matt Kaplan', 'Brett Bouttier', 'Scott Levine'], 'Starring': ['Katherine Langford', 'Charlie Plummer', 'Yvonne Orji']}\nIt was a fine movie. Silly, dramatic teenagers.\nIt was a fine movie\n{'Content advisory': ['Nudity', 'violence', 'alcohol use', 'foul language', 'sexual content'], 'Audio languages': ['English Dialogue Boost: High', 'English', 'English Dialogue Boost: Medium'], 'Subtitles': ['English [CC]'], 'Directors': ['Rose Troche'], 'Producers': ['Richard Alan Reid', 'Michael Philip', 'Jason Moring'], 'Starring': ['Keiynan Lonsdale', 'Dylan Sprouse', 'Sarah Hyland'], 'Studio': ['Amazon Studios']}\nWhile away an afternoon watching this silly rom-com.\nWhile away an afternoon watching this silly rom-com.",
  "actual_interaction": {
    "rating": 4.0,
    "title": "While away an afternoon watching this silly rom-com.",
    "text": "While away an afternoon watching this silly rom-com.",
    "images": [],
    "asin": "B09TJXSBQN",
    "parent_asin": "B09TJXSBQN",
    "user_id": "AFFSVGDWICQTPM3LR7EOUE4CNXFQ",
    "timestamp": "2022-07-18 18:50:09.619000",
    "helpful_vote": 0,
    "verified_purchase": true,
    "main_category": "Prime Video",
    "title_meta": null,
    "average_rating": 4.3,
    "rating_number": 157,
    "features": null,
    "description": null,
    "price": null,
    "images_meta": [
      {
        "360w": "https://images-na.ssl-images-amazon.com/images/S/pv-target-images/eb5e9bcd100aaa938608d2a15311cfb6cf5f60a30474730b4e7ffb2609224860._RI_TTW_SX360_FMwebp_.jpg",
        "480w": "https://images-na.ssl-images-amazon.com/images/S/pv-target-images/eb5e9bcd100aaa938608d2a15311cfb6cf5f60a30474730b4e7ffb2609224860._RI_TTW_SX480_FMwebp_.jpg",
        "720w": "https://images-na.ssl-images-amazon.com/images/S/pv-target-images/eb5e9bcd100aaa938608d2a15311cfb6cf5f60a30474730b4e7ffb2609224860._RI_TTW_SX720_FMwebp_.jpg",
        "1080w": "https://images-na.ssl-images-amazon.com/images/S/pv-target-images/eb5e9bcd100aaa938608d2a15311cfb6cf5f60a30474730b4e7ffb2609224860._RI_TTW_SX1080_FMwebp_.jpg",
        "1440w": "https://images-na.ssl-images-amazon.com/images/S/pv-target-images/eb5e9bcd100aaa938608d2a15311cfb6cf5f60a30474730b4e7ffb2609224860._RI_TTW_SX1440_FMwebp_.jpg",
        "1920w": "https://images-na.ssl-images-amazon.com/images/S/pv-target-images/eb5e9bcd100aaa938608d2a15311cfb6cf5f60a30474730b4e7ffb2609224860._RI_TTW_SX1920_FMwebp_.jpg",
        "variant": "MAIN"
      }
    ],
    "videos": [],
    "store": null,
    "categories": null,
    "details": {
      "Content advisory": [
        "Nudity",
        "violence",
        "alcohol use",
        "foul language",
        "sexual content"
      ],
      "Audio languages": [
        "English Dialogue Boost: High",
        "English",
        "English Dialogue Boost: Medium"
      ],
      "Subtitles": [
        "English [CC]"
      ],
      "Directors": [
        "Rose Troche"
      ],
      "Producers": [
        "Richard Alan Reid",
        "Michael Philip",
        "Jason Moring"
      ],
      "Starring": [
        "Keiynan Lonsdale",
        "Dylan Sprouse",
        "Sarah Hyland"
      ],
      "Studio": [
        "Amazon Studios"
      ]
    },
    "bought_together": null,
    "subtitle": null,
    "author": NaN
  }
}