{
  "interaction_number": 15,
  "interaction_summary": "=== Purchase Information ===\nReview Date: 2016/09/05\nAverage Rating: 4.5\nProduct Details: {'Audio languages': ['English'], 'Subtitles': ['English [CC]'], 'Directors': ['Jay Roach'], 'Producers': ['Michael London', 'Janice Williams', 'Shivani Rawat', 'Monica Levinson', 'Nimitt Mankad', 'John McNamara', 'Kevin Kelly Brown', 'Kelly Mullen'], 'Starring': ['Bryan Cranston', 'Diane Lane', 'Helen Mirren'], 'Studio': ['Bleecker Street Media LLC']}\nReview Text: Liked it\nReview Title: Five Stars\nRating: 5.0\n--------------------------------------------------",
  "reference_summary": "Grizzly Man\nTimothy Treadwell  (Actor),     Werner Herzog  (Director)    Rated:    R    Format: DVD\nMovies & TV, Studio Specials, Lionsgate Home Entertainment, Lionsgate Indie Selects\n['In this mesmerizing new film, acclaimed director Werner Herzog explores the life and death of amateur grizzly bear expert and wildlife preservationist Timothy Treadwell, who lived unarmed among grizzlies for 13 summers.']\n{'Genre': 'Documentary', 'Format': 'Multiple Formats, Closed-captioned, Color, Dolby, NTSC, Subtitled, Widescreen', 'Contributor': 'Timothy Treadwell, Werner Herzog', 'Language': 'English (Dolby Digital 2.0 Surround), Unqualified', 'Runtime': '1 hour and 43 minutes', 'Aspect Ratio': '1.78:1', 'Is Discontinued By Manufacturer': 'No', 'MPAA rating': 'R (Restricted)', 'Product Dimensions': '0.7 x 7.5 x 5.4 inches; 0.01 Ounces', 'Audio Description': 'English', 'Item model number': '31398186366', 'Director': 'Werner Herzog', 'Media Format': 'Multiple Formats, Closed-captioned, Color, Dolby, NTSC, Subtitled, Widescreen', 'Run time': '1 hour and 43 minutes', 'Release date': 'December 26, 2005', 'Actors': 'Timothy Treadwell', 'Subtitles': 'Spanish', 'Studio': 'Lionsgate', 'Country of Origin': 'USA', 'Number of discs': '1'}\nI thought I was going to see some really outstanding grizzly filming.  This movie should have been labeled \"One man's descent into insanity\".  Timothy Treadwell was a self absorbed,selfish, egocentric man and this story is about him and not the bears.  Due to his own behavior he became a  dish for one of the bears.  Too bad he took someone else along with him to his death. A couple of the bears he \"loved\" so much had to be murdered because of his behavior.  I would not recommend this movie.\nConservationist? Who? Timothy Treadwell?\nThe Way\nEmilio Estevez  (Actor, Director),     Martin Sheen  (Actor)    Rated:    PG-13    Format: DVD\nMovies & TV, Independently Distributed, Drama\n['\"The Way\" is a powerful and inspirational story about family, friends, and the challenges we face while navigating this ever-changing and complicated world. Martin Sheen plays Tom, who comes to St. Jean Pied de Port, France to collect the remains of his adult son , killed in the Pyrenees in a storm while walking the Camino de Santiago,. Rather than return home, Tom decides to embark on the historical pilgrimage to honor his son\\'s desire to finish the journey. What Tom doesn\\'t plan on is the profound impact the journey will have on him. From the unexpected and, oftentimes, amusing experiences along \"The Way,\" Tom begins to learn what it means to be a citizen of the world again. Through his unresolved relationship with his son, he discovers the difference between \"the life we live and the life we choose.\"']\n{'Format': 'Multiple Formats, Color, Dolby, NTSC, Widescreen', 'Contributor': 'Emilio Estevez, Martin Sheen', 'Language': 'English', 'Runtime': '2 hours and 1 minute', 'Studio': 'Arc Entertainment', 'Is Discontinued By Manufacturer': 'No', 'MPAA rating': 'PG-13 (Parents Strongly Cautioned)', 'Product Dimensions': '5.4 x 0.6 x 7.5 inches; 2.4 Ounces', 'Director': 'Emilio Estevez', 'Media Format': 'Multiple Formats, Color, Dolby, NTSC, Widescreen', 'Run time': '2 hours and 1 minute', 'Release date': 'February 21, 2012', 'Actors': 'Emilio Estevez, Martin Sheen', 'Subtitles': 'Spanish', 'Number of discs': '1'}\nI've added The Way to my list of all time favorite movies.  I'm surprised it didn't do better at the box office.\nExcellent and thoughtful movie\nAlpha House\nComedy, Drama\n[\"An Amazon Original series: They work in the Senate. They live in the house - Alpha House. Created by Garry Trudeau (Doonesbury, Tanner '88).\"]\n{'Content advisory': ['Nudity', 'violence', 'alcohol use', 'smoking', 'foul language', 'sexual content'], 'Audio languages': ['English Dialogue Boost: High', 'English', 'English Dialogue Boost: Medium', 'Deutsch'], 'Subtitles': ['English [CC]', 'Deutsch'], 'Directors': ['Adam Bernstein', 'Michael Mayer', 'Andrew McCarthy', 'Bob Balaban', 'Jann Turner', 'Jake Schreier', 'Antoine Douaihy', 'Clark Johnson', 'Michael Pressman'], 'Producers': ['Jonathan Alter']}\nI am impressed with the program and the actors involved. I hope this is not the way Washington really is. However, I suspect that it is.<br />I look forward to each week's episodes. When I watched the first episode I wasn't sure this program would be cancelled. Now I'm hooked and look forward to each new episode.\nA excellent tv program\n{'Content advisory': ['Violence', 'alcohol use', 'smoking', 'foul language', 'sexual content'], 'Audio languages': ['English'], 'Subtitles': ['English [CC]'], 'Directors': ['Lee Daniels'], 'Producers': ['Pamela Oas Williams', 'Laura Ziskin', 'Lee Daniels', 'Buddy Patrick', 'Cassian Elwes'], 'Starring': ['Forest Whitaker', 'Oprah Winfrey', 'Mariah Carey'], 'Studio': ['Lionsgate']}\nThis movie spanned about 70 years. It was more of a movie about civil rights. Entwined was the real life story of the White House Buller. Forest Whitaker played the role well and deserves accolades for his performance.\nWonderful movie\n{'Audio languages': ['English'], 'Subtitles': ['English [CC]'], 'Directors': ['David Frankel', 'Mikael Salomon', 'Tom Hanks', 'David Leland', 'Richard Loncraine', 'David Nutter', 'Phil Alden Robinson', 'Tony To'], 'Producers': ['Tom Hanks', 'Steven Spielberg', 'Mary Richards'], 'Starring': ['Patrick Dempsey', 'Rick Gomez', 'Scott Grimes'], 'Studio': ['Discovery Global']}\nVery intense. I wonder how anyone came back sane. Well done.\nFive Stars\n{'Content advisory': ['Nudity', 'violence', 'alcohol use', 'smoking', 'foul language', 'sexual content'], 'Audio languages': ['English', 'English [Audio Description]', 'Espa\u00f1ol (Espa\u00f1a)', 'Italiano', 'Espa\u00f1ol (Latinoam\u00e9rica)', 'Polski', '\u65e5\u672c\u8a9e', 'Portugu\u00eas', 'Deutsch', 'Fran\u00e7ais'], 'Subtitles': ['English [CC]', '\u0627\u0644\u0639\u0631\u0628\u064a\u0629', '\u010ce\u0161tina', 'Dansk', '\u0395\u03bb\u03bb\u03b7\u03bd\u03b9\u03ba\u03ac', 'Suomi', 'Filipino', '\u05e2\u05d1\u05e8\u05d9\u05ea', '\u0939\u093f\u0928\u094d\u0926\u0940', 'Magyar', 'Indonesia', '\u65e5\u672c\u8a9e', '\ud55c\uad6d\uc5b4', 'Bahasa Melayu', 'Norsk Bokm\u00e5l', 'Nederlands', 'Polski', 'Portugu\u00eas', 'Rom\u00e2n\u0103', '\u0420\u0443\u0441\u0441\u043a\u0438\u0439', 'Svenska', '\u0ba4\u0bae\u0bbf\u0bb4\u0bcd', '\u0c24\u0c46\u0c32\u0c41\u0c17\u0c41', '\u0e44\u0e17\u0e22', 'T\u00fcrk\u00e7e', '\u0423\u043a\u0440\u0430\u0457\u043d\u0441\u044c\u043a\u0430', 'Ti\u1ebfng Vi\u1ec7t', '\u4e2d\u6587\uff08\u7b80\u4f53\uff09', '\u4e2d\u6587\uff08\u7e41\u9ad4\uff09'], 'Directors': ['Joey Soloway', 'Andrea Arnold', 'Nisha Ganatra', 'Silas Howard', 'Jim Frohna', 'Stacie Passon', 'Marta Cunningham', 'Allison Liddi-Brown', 'Marielle Heller', 'So Yong Kim'], 'Producers': ['Joey Soloway', 'Nisha Ganatra', 'Andrea Sperling', 'Victor Hsu', 'Bridget Bedard', 'Rick Rosenthal', 'Jennifer Corey'], 'Starring': ['Jeffrey Tambor', 'Gaby Hoffmann', 'Jay Duplass'], 'Studio': ['Amazon Studios']}\nExcellent and funny but faces very important life issues. Excited about season 2.\nFunny but serious\nAll Is Lost\nDrama, Adventure, Bold, Compelling\n['Academy Award winner Robert Redford \"gives a solo tour-de-force in this awards-caliber adventure\" (NY Post) about one man\\'s battle for survival against the elements on the open sea.']\n{'Content advisory': ['Violence', 'foul language'], 'Audio languages': ['English'], 'Subtitles': ['English [CC]'], 'Directors': ['J.C. Chandor'], 'Producers': ['Neal Dodson', 'Anna Gerb', 'Justin Nappi', 'Teddy Schwarzman'], 'Starring': ['Robert Redford']}\nMy husband and I sailors. This sailor(?) wouldn't make it out of the harbor.\nCan't believe Redford made this film.\n{'Audio languages': ['English', 'English [Audio Description]'], 'Subtitles': ['English [CC]'], 'Directors': ['Seth Rogen'], 'Producers': ['Seth Rogen'], 'Starring': ['James Franco', 'Seth Rogen', 'Lizzy Caplan'], 'Studio': ['Columbia Pictures']}\nBoring and a waste of time.\nWaste of time\n{'Subtitles': ['None available'], 'Directors': ['Martin Scorsese'], 'Producers': ['Irwin Winkler'], 'Starring': ['Robert De Niro', 'Ray Liotta', 'Joe Pesci'], 'Studio': ['WARNER BROS.']}\nI've watched Goodfellas several time and shall watch it again.\nFive Stars\nWhiplash\nDrama, Arts, Entertainment, and Culture, Inspiring, Malicious\n['Winner of 3 Academy Awards\u00ae, WHIPLASH tells the story of an ambitious student drummer (Miles Teller) and his ruthless teacher (J.K. Simmons) who will stop at nothing to achieve perfection.']\n{'Content advisory': ['Violence', 'alcohol use', 'foul language', 'sexual content'], 'Audio languages': ['English'], 'Subtitles': ['English [CC]'], 'Directors': ['Damien Chazelle'], 'Producers': ['David Lancaster', 'Michel Litvak', 'Jason Blum', 'Helen Estabrook'], 'Starring': ['Miles Teller', 'Melissa Benoist', 'Paul Reiser']}\nWonderful movie and I'll watch it again. Powerful acting.\nShould watch\n{'Content advisory': ['Violence', 'alcohol use', 'smoking', 'foul language', 'sexual content'], 'Audio languages': ['English'], 'Subtitles': ['English [CC]'], 'Directors': ['David Ayer'], 'Producers': ['Bill Block', 'David Ayer', 'Ethan Smith', 'John Lesher'], 'Starring': ['Brad Pitt', 'Shia LaBeouf', 'Logan Lerman'], 'Studio': ['Columbia Pictures']}\nRealistic movie about the end of WWII.\nFive Stars\n{'Content advisory': ['Nudity', 'violence', 'alcohol use', 'smoking', 'foul language', 'sexual content'], 'Audio languages': ['English Dialogue Boost: High', 'English', 'English [Audio Description]', 'English Dialogue Boost: Medium', 'Espa\u00f1ol', 'Deutsch'], 'Subtitles': ['English [CC]', 'Deutsch', 'Espa\u00f1ol'], 'Directors': ['Alex Zakrzewski', 'Ernest R. Dickerson', 'Patrick Cady', 'Aaron Lipstadt', 'Kevin Dowling', 'Adam Davidson', 'Daisy von Scherler Mayer', 'Tim Hunter', 'Christine Moore', 'Zetna Fuentes'], 'Producers': ['Eric Overmyer', 'Michael Connelly', 'Henrik Bastin', 'Mikkel Bondesen', 'Pieter Jan Brugge', 'Jan David Frouman'], 'Starring': ['Titus Welliver', 'Jamie Hector', 'Amy Aquino'], 'Studio': ['Amazon Studios']}\nI've read all the Bosch books. This series is a compilation  of several books. The series is extremely well done. I can't wait for the next season to begin.\nI've read all the Bosch books. This series is ...\n{'Audio languages': ['English'], 'Subtitles': ['English [CC]'], 'Directors': ['George Stevens'], 'Producers': ['George Stevens', 'George Stevens Jr.'], 'Starring': ['Millie Perkins', 'Diane Baker', 'Shelley Winters'], 'Studio': ['Fox']}\nAs always an excellent book. What else is there to say?\nFive Stars\n{'Content advisory': ['Nudity', 'violence', 'substance use', 'alcohol use', 'smoking', 'foul language', 'sexual content'], 'Audio languages': ['English', 'English [Audio Description]'], 'Subtitles': ['English [CC]'], 'Directors': ['Ben Taylor'], 'Producers': ['Rob Delaney', 'Sharon Horgan', 'Richard Allen-Turner', 'Kara Baker', 'Jon Thoday'], 'Starring': ['Sharon Horgan', 'Rob Delaney'], 'Studio': ['Amazon Studios']}\nReally funny.\nFive Stars\n{'Audio languages': ['English'], 'Subtitles': ['English [CC]'], 'Directors': ['Jay Roach'], 'Producers': ['Michael London', 'Janice Williams', 'Shivani Rawat', 'Monica Levinson', 'Nimitt Mankad', 'John McNamara', 'Kevin Kelly Brown', 'Kelly Mullen'], 'Starring': ['Bryan Cranston', 'Diane Lane', 'Helen Mirren'], 'Studio': ['Bleecker Street Media LLC']}\nLiked it\nFive Stars",
  "actual_interaction": {
    "rating": 5.0,
    "title": "Five Stars",
    "text": "Liked it",
    "images": [],
    "asin": "B0180IAA6W",
    "parent_asin": "B0180IAA6W",
    "user_id": "AH6KLKXP5SO3PKYC6XNZQMCJLJTQ",
    "timestamp": "2016-09-05 18:44:25",
    "helpful_vote": 0,
    "verified_purchase": false,
    "main_category": "Prime Video",
    "title_meta": null,
    "average_rating": 4.5,
    "rating_number": 7494,
    "features": null,
    "description": null,
    "price": null,
    "images_meta": [
      {
        "360w": "https://images-na.ssl-images-amazon.com/images/S/pv-target-images/b47ace7b2cd41c2e86e3b1b5d5d5a9491e85e0177f85d3cb29bf4071d2003951._RI_SX360_FMwebp_.jpg",
        "480w": "https://images-na.ssl-images-amazon.com/images/S/pv-target-images/b47ace7b2cd41c2e86e3b1b5d5d5a9491e85e0177f85d3cb29bf4071d2003951._RI_SX480_FMwebp_.jpg",
        "720w": "https://images-na.ssl-images-amazon.com/images/S/pv-target-images/b47ace7b2cd41c2e86e3b1b5d5d5a9491e85e0177f85d3cb29bf4071d2003951._RI_SX720_FMwebp_.jpg",
        "1080w": "https://images-na.ssl-images-amazon.com/images/S/pv-target-images/b47ace7b2cd41c2e86e3b1b5d5d5a9491e85e0177f85d3cb29bf4071d2003951._RI_SX1080_FMwebp_.jpg",
        "1440w": "https://images-na.ssl-images-amazon.com/images/S/pv-target-images/b47ace7b2cd41c2e86e3b1b5d5d5a9491e85e0177f85d3cb29bf4071d2003951._RI_SX1440_FMwebp_.jpg",
        "1920w": "https://images-na.ssl-images-amazon.com/images/S/pv-target-images/b47ace7b2cd41c2e86e3b1b5d5d5a9491e85e0177f85d3cb29bf4071d2003951._RI_SX1920_FMwebp_.jpg",
        "variant": "MAIN"
      }
    ],
    "videos": [],
    "store": null,
    "categories": null,
    "details": {
      "Audio languages": [
        "English"
      ],
      "Subtitles": [
        "English [CC]"
      ],
      "Directors": [
        "Jay Roach"
      ],
      "Producers": [
        "Michael London",
        "Janice Williams",
        "Shivani Rawat",
        "Monica Levinson",
        "Nimitt Mankad",
        "John McNamara",
        "Kevin Kelly Brown",
        "Kelly Mullen"
      ],
      "Starring": [
        "Bryan Cranston",
        "Diane Lane",
        "Helen Mirren"
      ],
      "Studio": [
        "Bleecker Street Media LLC"
      ]
    },
    "bought_together": null,
    "subtitle": null,
    "author": NaN
  }
}