{
  "interaction_number": 17,
  "interaction_summary": "=== Purchase Information ===\nProduct Title: Downton Abbey Movie & TV Collection - Collector's Edition (DVD)\nReview Date: 2022/09/14\nStore: Hugh Bonneville  (Actor),     Michelle Dockery  (Actor),     Michael Engler  (Director)    &                   0                  more   Rated:    NR    Format: DVD\nCategories: Movies & TV, Genre for Featured Categories, Drama\nProduct Description: ['Downton Abbey, with all its splendor and scandal, has found its way into the hearts of millions around the globe. Now the full collection of six award-winning seasons and one sensational movie is yours to treasure, forever. Home to the Crawley family and their servants, Downton appears to be all elegance and order upon first glance, but no family is ever quite what it seems. Between the desires and dreams of all the residents, both upstairs and downstairs, a day in this household is never far from high drama. Re-live the laughter, tears, tragedy and triumph leading up to the most spectacular event in the history of this grand estate, a Royal visit.', 'Bonus Content:', 'Disc 1 - Downton Abbey: Season One:', 'Episode 1 - Commentary', 'Episode 1 - Commentary', 'Episode 2 - Commentary', 'Episode 2 - Commentary', 'Disc 3 - Downton Abbey: Season One:', 'A House in History - Downton Abbey', 'A House in History - Downton Abbey', 'The Making of Downton Abbey', 'The Making of Downton Abbey', 'Deleted Scenes', 'Deleted Scenes', 'Disc 4 - Downton Abbey: Season Two:', 'Episode 1 - Commentary', 'Episode 1 - Commentary', 'Disc 6 - Downton Abbey: Season Two:', 'Deleted Scenes', 'Deleted Scenes', 'House to Hospital', 'House to Hospital', 'Fashion and Uniforms', 'Fashion and Uniforms', 'Romance in a Time of Warfare', 'Romance in a Time of Warfare', 'Disc 7 - Downton Abbey: Season Three:', 'The Wedding of Lady Mary', 'The Wedding of Lady Mary', 'The Wedding of Lady Edith', 'The Wedding of Lady Edith', 'Shirley MacLaine at Downton Abbey', 'Shirley MacLaine at Downton Abbey', 'Disc 8 - Downton Abbey: Season Three:', 'The Men of Downton Abbey', 'The Men of Downton Abbey', 'Disc 9 - Downton Abbey: Season Three:', 'Downton Abbey in 1920', 'Downton Abbey in 1920', 'Behind the Scenes: The Cricket Match', 'Behind the Scenes: The Cricket Match', 'Behind the Scenes: A Journey to the Highlands', 'Behind the Scenes: A Journey to the Highlands', 'Disc 12 - Downton Abbey: Season Four:', 'The Making Of', 'The Making Of', 'The Downton Diaries', 'The Downton Diaries', 'New Arrivals', 'New Arrivals', 'Disc 15 - Downton Abbey: Season Five:', 'Behind the Scenes: Day 100', 'Behind the Scenes: Day 100', 'A Day with Lady Rose', 'A Day with Lady Rose', 'The Roaring Twenties', 'The Roaring Twenties', 'Disc 18 - Downton Abbey: Season Six:', 'The Cars of Downton', 'The Cars of Downton', 'Farewell to Highclere', 'Farewell to Highclere', 'Changing Times at Downton', 'Changing Times at Downton', 'Disc 19 - Downton Abbey: Season Six:', 'The Manners of Downton Abbey', 'The Manners of Downton Abbey', 'More Manners of Downton Abbey', 'More Manners of Downton Abbey', 'Disc 20:', 'The Story of Downton Abbey', 'The Story of Downton Abbey', \"The Creators' Favourite Scenes\", \"The Creators' Favourite Scenes\", \"Supercuts: The Dowager's Finest Moments\", \"Supercuts: The Dowager's Finest Moments\", 'Supercuts: The Best of Mrs. Patmore', 'Supercuts: The Best of Mrs. Patmore', 'Supercuts: The Best of the Downton Rows', 'Supercuts: The Best of the Downton Rows', 'Supercuts: The Social Calendar', 'Supercuts: The Social Calendar', \"Supercuts: Downton's Most Shocking Moments\", \"Supercuts: Downton's Most Shocking Moments\", 'Supercuts: Historical Moments in Downton Abbey', 'Supercuts: Historical Moments in Downton Abbey', 'Supercuts: Steamy Downton Moments', 'Supercuts: Steamy Downton Moments', 'Supercuts: Downton Abbey Weddings', 'Supercuts: Downton Abbey Weddings', 'Supercuts: Dressing for Downton', 'Supercuts: Dressing for Downton', 'Disc 21:', 'Character Documentaries: Lady Mary Crawley', 'Character Documentaries: Lady Mary Crawley', 'Character Documentaries: Mr. Carson', 'Character Documentaries: Mr. Carson', 'Character Documentaries: Mr. Bates', 'Character Documentaries: Mr. Bates', 'Character Documentaries: Daisy', 'Character Documentaries: Daisy', 'Character Documentaries: Lord Grantham', 'Character Documentaries: Lord Grantham', 'Character Documentaries: Lady Grantham', 'Character Documentaries: Lady Grantham', 'Character Documentaries: Lady Edith Crawley', 'Character Documentaries: Lady Edith Crawley', 'Disc 22 - Downton Abbey (Movie, 2019):', 'Cast Conversations', 'Cast Conversations', 'The Royal Visit', 'The Royal Visit', 'True to the Twenties', 'True to the Twenties', 'Deleted Scenes', 'Deleted Scenes', 'Welcome to Downton Abbey', 'Welcome to Downton Abbey', 'The Brilliance of Julian Fellowes', 'The Brilliance of Julian Fellowes', 'Feature Commentary with Director Michael Engler', 'Feature Commentary with Director Michael Engler', ']]>']\nAverage Rating: 4.8\nProduct Details: {'Aspect Ratio': '1.78:1, 2.39:1', 'Is Discontinued By Manufacturer': 'No', 'MPAA rating': 'NR (Not Rated)', 'Product Dimensions': '0.7 x 7.5 x 5.4 inches; 3.32 Pounds', 'Director': 'Michael Engler', 'Media Format': 'NTSC, Subtitled', 'Run time': '53 hours and 35 minutes', 'Release date': 'November 10, 2020', 'Actors': 'Hugh Bonneville, Michelle Dockery, Elizabeth McGovern, Laura Carmichael, Maggie Smith', 'Subtitles': 'French, Spanish', 'Producers': 'Gareth Neame, Julian Fellowes, Liz Trubridge', 'Language': 'Spanish (Dolby Digital 5.1), English (Dolby Digital 5.1), English (Dolby Digital 2.0), French (Dolby Digital 2.0)', 'Studio': 'Universal Pictures Home Entertainment', 'Writers': 'Julian Fellowes', 'Number of discs': '22'}\nReview Text: Good acting\nReview Title: Great story\nRating: 5.0\n--------------------------------------------------",
  "reference_summary": "Sid the Science Kid: Sid in Motion\nSid the Science Kid  (Actor),     Katy Garretson  (Director),     David Gumpel  (Director)    &                   0                  more   Rated:    Unrated    Format: DVD\nMovies & TV, Featured Categories, DVD, Kids & Family\n[\"Sid the Science Kid \u2122 is trying out his new dance, Sid Slide to the Side, on his hardwood floors when he discovers that friction prevents him from sliding in his sneakers. When he plays ball, he quickly learns that if a ball doesn't have enough elasticity, it won't bounce! This calls for some serious investigating! After pretending to be Super Sid by kicking the ball with all his might, Sid and his friends take a trip to the Science Center to investigate how using lots of force makes things move far and fast! Join Sid and his friends as they explore the laws of motion!\"]\n{'MPAA rating': 'Unrated (Not Rated)', 'Product Dimensions': '0.7 x 7.5 x 5.4 inches; 2.72 Ounces', 'Item model number': '8646994', 'Director': 'Katy Garretson, David Gumpel', 'Media Format': 'Multiple Formats, Color, Animated, NTSC', 'Run time': '1 minute', 'Release date': 'January 10, 2012', 'Actors': 'Sid the Science Kid', 'Studio': 'Ncircle', 'Number of discs': '1'}\nSid the science kid is a must for young kids. My grandson starting watching it at age three and has picked up an amazing vocabulary and science concepts. I find it entertaining, too. Quick delivery, reliable seller.\nOne of the best!\nSid the Science Kid: Sense-Ational Adventures\nSid and Friends  (Actor),     The Jim Henson Company  (Director)    Rated:    Unrated    Format: DVD\nMovies & TV, Genre for Featured Categories, Kids & Family\n[\"Did you hear that? Can you see this? What's that smell? Sid and his friends are embarking on a quest to explore vision, hearing, touch, smell and taste! Sid wonders why the tag on his shirt is really itchy so his class explores all the different textures around them. Sid is curious about why Grandma's glasses help her see clearly, but make things blurry for him. But when it comes to hearing, is it possible that Sid has super powers? Find out all about Sid's Super Duper Senses and find out about your own senses in these sense-sational stories!\"]\n{'MPAA rating': 'Unrated (Not Rated)', 'Product Dimensions': '0.7 x 7.5 x 5.4 inches; 2.72 Ounces', 'Item model number': '6313446', 'Director': 'The Jim Henson Company', 'Media Format': 'Multiple Formats, Animated, Color, NTSC', 'Run time': '1 hour and 55 minutes', 'Release date': 'January 4, 2011', 'Actors': 'Sid and Friends', 'Studio': 'Ncircle', 'Number of discs': '1'}\nSid the science kid is a must for young kids. My grandson starting watching it at age three and has picked up an amazing vocabulary and science concepts. I find it entertaining, too. Quick delivery, reliable seller.\nSid is GREAT!!!!\nMcCabe & Mrs. Miller\nWarren Beatty  (Actor),     Julie Christie  (Actor),     Robert Altman  (Director, Writer)    &                   0                  more   Rated:    R    Format: DVD\nMovies & TV, Studio Specials, Warner Home Video, All Titles\n['A frontier gambler and madam protect their booming business from outside investors. Directed by Robert Altman.']\n{'Aspect Ratio': '2.35:1', 'Is Discontinued By Manufacturer': 'No', 'MPAA rating': 'R (Restricted)', 'Product Dimensions': '7.75 x 5.5 x 0.5 inches; 3.2 Ounces', 'Director': 'Robert Altman', 'Media Format': 'Anamorphic, Closed-captioned, Color, DVD, Subtitled, Widescreen, NTSC', 'Run time': '2 hours and 1 minute', 'Release date': 'June 4, 2002', 'Actors': 'Warren Beatty, Julie Christie, Rene Auberjonois, William Devane, John Schuck', 'Subtitles': 'English, Spanish, French, Portuguese, Japanese', 'Language': 'Unqualified (DTS ES 6.1), French (Dolby Digital 2.0), English (Dolby Digital 2.0)', 'Studio': 'Warner Home Video', 'Writers': 'Edmund Naughton, Robert Altman, Brian McKay', 'Number of discs': '1'}\nIf you are a Beatty and Christy fan, you will enjoy this movie. My favorite part is the music, a lot of songs sung by Leonard Cohen.<br />Worth watching for the scenery and music!\nOne of my favorites\nBroadway Musicals: A Jewish Legacy\nJoel Grey  (Actor),     Michael Kantor  (Director)    Rated:    NR    Format: DVD\nMovies & TV, Genre for Featured Categories, Documentary\n['Recent Peabody Award winner as seen on PBS', \"Performances by Matthew Broderick, Kelli O'Hara, Zero Mostel, Nathan Lane, Barbra Streisand, Idina Menzel, Kristin Chenoweth, and many more  Engaging, humorous, and provocative,\", 'Broadway Musicals: A Jewish Legacy', \"examines the unique role of Jewish composers and lyricists in the creation of the modern American musical. The film showcases the work of legends such as Irving Berlin, Jerome Kern, George and Ira Gershwin, Lorenz Hart, Richard Rodgers, Oscar Hammerstein II, Leonard Bernstein, and Stephen Sondheim. Interviews with songwriters and luminaries including Sheldon Harnick, Stephen Schwartz, Harold Prince, Arthur Laurents, Charles Strouse, and Mel Brooks provide insight, alongside standout performances and archival footage.  Narrated by Tony\u00ae and Academy Award\u00ae winner Joel Grey, this entertaining documentary mingles cultural history with illuminating perspectives on the origins and meanings of some of Broadway's most beloved songs, stories, and shows.\"]\n{'Genre': 'Special Interests', 'Format': 'Multiple Formats, Color, NTSC, Widescreen', 'Contributor': 'Joel Grey, Michael Kantor', 'Language': 'English', 'Runtime': '1 hour and 24 minutes', 'Is Discontinued By Manufacturer': 'No', 'MPAA rating': 'NR (Not Rated)', 'Product Dimensions': '0.7 x 7.5 x 5.4 inches; 2.4 Ounces', 'Item model number': '26355977', 'Director': 'Michael Kantor', 'Media Format': 'Multiple Formats, Color, NTSC, Widescreen', 'Run time': '1 hour and 24 minutes', 'Release date': 'May 7, 2013', 'Actors': 'Joel Grey', 'Studio': 'Acorn', 'Number of discs': '2'}\nThis has great songs and music and raw footage of the old stars. It was both very informative and enjoyable!\nWonderful DVD\nCrazy from the Heart [VHS]\nFormat: VHS Tape\nMovies & TV, Featured Categories\n[\"A small-town, high-school principal still living at home with her mother shakes up her life in a way that even she never expected when she agrees to go out on a date with her school's Hispanic janitor.\"]\n{'Is Discontinued By Manufacturer': 'No', 'Package Dimensions': '7.32 x 4.19 x 1.12 inches; 0.01 Ounces', 'Media Format': 'VHS'}\nWonderful film, now available on DVD, do a google search! and It's worth what you have to pay for it!\nGreat film, now on DVD\nJane Eyre [DVD]\nMia Wasikowska  (Actor),     Michael Fassbender  (Actor),     Cary Joji Fukunaga  (Director)    &                   0                  more   Rated:    PG-13    Format: DVD\nMovies & TV, Genre for Featured Categories, Drama\n{'Genre': 'Drama, Romance, Arthouse', 'Format': 'Multiple Formats, AC-3, Color, Dolby, Dubbed, NTSC, Subtitled, Widescreen', 'Contributor': \"Jamie Bell, Michael O'Connor, Sally Hawkins, Tamzin Merchant, Michael Fassbender, Alison Owen, Romy Settbon Moore, Judi Dench, Mia Wasikowska, Holliday Grainger, Amelia Clarkson, Moira Buffini, Imogen Poots, Paul Trijbits, Freya Parks, Cary Joji FukunagaJamie Bell, Michael O'Connor, Sally Hawkins, Tamzin Merchant, Michael Fassbender, Alison Owen, Romy Settbon Moore, Judi Dench, Mia Wasikowska, Holliday Grainger, Amelia Clarkson, Moira Buffini, Imogen Poots, Paul Trijbits, Freya Parks, Cary Joji Fukunaga  See more\", 'Initial release date': '2017-07-04', 'Language': 'English'}\nOk film. Actors just so-so. There are a lot better versions around. And nothing can compare to the original with Orson Welles and<br />Joan Fontaine.\nNot my favorite Jane Eyre\nSid the Science Kid: Weather Kid Sid\nSid  (Actor, Director)    Rated:    NR    Format: DVD\nMovies & TV, Genre for Featured Categories, Kids & Family\n[\"*Teachers' Choice Award: Excellence in Classroom Products 2014* Rain, rain, go away; Sid the Science Kid wants to play! Sid s not too happy when rain threatens to squash his play date outside. But the more Sid learns about the rain, the more he understands how important precipitation is. In fact Sid is learning about all kinds of weather patterns and how it affects our world. At school Sid studies the sun and how it lights up our world. At home, Sid s family visits relatives where it s really chilly. Brrrr! It s cold in here... Sid hits the science lab to discover that wind, rain and sun can be fascinating and fun!\"]\n{'Genre': 'Kids & Family', 'Format': 'Multiple Formats, Animated, Color, NTSC', 'Contributor': 'Sid', 'Language': 'Unqualified', 'Number Of Discs': '1', 'Is Discontinued By Manufacturer': 'No', 'MPAA rating': 'NR (Not Rated)', 'Product Dimensions': '0.7 x 7.5 x 5.4 inches; 1.6 Ounces', 'Item model number': '100376', 'Director': 'Sid', 'Media Format': 'Multiple Formats, Animated, Color, NTSC', 'Run time': '1 hour and 55 minutes', 'Release date': 'December 1, 2009', 'Actors': 'Sid', 'Studio': 'Sid Science Kid', 'Number of discs': '1'}\nGood for 3-4 year olds. Teaches a lot about science and new terminology. My 3 year old Grandson loved him!.\nGrandson loves him.\nAndrew Lloyd Webber's Love Never Dies [DVD]\nBen Lewis  (Actor),     Anna O'Byrne  (Actor),     Brett Sullivan  (Director, Producer)    &                   0                  more   Rated:    NR    Format: DVD\nMovies & TV, Genre for Featured Categories, Drama\n[\"Set 10 years later, the Phantom has escaped from Paris to New York where he lives amongst the joy rides and freak shows of Coney Island. He has finally found a place for his music to soar, all that is missing is his love Christine Daa\u00e9. In a bid to win back her love, the Phantom lures Christine, her husband Raoul, and their young son Gustave from Manhattan, to the glittering and glorious world of Coney Island... they have no idea what lies in store for them... You truly haven't experienced Andrew Lloyd Webber's Love Never Dies until you see this spectacular new Australian production, filmed at Melbourne's iconic Regent Theatre.\", 'Bonus Content:', 'The Making of Love Never Dies', 'The Making of Love Never Dies', ']]>']\n{'Genre': 'Musicals, Arts, Culture & Entertainment, Arthouse', 'Format': 'Multiple Formats, Color, Dolby, NTSC, Subtitled, Widescreen', 'Contributor': \"Maria Mercedes, Ben Lewis, Simon Gleeson, Brett Sullivan, Anna O'Byrne, Clayton Jacobsen, Sharon MillerchipMaria Mercedes, Ben Lewis, Simon Gleeson, Brett Sullivan, Anna O'Byrne, Clayton Jacobsen, Sharon Millerchip  See more\", 'Initial release date': '2012-05-29', 'Language': 'English (Dolby Digital 5.1), English (Dolby Digital 2.0)', 'Aspect Ratio': '2.35:1', 'Is Discontinued By Manufacturer': 'No', 'MPAA rating': 'NR (Not Rated)', 'Item model number': '25148870', 'Director': 'Brett Sullivan', 'Media Format': 'Multiple Formats, Color, Dolby, NTSC, Subtitled, Widescreen', 'Run time': '2 hours and 1 minute', 'Release date': 'May 29, 2012', 'Actors': \"Ben Lewis, Anna O'Byrne, Maria Mercedes, Simon Gleeson, Sharon Millerchip\", 'Subtitles': 'French, Spanish', 'Producers': 'Clayton Jacobsen, Brett Sullivan', 'Studio': 'Studio Distribution Services', 'Number of discs': '1'}\nI am a big Phantom fan so when this came out I was eager to have it. It is similar in tone and style and continues story line. Somehow just not as good as original...takes place in Coney Island, NY.\nInteresting sequel\nThe Phantom of the Opera at the Royal Albert Hall\nRamin Karimloo  (Actor),     Sierra Boggess  (Actor)    Rated:    NR    Format: DVD\nMovies & TV, Genre for Featured Categories, Musicals\n['In celebration of the 25th Anniversary of Andrew Lloyd Webber\u2019s', 'The Phantom of the Opera', ', Cameron Mackintosh produced a unique, spectacular staging of the musical on a scale which had never been seen before. Inspired by the original staging by Hal Prince and Gillian Lynne, this lavish, fully-staged production set in the sumptuous Victorian splendour of London\u2019s legendary Royal Albert Hall features a cast and orchestra of over 200, plus some very special guest appearances.']\n{'Genre': 'Musicals, Arts, Culture & Entertainment', 'Format': 'Multiple Formats, Color, Dolby, AC-3, NTSC, Subtitled, Widescreen', 'Contributor': 'Gareth Snook, Andrew Lloyd Webber, Hadley Fraser, Wynne Evans, Sierra Boggess, Barry James, Liz Robertson, Sergei Polunin, Ramin Karimloo, Wendy FergusonGareth Snook, Andrew Lloyd Webber, Hadley Fraser, Wynne Evans, Sierra Boggess, Barry James, Liz Robertson, Sergei Polunin, Ramin Karimloo, Wendy Ferguson  See more', 'Initial release date': '2012-02-07', 'Language': 'English (Dolby Digital 5.1), English (Dolby Digital 2.0)', 'Aspect Ratio': '1.78:1', 'Is Discontinued By Manufacturer': 'No', 'MPAA rating': 'NR (Not Rated)', 'Product Dimensions': '0.7 x 7.5 x 5.4 inches; 2.26 Ounces', 'Item model number': '24185086', 'Media Format': 'Multiple Formats, Color, Dolby, AC-3, NTSC, Subtitled, Widescreen', 'Run time': '2 hours and 40 minutes', 'Release date': 'February 7, 2012', 'Actors': 'Ramin Karimloo, Sierra Boggess, Hadley Fraser, Wendy Ferguson, Barry James', 'Subtitles': 'Spanish, French', 'Studio': 'Studio Distribution Services', 'Country of Origin': 'USA', 'Number of discs': '1'}\nLove the music\nFour Stars\nMasterpiece: Downton Abbey Season 6\nHugh Bonneville, Laura Carmichael, Michelle Dockery, Maggie Smith, Jim Carter  (Actor),     .  (Director)    Rated:    PG    Format: DVD\nMovies & TV, Featured Categories, DVD, Drama\n['Return to Downton Abbey for the sixth and final season to discover the fates of the Crawley family, and the servants who work for them, as they face new challenges and begin forging different paths in a rapidly changing world. Creator Julian Fellowes brings the top PBS drama of all time to its climactic chapter, with the beloved ensemble led by Hugh Bonneville, Michelle Dockery, Elizabeth McGovern, and Maggie Smith.']\n{'Is Discontinued By Manufacturer': 'No', 'MPAA rating': 'PG (Parental Guidance Suggested)', 'Product Dimensions': '0.7 x 7.5 x 5.4 inches; 6.4 Ounces', 'Item model number': '02578', 'Media Format': 'Multiple Formats, NTSC, Widescreen', 'Run time': '9 hours', 'Release date': 'January 26, 2016', 'Actors': 'Hugh Bonneville, Laura Carmichael, Michelle Dockery, Maggie Smith, Jim Carter', 'Subtitles': 'English', 'Studio': 'PBS (Direct)', 'Number of discs': '1'}\nWonderful!\nFive Stars\nJesus Christ Superstar\nTed Neeley  (Actor),     Carl Anderson  (Actor),     Norman Jewison  (Director, Producer, Writer)    &                   0                  more   Rated:    G    Format: DVD\nMovies & TV, Featured Categories, DVD, Drama\n[\"This dazzling interpretation of the hit Tim Rice - Andrew Lloyd Webber rock opera tells the story of Christ's (Ted Neeley) final weeks in a bold and epic production. Shot entirely on location in Israel, producer-director Norman Jewison creates a brilliant example of modern movie making with groundbreaking vision and the unforgettable songs of Rice and Webber. Nominated for several Golden Globe Awards including Best Picture, Best Actor and Best Actress, this legendary classic is now a must-have Special Edition.Bonus Content:\", 'An Exclusive Interview with Master Lyricist Tim Rice', 'An Exclusive Interview with Master Lyricist Tim Rice', 'Feature Commentary with Directory Norman Jewison and Actor Ted Neeley', 'Feature Commentary with Directory Norman Jewison and Actor Ted Neeley', 'Photo Gallery', 'Photo Gallery']\n{'Genre': 'Musicals & Performing Arts, Drama, DVD Movie, Special Interests/Religion & Spirituality, Blu-ray MovieMusicals & Performing Arts, Drama, DVD Movie, Special Interests/Religion & Spirituality, Blu-ray Movie   See more', 'Format': 'Anamorphic, Color, DTS Surround Sound, Dolby, NTSC, Special Edition, Subtitled, Widescreen, Dubbed', 'Contributor': 'Ted Neeley, Barry Dennen, Yvonne Elliman, Bob Bingham, Larry T. Marshall, Melvyn Bragg, Carl Anderson, Philip Toubus, Robert Stigwood, Josh Mostel, Kurt Yaghjian, Norman JewisonTed Neeley, Barry Dennen, Yvonne Elliman, Bob Bingham, Larry T. Marshall, Melvyn Bragg, Carl Anderson, Philip Toubus, Robert Stigwood, Josh Mostel, Kurt Yaghjian, Norman Jewison   See more', 'Language': 'Unqualified, English, French (Dolby Digital 2.0 Stereo)', 'Number Of Discs': '1', 'Aspect Ratio': '2.35:1', 'Is Discontinued By Manufacturer': 'No', 'MPAA rating': 'G (General Audience)', 'Product Dimensions': '7.75 x 5.75 x 0.53 inches; 0.99 Ounces', 'Item model number': '25192578625', 'Director': 'Norman Jewison', 'Media Format': 'Anamorphic, Color, DTS Surround Sound, Dolby, NTSC, Special Edition, Subtitled, Widescreen, Dubbed', 'Run time': '1 hour and 47 minutes', 'Release date': 'August 31, 2004', 'Actors': 'Ted Neeley, Carl Anderson, Yvonne Elliman, Barry Dennen, Bob Bingham', 'Dubbed': 'French', 'Subtitles': 'French, Spanish', 'Producers': 'Norman Jewison, Robert Stigwood', 'Studio': 'Universal Pictures Home Entertainment', 'Writers': 'Melvyn Bragg, Norman Jewison', 'Country of Origin': 'USA', 'Number of discs': '1'}\nThe stage show is a lot better. Movie too modern for my taste.\nThree Stars\n{'Audio languages': ['English'], 'Subtitles': ['English [CC]'], 'Directors': ['Martin McDonagh'], 'Producers': ['Graham Broadbent', 'Pete Czernin', 'Martin McDonagh'], 'Starring': ['Frances McDormand', 'Woody Harrelson', 'Sam Rockwell'], 'Studio': ['Searchlight']}\nI hate depressing movies. Otherwise fine acting, well made.\nThree Stars\nThe Shape of Water\nSuspense, Drama, Fantastic, Tense\n[\"From master storyteller Guillermo del Toro comes an otherworldly fairy tale set in 1960s America where a woman's life is changed forever after she discovers a secret experiment.\"]\n{'Audio languages': ['English'], 'Subtitles': ['English [CC]'], 'Directors': ['Guillermo Del Toro'], 'Producers': ['Guillermo del Toro', 'J. Miles Dale'], 'Starring': ['Sally Hawkins', 'Michael Shannon', 'Richard Jenkins']}\nWorth seeing, very unusual.\nFour Stars\n{'Content advisory': ['Violence', 'alcohol use', 'smoking', 'foul language'], 'Audio languages': ['English', 'English [Audio Description]'], 'Subtitles': ['English [CC]'], 'Directors': ['Joe Wright'], 'Producers': ['Tim Bevan', 'Eric Fellner', 'Lisa Bruce', 'Anthony McCarten', 'Douglas Urbanski'], 'Starring': ['Gary Oldman', 'Kristin Scott Thomas', 'Lily James']}\nGreat film and acting!\nFive Stars\nThe Godfather 3-Movie Collection\nVarious  (Actor)    Rated:    R    Format: DVD\nMovies & TV, Paramount Home Entertainment, Drama\n{'Is Discontinued By Manufacturer': 'No', 'MPAA rating': 'R (Restricted)', 'Product Dimensions': '0.7 x 7.5 x 5.4 inches; 7.52 Ounces', 'Item model number': '59173264000', 'Media Format': 'Multiple Formats, Box set, Color, Dubbed, Subtitled, Widescreen, NTSC', 'Run time': '9 hours and 9 minutes', 'Release date': 'October 6, 2015', 'Actors': 'Various', 'Dubbed': 'French', 'Subtitles': 'Spanish, French, English', 'Studio': 'Paramount Pictures Home Entertainment', 'Country of Origin': 'USA', 'Number of discs': '3'}\nLoved it!\nGreat movie!\nPhantom of the Opera\nGerard Butler  (Actor),     Emmy Rossum  (Actor)    Rated:    PG-13    Format: DVD\nMovies & TV, MGM Home Entertainment, All MGM Titles\n[\"He is a genius whose rapturous music fills the Opera Populaire of 1870 Paris - and a solitary soul hiding his disfigurement behind a mask and dwelling in the catacombs below. But he can no longer hide his love for young soprano Christine. And the phantom may emerge from the shadows past the point of no return.   The stage musical sensation magically and hauntingly comes to the screen in director Joel Schumacher's lavish production, sweeping audiences aloft to new cinematic heights of sight-and-sound grandeur. Gerard Butler (the Phantom), Emmy Rossum (the National Board of Review Breakthrough Performance Award winner as Christine) and Patrick Wilson (as Raoul) play the fateful love triangle that unfurls in splendor, suspense - and in the music of the night.   Format: Closed-captioned, Color, Dolby, NTSC, Subtitled, Widescreen  Language: English (Dolby Digital 5.1), French (Dolby Digital 5.1)  Subtitles: English, Spanish, French  Region 1 (U.S. and Canada only)  Number of discs: 1  Rated: PG-13  Run Time: 141 minutes\"]\n{'Is Discontinued By Manufacturer': 'No', 'MPAA rating': 'PG-13 (Parents Strongly Cautioned)', 'Product Dimensions': '7.5 x 0.5 x 5.5 inches; 3.21 Ounces', 'Media Format': 'NTSC', 'Run time': '2 hours and 21 minutes', 'Release date': 'December 7, 2004', 'Actors': 'Gerard Butler, Emmy Rossum, Patrick Wilson, Miranda Richardson, Minnie Driver', 'Dubbed': 'French', 'Subtitles': 'English', 'Language': 'Unqualified (Dolby Digital 5.1)', 'Studio': 'MGM (Video & DVD)'}\nOne of my favorites!\nGreat film\nDownton Abbey Movie & TV Collection - Collector's Edition (DVD)\nHugh Bonneville  (Actor),     Michelle Dockery  (Actor),     Michael Engler  (Director)    &                   0                  more   Rated:    NR    Format: DVD\nMovies & TV, Genre for Featured Categories, Drama\n['Downton Abbey, with all its splendor and scandal, has found its way into the hearts of millions around the globe. Now the full collection of six award-winning seasons and one sensational movie is yours to treasure, forever. Home to the Crawley family and their servants, Downton appears to be all elegance and order upon first glance, but no family is ever quite what it seems. Between the desires and dreams of all the residents, both upstairs and downstairs, a day in this household is never far from high drama. Re-live the laughter, tears, tragedy and triumph leading up to the most spectacular event in the history of this grand estate, a Royal visit.', 'Bonus Content:', 'Disc 1 - Downton Abbey: Season One:', 'Episode 1 - Commentary', 'Episode 1 - Commentary', 'Episode 2 - Commentary', 'Episode 2 - Commentary', 'Disc 3 - Downton Abbey: Season One:', 'A House in History - Downton Abbey', 'A House in History - Downton Abbey', 'The Making of Downton Abbey', 'The Making of Downton Abbey', 'Deleted Scenes', 'Deleted Scenes', 'Disc 4 - Downton Abbey: Season Two:', 'Episode 1 - Commentary', 'Episode 1 - Commentary', 'Disc 6 - Downton Abbey: Season Two:', 'Deleted Scenes', 'Deleted Scenes', 'House to Hospital', 'House to Hospital', 'Fashion and Uniforms', 'Fashion and Uniforms', 'Romance in a Time of Warfare', 'Romance in a Time of Warfare', 'Disc 7 - Downton Abbey: Season Three:', 'The Wedding of Lady Mary', 'The Wedding of Lady Mary', 'The Wedding of Lady Edith', 'The Wedding of Lady Edith', 'Shirley MacLaine at Downton Abbey', 'Shirley MacLaine at Downton Abbey', 'Disc 8 - Downton Abbey: Season Three:', 'The Men of Downton Abbey', 'The Men of Downton Abbey', 'Disc 9 - Downton Abbey: Season Three:', 'Downton Abbey in 1920', 'Downton Abbey in 1920', 'Behind the Scenes: The Cricket Match', 'Behind the Scenes: The Cricket Match', 'Behind the Scenes: A Journey to the Highlands', 'Behind the Scenes: A Journey to the Highlands', 'Disc 12 - Downton Abbey: Season Four:', 'The Making Of', 'The Making Of', 'The Downton Diaries', 'The Downton Diaries', 'New Arrivals', 'New Arrivals', 'Disc 15 - Downton Abbey: Season Five:', 'Behind the Scenes: Day 100', 'Behind the Scenes: Day 100', 'A Day with Lady Rose', 'A Day with Lady Rose', 'The Roaring Twenties', 'The Roaring Twenties', 'Disc 18 - Downton Abbey: Season Six:', 'The Cars of Downton', 'The Cars of Downton', 'Farewell to Highclere', 'Farewell to Highclere', 'Changing Times at Downton', 'Changing Times at Downton', 'Disc 19 - Downton Abbey: Season Six:', 'The Manners of Downton Abbey', 'The Manners of Downton Abbey', 'More Manners of Downton Abbey', 'More Manners of Downton Abbey', 'Disc 20:', 'The Story of Downton Abbey', 'The Story of Downton Abbey', \"The Creators' Favourite Scenes\", \"The Creators' Favourite Scenes\", \"Supercuts: The Dowager's Finest Moments\", \"Supercuts: The Dowager's Finest Moments\", 'Supercuts: The Best of Mrs. Patmore', 'Supercuts: The Best of Mrs. Patmore', 'Supercuts: The Best of the Downton Rows', 'Supercuts: The Best of the Downton Rows', 'Supercuts: The Social Calendar', 'Supercuts: The Social Calendar', \"Supercuts: Downton's Most Shocking Moments\", \"Supercuts: Downton's Most Shocking Moments\", 'Supercuts: Historical Moments in Downton Abbey', 'Supercuts: Historical Moments in Downton Abbey', 'Supercuts: Steamy Downton Moments', 'Supercuts: Steamy Downton Moments', 'Supercuts: Downton Abbey Weddings', 'Supercuts: Downton Abbey Weddings', 'Supercuts: Dressing for Downton', 'Supercuts: Dressing for Downton', 'Disc 21:', 'Character Documentaries: Lady Mary Crawley', 'Character Documentaries: Lady Mary Crawley', 'Character Documentaries: Mr. Carson', 'Character Documentaries: Mr. Carson', 'Character Documentaries: Mr. Bates', 'Character Documentaries: Mr. Bates', 'Character Documentaries: Daisy', 'Character Documentaries: Daisy', 'Character Documentaries: Lord Grantham', 'Character Documentaries: Lord Grantham', 'Character Documentaries: Lady Grantham', 'Character Documentaries: Lady Grantham', 'Character Documentaries: Lady Edith Crawley', 'Character Documentaries: Lady Edith Crawley', 'Disc 22 - Downton Abbey (Movie, 2019):', 'Cast Conversations', 'Cast Conversations', 'The Royal Visit', 'The Royal Visit', 'True to the Twenties', 'True to the Twenties', 'Deleted Scenes', 'Deleted Scenes', 'Welcome to Downton Abbey', 'Welcome to Downton Abbey', 'The Brilliance of Julian Fellowes', 'The Brilliance of Julian Fellowes', 'Feature Commentary with Director Michael Engler', 'Feature Commentary with Director Michael Engler', ']]>']\n{'Aspect Ratio': '1.78:1, 2.39:1', 'Is Discontinued By Manufacturer': 'No', 'MPAA rating': 'NR (Not Rated)', 'Product Dimensions': '0.7 x 7.5 x 5.4 inches; 3.32 Pounds', 'Director': 'Michael Engler', 'Media Format': 'NTSC, Subtitled', 'Run time': '53 hours and 35 minutes', 'Release date': 'November 10, 2020', 'Actors': 'Hugh Bonneville, Michelle Dockery, Elizabeth McGovern, Laura Carmichael, Maggie Smith', 'Subtitles': 'French, Spanish', 'Producers': 'Gareth Neame, Julian Fellowes, Liz Trubridge', 'Language': 'Spanish (Dolby Digital 5.1), English (Dolby Digital 5.1), English (Dolby Digital 2.0), French (Dolby Digital 2.0)', 'Studio': 'Universal Pictures Home Entertainment', 'Writers': 'Julian Fellowes', 'Number of discs': '22'}\nGood acting\nGreat story",
  "actual_interaction": {
    "rating": 5.0,
    "title": "Great story",
    "text": "Good acting",
    "images": [],
    "asin": "B08HB6PVCQ",
    "parent_asin": "B08HB6PVCQ",
    "user_id": "AGJ2BFCJG5DPA72PALI6OY3BMZSQ",
    "timestamp": "2022-09-14 03:16:58.552000",
    "helpful_vote": 0,
    "verified_purchase": true,
    "main_category": "Movies & TV",
    "title_meta": "Downton Abbey Movie & TV Collection - Collector's Edition (DVD)",
    "average_rating": 4.8,
    "rating_number": 810,
    "features": [],
    "description": [
      "Downton Abbey, with all its splendor and scandal, has found its way into the hearts of millions around the globe. Now the full collection of six award-winning seasons and one sensational movie is yours to treasure, forever. Home to the Crawley family and their servants, Downton appears to be all elegance and order upon first glance, but no family is ever quite what it seems. Between the desires and dreams of all the residents, both upstairs and downstairs, a day in this household is never far from high drama. Re-live the laughter, tears, tragedy and triumph leading up to the most spectacular event in the history of this grand estate, a Royal visit.",
      "Bonus Content:",
      "Disc 1 - Downton Abbey: Season One:",
      "Episode 1 - Commentary",
      "Episode 1 - Commentary",
      "Episode 2 - Commentary",
      "Episode 2 - Commentary",
      "Disc 3 - Downton Abbey: Season One:",
      "A House in History - Downton Abbey",
      "A House in History - Downton Abbey",
      "The Making of Downton Abbey",
      "The Making of Downton Abbey",
      "Deleted Scenes",
      "Deleted Scenes",
      "Disc 4 - Downton Abbey: Season Two:",
      "Episode 1 - Commentary",
      "Episode 1 - Commentary",
      "Disc 6 - Downton Abbey: Season Two:",
      "Deleted Scenes",
      "Deleted Scenes",
      "House to Hospital",
      "House to Hospital",
      "Fashion and Uniforms",
      "Fashion and Uniforms",
      "Romance in a Time of Warfare",
      "Romance in a Time of Warfare",
      "Disc 7 - Downton Abbey: Season Three:",
      "The Wedding of Lady Mary",
      "The Wedding of Lady Mary",
      "The Wedding of Lady Edith",
      "The Wedding of Lady Edith",
      "Shirley MacLaine at Downton Abbey",
      "Shirley MacLaine at Downton Abbey",
      "Disc 8 - Downton Abbey: Season Three:",
      "The Men of Downton Abbey",
      "The Men of Downton Abbey",
      "Disc 9 - Downton Abbey: Season Three:",
      "Downton Abbey in 1920",
      "Downton Abbey in 1920",
      "Behind the Scenes: The Cricket Match",
      "Behind the Scenes: The Cricket Match",
      "Behind the Scenes: A Journey to the Highlands",
      "Behind the Scenes: A Journey to the Highlands",
      "Disc 12 - Downton Abbey: Season Four:",
      "The Making Of",
      "The Making Of",
      "The Downton Diaries",
      "The Downton Diaries",
      "New Arrivals",
      "New Arrivals",
      "Disc 15 - Downton Abbey: Season Five:",
      "Behind the Scenes: Day 100",
      "Behind the Scenes: Day 100",
      "A Day with Lady Rose",
      "A Day with Lady Rose",
      "The Roaring Twenties",
      "The Roaring Twenties",
      "Disc 18 - Downton Abbey: Season Six:",
      "The Cars of Downton",
      "The Cars of Downton",
      "Farewell to Highclere",
      "Farewell to Highclere",
      "Changing Times at Downton",
      "Changing Times at Downton",
      "Disc 19 - Downton Abbey: Season Six:",
      "The Manners of Downton Abbey",
      "The Manners of Downton Abbey",
      "More Manners of Downton Abbey",
      "More Manners of Downton Abbey",
      "Disc 20:",
      "The Story of Downton Abbey",
      "The Story of Downton Abbey",
      "The Creators' Favourite Scenes",
      "The Creators' Favourite Scenes",
      "Supercuts: The Dowager's Finest Moments",
      "Supercuts: The Dowager's Finest Moments",
      "Supercuts: The Best of Mrs. Patmore",
      "Supercuts: The Best of Mrs. Patmore",
      "Supercuts: The Best of the Downton Rows",
      "Supercuts: The Best of the Downton Rows",
      "Supercuts: The Social Calendar",
      "Supercuts: The Social Calendar",
      "Supercuts: Downton's Most Shocking Moments",
      "Supercuts: Downton's Most Shocking Moments",
      "Supercuts: Historical Moments in Downton Abbey",
      "Supercuts: Historical Moments in Downton Abbey",
      "Supercuts: Steamy Downton Moments",
      "Supercuts: Steamy Downton Moments",
      "Supercuts: Downton Abbey Weddings",
      "Supercuts: Downton Abbey Weddings",
      "Supercuts: Dressing for Downton",
      "Supercuts: Dressing for Downton",
      "Disc 21:",
      "Character Documentaries: Lady Mary Crawley",
      "Character Documentaries: Lady Mary Crawley",
      "Character Documentaries: Mr. Carson",
      "Character Documentaries: Mr. Carson",
      "Character Documentaries: Mr. Bates",
      "Character Documentaries: Mr. Bates",
      "Character Documentaries: Daisy",
      "Character Documentaries: Daisy",
      "Character Documentaries: Lord Grantham",
      "Character Documentaries: Lord Grantham",
      "Character Documentaries: Lady Grantham",
      "Character Documentaries: Lady Grantham",
      "Character Documentaries: Lady Edith Crawley",
      "Character Documentaries: Lady Edith Crawley",
      "Disc 22 - Downton Abbey (Movie, 2019):",
      "Cast Conversations",
      "Cast Conversations",
      "The Royal Visit",
      "The Royal Visit",
      "True to the Twenties",
      "True to the Twenties",
      "Deleted Scenes",
      "Deleted Scenes",
      "Welcome to Downton Abbey",
      "Welcome to Downton Abbey",
      "The Brilliance of Julian Fellowes",
      "The Brilliance of Julian Fellowes",
      "Feature Commentary with Director Michael Engler",
      "Feature Commentary with Director Michael Engler",
      "]]>"
    ],
    "price": 36.44,
    "images_meta": [
      {
        "thumb": "https://m.media-amazon.com/images/I/412JzufZ+oL._SX38_SY50_CR,0,0,38,50_.jpg",
        "large": "https://m.media-amazon.com/images/I/412JzufZ+oL.jpg",
        "variant": "MAIN",
        "hi_res": "https://m.media-amazon.com/images/I/61T4novbWOL._SL1500_.jpg"
      },
      {
        "thumb": "https://m.media-amazon.com/images/I/51buuJXXOyL._SX38_SY50_CR,0,0,38,50_.jpg",
        "large": "https://m.media-amazon.com/images/I/51buuJXXOyL.jpg",
        "variant": "BACK",
        "hi_res": "https://m.media-amazon.com/images/I/71oj2R5l6-L._SL1500_.jpg"
      }
    ],
    "videos": [],
    "store": "Hugh Bonneville  (Actor),     Michelle Dockery  (Actor),     Michael Engler  (Director)    &                   0                  more   Rated:    NR    Format: DVD",
    "categories": [
      "Movies & TV",
      "Genre for Featured Categories",
      "Drama"
    ],
    "details": {
      "Aspect Ratio": "1.78:1, 2.39:1",
      "Is Discontinued By Manufacturer": "No",
      "MPAA rating": "NR (Not Rated)",
      "Product Dimensions": "0.7 x 7.5 x 5.4 inches; 3.32 Pounds",
      "Director": "Michael Engler",
      "Media Format": "NTSC, Subtitled",
      "Run time": "53 hours and 35 minutes",
      "Release date": "November 10, 2020",
      "Actors": "Hugh Bonneville, Michelle Dockery, Elizabeth McGovern, Laura Carmichael, Maggie Smith",
      "Subtitles": "French, Spanish",
      "Producers": "Gareth Neame, Julian Fellowes, Liz Trubridge",
      "Language": "Spanish (Dolby Digital 5.1), English (Dolby Digital 5.1), English (Dolby Digital 2.0), French (Dolby Digital 2.0)",
      "Studio": "Universal Pictures Home Entertainment",
      "Writers": "Julian Fellowes",
      "Number of discs": "22"
    },
    "bought_together": null,
    "subtitle": NaN,
    "author": NaN
  }
}