{
  "interaction_number": 12,
  "interaction_summary": "=== Purchase Information ===\nProduct Title: The Tomorrow War\nReview Date: 2021/07/04\nCategories: Suspense, Drama, Compelling, Frightening\nProduct Description: ['Time travelers arrive from 2051 to deliver an urgent message: 30 years in the future mankind is losing a war against a deadly alien species. The only hope for survival is for soldiers and civilians to be transported to the future and join the fight. Determined to save the world for his daughter, Dan Forester teams up with a brilliant scientist and his estranged father to rewrite the planet\u2019s fate.']\nAverage Rating: 4.1\nProduct Details: {'Content advisory': ['Violence', 'alcohol use', 'foul language', 'sexual content'], 'Audio languages': ['English', 'English [Audio Description]', 'Fran\u00e7ais (Canada)', 'Italiano', '\u65e5\u672c\u8a9e', 'Portugu\u00eas', 'Deutsch', '\u0ba4\u0bae\u0bbf\u0bb4\u0bcd', '\u0939\u093f\u0928\u094d\u0926\u0940', 'Espa\u00f1ol (Espa\u00f1a)', 'Espa\u00f1ol (Latinoam\u00e9rica)', 'Polski', '\u010ce\u0161tina', 'Magyar', '\u0c24\u0c46\u0c32\u0c41\u0c17\u0c41', 'Fran\u00e7ais (France)'], 'Subtitles': ['English [CC]', '\u0627\u0644\u0639\u0631\u0628\u064a\u0629', '\u010ce\u0161tina', 'Dansk', 'Deutsch', '\u0395\u03bb\u03bb\u03b7\u03bd\u03b9\u03ba\u03ac', 'Espa\u00f1ol (Latinoam\u00e9rica)', 'Espa\u00f1ol (Espa\u00f1a)', 'Suomi', 'Filipino', 'Fran\u00e7ais (Canada)', 'Fran\u00e7ais (France)', '\u05e2\u05d1\u05e8\u05d9\u05ea', '\u0939\u093f\u0928\u094d\u0926\u0940', 'Magyar', 'Indonesia', 'Italiano', '\u65e5\u672c\u8a9e', '\ud55c\uad6d\uc5b4', 'Bahasa Melayu', 'Norsk Bokm\u00e5l', 'Nederlands', 'Polski', 'Portugu\u00eas (Brasil)', 'Portugu\u00eas (Portugal)', 'Rom\u00e2n\u0103', '\u0420\u0443\u0441\u0441\u043a\u0438\u0439', 'Svenska', '\u0ba4\u0bae\u0bbf\u0bb4\u0bcd', '\u0c24\u0c46\u0c32\u0c41\u0c17\u0c41', '\u0e44\u0e17\u0e22', 'T\u00fcrk\u00e7e', '\u4e2d\u6587\uff08\u7b80\u4f53\uff09', '\u4e2d\u6587\uff08\u7e41\u9ad4\uff09'], 'Directors': ['Chris McKay'], 'Producers': ['Rob Cowan', 'Leifur B. Dagfinnsson', 'Jules Daly', 'David Ellison', 'Bradley J. Fischer', 'Dana Goldberg', 'David S. Goyer', 'Don Granger', 'Hjortur Gretarsson'], 'Starring': ['Chris Pratt', 'J.K. Simmons', 'Yvonne Strahovski']}\nReview Text: Some of the reviews are negative, but i did not watch this film as a documentary or biography.  I found it as enjoyable as Independence Day.  You need to watch the entire movie to see why i am a bit freaked out about the premise.  Yikes !!  I do not like the idea but it was clever.\nReview Title: Enjoyable\nRating: 4.0\n--------------------------------------------------",
  "reference_summary": "Alpha House\nComedy, Drama\n[\"An Amazon Original series: They work in the Senate. They live in the house - Alpha House. Created by Garry Trudeau (Doonesbury, Tanner '88).\"]\n{'Content advisory': ['Nudity', 'violence', 'alcohol use', 'smoking', 'foul language', 'sexual content'], 'Audio languages': ['English Dialogue Boost: High', 'English', 'English Dialogue Boost: Medium', 'Deutsch'], 'Subtitles': ['English [CC]', 'Deutsch'], 'Directors': ['Adam Bernstein', 'Michael Mayer', 'Andrew McCarthy', 'Bob Balaban', 'Jann Turner', 'Jake Schreier', 'Antoine Douaihy', 'Clark Johnson', 'Michael Pressman'], 'Producers': ['Jonathan Alter']}\nI do not like politics in real life.  But this clever show makes me laugh because I think it might be closer to the truth than politicians will admit.\nFunny pokes at politics\nJustified\nSuspense, Western, Drama, Action\n[\"Deputy US Marshal Raylan Givens (Timothy Olyphant) will start to pick at the thread of a cold case over 30 years in the making, unraveling a riddle that echoes all the way back to his boyhood and his criminal father's bad dealings. Meanwhile, Boyd Crowder (Walton Goggins) finds his grip on Harlan loosening due to a Pentecostal preacher with a penchant for theatrics and a knack for manipulation...\"]\n{'Content advisory': ['Violence', 'substance use', 'alcohol use', 'foul language', 'sexual content'], 'Audio languages': ['English'], 'Subtitles': ['English [CC]'], 'Directors': ['Adam Arkin', 'Jon Avnet', 'Peter Werner', 'Michael Dinner', 'John Dahl', 'Bill Johnson', 'Michael W. Watkins', 'Gwyneth Horder-Payton', 'Don Kurt', 'Dean Parisot'], 'Producers': ['Fred Golan', 'Sarah Timberman', 'Carl Beverly', 'Michael Dinner', 'Graham Yost', 'Elmore Leonard']}\nI enjoy westerners.  Justified is a modern day cowboy tale.  Even some of the bad guys are loveable and others are just plain fun to hate.  Every once in awhile, I find myself boo and hissing at events.\nlove the modern day cowboy\n{'Audio languages': ['English', 'English [Audio Description]'], 'Subtitles': ['English [CC]'], 'Directors': ['Richard Starzak', 'Christopher Sadler', 'Jay Grace', 'Lee Wilton', 'Seamus Malone', 'Jean-Philippe Vine', 'Richard Webber', 'Will Becher', 'Mike Mort', 'Dave Osmand'], 'Starring': ['John Sparkes', 'Justin Fletcher', 'Kate Harbour'], 'Studio': ['Aardman Animations']}\nLove Shaun the Sheep.  He IA always thinking.  He doesn't miss a beat, I hope you will be able to meet, Shaun the Sheep.  I love Shirley and Timmy too\nDont miss a beat, come watch Shaun the Sheep\n{'Content advisory': ['Nudity', 'violence', 'substance use', 'alcohol use', 'smoking', 'foul language', 'sexual content'], 'Audio languages': ['English Dialogue Boost: High', 'English', 'English [Audio Description]', 'English Dialogue Boost: Medium', 'English Dialogue Boost: Low', 'Italiano', '\u65e5\u672c\u8a9e', 'Portugu\u00eas', 'Deutsch', 'Espa\u00f1ol (Espa\u00f1a)', 'Espa\u00f1ol (Latinoam\u00e9rica)', 'Polski', 'Fran\u00e7ais'], 'Subtitles': ['English [CC]', '\u0627\u0644\u0639\u0631\u0628\u064a\u0629', '\u010ce\u0161tina', 'Dansk', 'Deutsch', '\u0395\u03bb\u03bb\u03b7\u03bd\u03b9\u03ba\u03ac', 'Espa\u00f1ol (Latinoam\u00e9rica)', 'Espa\u00f1ol (Espa\u00f1a)', 'Suomi', 'Filipino', 'Fran\u00e7ais', '\u05e2\u05d1\u05e8\u05d9\u05ea', '\u0939\u093f\u0928\u094d\u0926\u0940', 'Magyar', 'Indonesia', 'Italiano', '\u65e5\u672c\u8a9e', '\ud55c\uad6d\uc5b4', 'Bahasa Melayu', 'Norsk Bokm\u00e5l', 'Nederlands', 'Polski', 'Portugu\u00eas (Brasil)', 'Portugu\u00eas (Portugal)', 'Rom\u00e2n\u0103', '\u0420\u0443\u0441\u0441\u043a\u0438\u0439', 'Svenska', '\u0ba4\u0bae\u0bbf\u0bb4\u0bcd', '\u0c24\u0c46\u0c32\u0c41\u0c17\u0c41', '\u0e44\u0e17\u0e22', 'T\u00fcrk\u00e7e', '\u0423\u043a\u0440\u0430\u0457\u043d\u0441\u044c\u043a\u0430', 'Ti\u1ebfng Vi\u1ec7t', '\u4e2d\u6587\uff08\u7b80\u4f53\uff09', '\u4e2d\u6587\uff08\u7e41\u9ad4\uff09'], 'Directors': ['Rosemary Rodriguez', 'Sarah Pia Anderson', 'Seth Gordon', 'Laura Innes', 'Craig Zisk', 'Michael Pressman', 'Adam Arkin'], 'Producers': ['James Degus', 'Margo Myers Massey'], 'Starring': ['Marin Ireland', 'Shane Mcrae', 'Giovanni Ribisi'], 'Studio': ['Amazon Studios']}\nOk, I hate it when a great pilot is shown, gets great reviews and isn't picked up.  This is a GREAT  story.  I love the blend of city and country settings, I like the characters, and I want to know what happens to brothers, cousins, and grandparents.  More, more, more please !!\nI Want To Know What's Next\n{'Content advisory': ['Violence', 'alcohol use', 'sexual content'], 'Subtitles': ['None available'], 'Directors': ['Niall MacCormick'], 'Producers': ['Helen Gregory'], 'Studio': ['Amazon Studios']}\nI recently read many of Trollope' s novels and was thrilled to see that a theatrical adaptation was available.  Yes the movie has some slight changes, but it is a great representation of Trollope' s work.  If you have not exposed yourself to his writing, it can be confusing at first, but all is made clear by the conclusion.  The movie was the same.  I felt as if I read the book for a second time.  Excellent\nLike Both Book and Movie\n{'Content advisory': ['Nudity', 'violence', 'substance use', 'alcohol use', 'smoking', 'foul language', 'sexual content'], 'Audio languages': ['English Dialogue Boost: High', 'English', 'English [Audio Description]', 'English Dialogue Boost: Medium', 'Espa\u00f1ol', 'Deutsch'], 'Subtitles': ['English [CC]', 'Deutsch', 'Espa\u00f1ol'], 'Directors': ['Alex Zakrzewski', 'Ernest R. Dickerson', 'Patrick Cady', 'Aaron Lipstadt', 'Kevin Dowling', 'Adam Davidson', 'Daisy von Scherler Mayer', 'Tim Hunter', 'Christine Moore', 'Zetna Fuentes'], 'Producers': ['Eric Overmyer', 'Michael Connelly', 'Henrik Bastin', 'Pieter Jan Brugge'], 'Starring': ['\u30bf\u30a4\u30bf\u30b9\u30fb\u30a6\u30a7\u30ea\u30d0\u30fc', '\u30b8\u30a7\u30a4\u30df\u30fc\u30fb\u3078\u30af\u30bf\u30fc', '\u30a8\u30a4\u30df\u30fc\u30fb\u30a2\u30ad\u30ce']}\nOk, my friend Linda got me hooked on the Harry Bosch novels.  Now she has me hooked on the series.  Can't wait for the next book nor the next season !!\nI Could Kick Linda\n{'Content advisory': ['Violence', 'alcohol use', 'smoking', 'foul language', 'sexual content'], 'Audio languages': ['English', 'English [Audio Description]', 'Espa\u00f1ol (Espa\u00f1a)', 'Italiano', 'Espa\u00f1ol (Latinoam\u00e9rica)', '\u65e5\u672c\u8a9e', 'Portugu\u00eas', 'Deutsch', 'Fran\u00e7ais'], 'Subtitles': ['English [CC]', '\u0627\u0644\u0639\u0631\u0628\u064a\u0629', '\u010ce\u0161tina', 'Dansk', 'Deutsch', '\u0395\u03bb\u03bb\u03b7\u03bd\u03b9\u03ba\u03ac', 'Espa\u00f1ol (Latinoam\u00e9rica)', 'Espa\u00f1ol (Espa\u00f1a)', 'Suomi', 'Filipino', 'Fran\u00e7ais', '\u05e2\u05d1\u05e8\u05d9\u05ea', '\u0939\u093f\u0928\u094d\u0926\u0940', 'Magyar', 'Indonesia', 'Italiano', '\u65e5\u672c\u8a9e', '\ud55c\uad6d\uc5b4', 'Bahasa Melayu', 'Norsk Bokm\u00e5l', 'Nederlands', 'Polski', 'Portugu\u00eas (Brasil)', 'Portugu\u00eas (Portugal)', 'Rom\u00e2n\u0103', '\u0420\u0443\u0441\u0441\u043a\u0438\u0439', 'Svenska', '\u0ba4\u0bae\u0bbf\u0bb4\u0bcd', '\u0c24\u0c46\u0c32\u0c41\u0c17\u0c41', '\u0e44\u0e17\u0e22', 'T\u00fcrk\u00e7e', '\u4e2d\u6587\uff08\u7b80\u4f53\uff09', '\u4e2d\u6587\uff08\u7e41\u9ad4\uff09'], 'Directors': ['Adam Davidson', 'Alex Zakrzewski', 'Sarah Pia Anderson', 'Ernest Dickerson', 'Christine Moore', 'Stephen Gyllenhaal'], 'Producers': ['Eric Overmyer', 'Michael Connelly', 'Henrik Bastin', 'Pieter Jan Brugge', 'Daniel Pyne'], 'Starring': ['Titus Welliver', 'Jamie Hector', 'Amy Aquino'], 'Studio': ['Amazon Studios']}\nOne of the best detective series available.  Bosch seems approachable but intense.  I enjoy that the Bosch in the novels and in the Amazon series are not exactly alike but very closely related.  Even if my Bosch novel character differs in my mind a bit from the Amazon Bosch, both represent an exceptional excellence in writing.  I don't watch much cable or network television but save my time for reading and Amazon series !!\nBosch Bosch Bosch\n{'Subtitles': ['None available'], 'Directors': ['David Duchovny'], 'Producers': ['Richard B. Lewis', 'Bob Yari', 'Jane Rosenthal'], 'Starring': ['Anton Yelchin', 'T\u00e9a Leoni', 'David Duchovny'], 'Studio': ['tribecashortlist']}\nAs I was watching this film, I was watching through the lives of the actors in real life.  It's touching how through the death in the film, life was lived.  As the actors have subsequently died, divorced, grew, changed, life continues and changes.  If I watched this film after it came out, I would have had a different perspective.  I am glad I ran across it now because it is so appropriate.\nIn The Light of Their Lives\n{'Content advisory': ['Alcohol use', 'foul language'], 'Audio languages': ['English'], 'Subtitles': ['English [CC]'], 'Directors': ['Mark Pellington'], 'Producers': [\"Kirk D'Amico\", 'Anne-Marie MacKay', 'Mark Pellington'], 'Starring': ['Shirley MacLaine', 'Amanda Seyfried', 'AnnJewel Lee Dixon'], 'Studio': ['BLEECKER STREET FILMS']}\nWe all know or have known one older person that seems to a pain in everyone's backside.  You might be that curmudgeon that people are polite, seemingly interested but melt away once your head is turned.  People, even bitchy old people can make a difference.  Listen to what they mean, not just what they say.  And they need to listen to themselves so that they might impart wisdom to the finale.  McClain is superb. Highly recommended.  Warning of foul language but I take that over a non violent, non graphically pictorial of sexual encounters.\nAppreciate the Curmudgeon\n{'Content advisory': ['Violence', 'substance use', 'alcohol use', 'smoking', 'foul language', 'sexual content'], 'Audio languages': ['English'], 'Subtitles': ['English [CC]', 'Fran\u00e7ais'], 'Directors': ['Tyler Perry'], 'Producers': ['Tyler Perry', 'Reuben Cannon'], 'Starring': ['Tyler Perry', 'Derek Luke', 'Keshia Knight Pulliam'], 'Studio': ['LIONSGATE']}\nGood movie.  Love the big with Dr Phil. Love the out take during the credits.  Tyler Perry might be getting tired of playing Madea but I will always love that old fart.\nI Love Madea\n{'Content advisory': ['Violence', 'alcohol use', 'smoking', 'foul language', 'sexual content'], 'Audio languages': ['English', 'English [Audio Description]'], 'Subtitles': ['English [CC]'], 'Directors': ['Jon Favreau'], 'Producers': ['Jon Favreau', 'Sergei Bespalov'], 'Starring': ['Jon Favreau', 'Sofia Vergara', 'John Leguizamo'], 'Studio': ['Open Road Films']}\nI enjoyed the characters, plot, and various messages in the film.  For some reason, the food inspired my mouth to water, my appetite to rage into Hulk like proportions, and my notes to self to find the best Cuban sandwiches in the area and visit tomorrow.  I am not usually influenced by food shows, but boy, honey, this little flick was uplifting and a great brief introduction into what really matters in life.. Love, family, friends, passion for your calling, and how your mind can be teased into torturing your appetite.  The only important person not raped was God.  Warning about a lot of cursing and some sexual discussions.\nRomance for the Taste Buds\nThe Tomorrow War\nSuspense, Drama, Compelling, Frightening\n['Time travelers arrive from 2051 to deliver an urgent message: 30 years in the future mankind is losing a war against a deadly alien species. The only hope for survival is for soldiers and civilians to be transported to the future and join the fight. Determined to save the world for his daughter, Dan Forester teams up with a brilliant scientist and his estranged father to rewrite the planet\u2019s fate.']\n{'Content advisory': ['Violence', 'alcohol use', 'foul language', 'sexual content'], 'Audio languages': ['English', 'English [Audio Description]', 'Fran\u00e7ais (Canada)', 'Italiano', '\u65e5\u672c\u8a9e', 'Portugu\u00eas', 'Deutsch', '\u0ba4\u0bae\u0bbf\u0bb4\u0bcd', '\u0939\u093f\u0928\u094d\u0926\u0940', 'Espa\u00f1ol (Espa\u00f1a)', 'Espa\u00f1ol (Latinoam\u00e9rica)', 'Polski', '\u010ce\u0161tina', 'Magyar', '\u0c24\u0c46\u0c32\u0c41\u0c17\u0c41', 'Fran\u00e7ais (France)'], 'Subtitles': ['English [CC]', '\u0627\u0644\u0639\u0631\u0628\u064a\u0629', '\u010ce\u0161tina', 'Dansk', 'Deutsch', '\u0395\u03bb\u03bb\u03b7\u03bd\u03b9\u03ba\u03ac', 'Espa\u00f1ol (Latinoam\u00e9rica)', 'Espa\u00f1ol (Espa\u00f1a)', 'Suomi', 'Filipino', 'Fran\u00e7ais (Canada)', 'Fran\u00e7ais (France)', '\u05e2\u05d1\u05e8\u05d9\u05ea', '\u0939\u093f\u0928\u094d\u0926\u0940', 'Magyar', 'Indonesia', 'Italiano', '\u65e5\u672c\u8a9e', '\ud55c\uad6d\uc5b4', 'Bahasa Melayu', 'Norsk Bokm\u00e5l', 'Nederlands', 'Polski', 'Portugu\u00eas (Brasil)', 'Portugu\u00eas (Portugal)', 'Rom\u00e2n\u0103', '\u0420\u0443\u0441\u0441\u043a\u0438\u0439', 'Svenska', '\u0ba4\u0bae\u0bbf\u0bb4\u0bcd', '\u0c24\u0c46\u0c32\u0c41\u0c17\u0c41', '\u0e44\u0e17\u0e22', 'T\u00fcrk\u00e7e', '\u4e2d\u6587\uff08\u7b80\u4f53\uff09', '\u4e2d\u6587\uff08\u7e41\u9ad4\uff09'], 'Directors': ['Chris McKay'], 'Producers': ['Rob Cowan', 'Leifur B. Dagfinnsson', 'Jules Daly', 'David Ellison', 'Bradley J. Fischer', 'Dana Goldberg', 'David S. Goyer', 'Don Granger', 'Hjortur Gretarsson'], 'Starring': ['Chris Pratt', 'J.K. Simmons', 'Yvonne Strahovski']}\nSome of the reviews are negative, but i did not watch this film as a documentary or biography.  I found it as enjoyable as Independence Day.  You need to watch the entire movie to see why i am a bit freaked out about the premise.  Yikes !!  I do not like the idea but it was clever.\nEnjoyable",
  "actual_interaction": {
    "rating": 4.0,
    "title": "Enjoyable",
    "text": "Some of the reviews are negative, but i did not watch this film as a documentary or biography.  I found it as enjoyable as Independence Day.  You need to watch the entire movie to see why i am a bit freaked out about the premise.  Yikes !!  I do not like the idea but it was clever.",
    "images": [],
    "asin": "B093CNZ7ST",
    "parent_asin": "B093CNZ7ST",
    "user_id": "AHQ63F2BFHJOMPOS4OR6MMTTH7BQ",
    "timestamp": "2021-07-04 05:54:55.393000",
    "helpful_vote": 0,
    "verified_purchase": true,
    "main_category": "Prime Video",
    "title_meta": "The Tomorrow War",
    "average_rating": 4.1,
    "rating_number": 33247,
    "features": [
      "IMDb 6.5",
      "2 h 18 min",
      "2021",
      "X-Ray",
      "HDR",
      "UHD",
      "PG-13"
    ],
    "description": [
      "Time travelers arrive from 2051 to deliver an urgent message: 30 years in the future mankind is losing a war against a deadly alien species. The only hope for survival is for soldiers and civilians to be transported to the future and join the fight. Determined to save the world for his daughter, Dan Forester teams up with a brilliant scientist and his estranged father to rewrite the planet\u2019s fate."
    ],
    "price": null,
    "images_meta": [
      {
        "360w": "https://images-na.ssl-images-amazon.com/images/S/pv-target-images/06e43e32087be701c6200cfc7ef1d49958b285a0deba4ed53ab9d2e16acd88c7._RI_SX360_FMwebp_.jpg",
        "480w": "https://images-na.ssl-images-amazon.com/images/S/pv-target-images/06e43e32087be701c6200cfc7ef1d49958b285a0deba4ed53ab9d2e16acd88c7._RI_SX480_FMwebp_.jpg",
        "720w": "https://images-na.ssl-images-amazon.com/images/S/pv-target-images/06e43e32087be701c6200cfc7ef1d49958b285a0deba4ed53ab9d2e16acd88c7._RI_SX720_FMwebp_.jpg",
        "1080w": "https://images-na.ssl-images-amazon.com/images/S/pv-target-images/06e43e32087be701c6200cfc7ef1d49958b285a0deba4ed53ab9d2e16acd88c7._RI_SX1080_FMwebp_.jpg",
        "1440w": "https://images-na.ssl-images-amazon.com/images/S/pv-target-images/06e43e32087be701c6200cfc7ef1d49958b285a0deba4ed53ab9d2e16acd88c7._RI_SX1440_FMwebp_.jpg",
        "1920w": "https://images-na.ssl-images-amazon.com/images/S/pv-target-images/06e43e32087be701c6200cfc7ef1d49958b285a0deba4ed53ab9d2e16acd88c7._RI_SX1920_FMwebp_.jpg",
        "variant": "MAIN"
      }
    ],
    "videos": [],
    "store": null,
    "categories": [
      "Suspense",
      "Drama",
      "Compelling",
      "Frightening"
    ],
    "details": {
      "Content advisory": [
        "Violence",
        "alcohol use",
        "foul language",
        "sexual content"
      ],
      "Audio languages": [
        "English",
        "English [Audio Description]",
        "Fran\u00e7ais (Canada)",
        "Italiano",
        "\u65e5\u672c\u8a9e",
        "Portugu\u00eas",
        "Deutsch",
        "\u0ba4\u0bae\u0bbf\u0bb4\u0bcd",
        "\u0939\u093f\u0928\u094d\u0926\u0940",
        "Espa\u00f1ol (Espa\u00f1a)",
        "Espa\u00f1ol (Latinoam\u00e9rica)",
        "Polski",
        "\u010ce\u0161tina",
        "Magyar",
        "\u0c24\u0c46\u0c32\u0c41\u0c17\u0c41",
        "Fran\u00e7ais (France)"
      ],
      "Subtitles": [
        "English [CC]",
        "\u0627\u0644\u0639\u0631\u0628\u064a\u0629",
        "\u010ce\u0161tina",
        "Dansk",
        "Deutsch",
        "\u0395\u03bb\u03bb\u03b7\u03bd\u03b9\u03ba\u03ac",
        "Espa\u00f1ol (Latinoam\u00e9rica)",
        "Espa\u00f1ol (Espa\u00f1a)",
        "Suomi",
        "Filipino",
        "Fran\u00e7ais (Canada)",
        "Fran\u00e7ais (France)",
        "\u05e2\u05d1\u05e8\u05d9\u05ea",
        "\u0939\u093f\u0928\u094d\u0926\u0940",
        "Magyar",
        "Indonesia",
        "Italiano",
        "\u65e5\u672c\u8a9e",
        "\ud55c\uad6d\uc5b4",
        "Bahasa Melayu",
        "Norsk Bokm\u00e5l",
        "Nederlands",
        "Polski",
        "Portugu\u00eas (Brasil)",
        "Portugu\u00eas (Portugal)",
        "Rom\u00e2n\u0103",
        "\u0420\u0443\u0441\u0441\u043a\u0438\u0439",
        "Svenska",
        "\u0ba4\u0bae\u0bbf\u0bb4\u0bcd",
        "\u0c24\u0c46\u0c32\u0c41\u0c17\u0c41",
        "\u0e44\u0e17\u0e22",
        "T\u00fcrk\u00e7e",
        "\u4e2d\u6587\uff08\u7b80\u4f53\uff09",
        "\u4e2d\u6587\uff08\u7e41\u9ad4\uff09"
      ],
      "Directors": [
        "Chris McKay"
      ],
      "Producers": [
        "Rob Cowan",
        "Leifur B. Dagfinnsson",
        "Jules Daly",
        "David Ellison",
        "Bradley J. Fischer",
        "Dana Goldberg",
        "David S. Goyer",
        "Don Granger",
        "Hjortur Gretarsson"
      ],
      "Starring": [
        "Chris Pratt",
        "J.K. Simmons",
        "Yvonne Strahovski"
      ]
    },
    "bought_together": null,
    "subtitle": null,
    "author": NaN
  }
}