{
  "interaction_number": 18,
  "interaction_summary": "=== Purchase Information ===\nReview Date: 2023/02/23\nAverage Rating: 5.0\nProduct Details: {'Content advisory': ['Violence', 'alcohol use', 'smoking', 'foul language', 'sexual content'], 'Audio languages': ['English', 'English [Audio Description]', 'English Dialogue Boost: High', 'English Dialogue Boost: Medium', 'Espa\u00f1ol (Espa\u00f1a)', 'Italiano', 'Espa\u00f1ol (Latinoam\u00e9rica)', 'Polski', '\u65e5\u672c\u8a9e', 'Portugu\u00eas', 'Deutsch', 'Fran\u00e7ais'], 'Subtitles': ['English [CC]', '\u0627\u0644\u0639\u0631\u0628\u064a\u0629', '\u010ce\u0161tina', 'Dansk', 'Deutsch', '\u0395\u03bb\u03bb\u03b7\u03bd\u03b9\u03ba\u03ac', 'Espa\u00f1ol (Latinoam\u00e9rica)', 'Espa\u00f1ol (Espa\u00f1a)', 'Suomi', 'Filipino', 'Fran\u00e7ais', '\u05e2\u05d1\u05e8\u05d9\u05ea', '\u0939\u093f\u0928\u094d\u0926\u0940', 'Magyar', 'Indonesia', 'Italiano', '\u65e5\u672c\u8a9e', '\ud55c\uad6d\uc5b4', 'Bahasa Melayu', 'Norsk Bokm\u00e5l', 'Nederlands', 'Polski', 'Portugu\u00eas (Brasil)', 'Portugu\u00eas (Portugal)', 'Rom\u00e2n\u0103', '\u0420\u0443\u0441\u0441\u043a\u0438\u0439', 'Svenska', '\u0ba4\u0bae\u0bbf\u0bb4\u0bcd', '\u0c24\u0c46\u0c32\u0c41\u0c17\u0c41', '\u0e44\u0e17\u0e22', 'T\u00fcrk\u00e7e', '\u0423\u043a\u0440\u0430\u0457\u043d\u0441\u044c\u043a\u0430', 'Ti\u1ebfng Vi\u1ec7t', '\u4e2d\u6587\uff08\u7b80\u4f53\uff09', '\u4e2d\u6587\uff08\u7e41\u9ad4\uff09'], 'Directors': ['Will Yapp'], 'Producers': ['Expectation Entertainment', 'Condao Productions'], 'Starring': ['Jeremy Clarkson'], 'Studio': ['Amazon Studios']}\nReview Text: This my favorite season so far. Season 1 was great but Season 2 is the best. I can hardly wait for Season 3!\nReview Title: Love it\nRating: 5.0\n--------------------------------------------------",
  "reference_summary": "Penny Dreadful: The Complete Series\nRory Kinnear  (Actor),     Josh Hartnett  (Actor)    Rated:    NR    Format: DVD\nMovies & TV, Paramount Home Entertainment, Boxed Sets\n[\"Some of literature's most terrifying characters, including Dr. Frankenstein and his monster, Dorian Gray, and iconic figures from the novel Dracula are lurking in the darkest corners of Victorian London. They are joined by a core of original characters in a complex, frightening new narrative, where personal demons from the past can be stronger than vampires, evil spirits and immortal beasts. Relive every chilling episode of Showtime's Penny Dreadful if you dare.\"]\n{'Genre': 'Television, Horror/Television', 'Format': 'AC-3, Box set, Dolby, Dubbed, Subtitled, Widescreen, NTSC', 'Contributor': 'Eva Green, Harry Treadaway, Rory Kinnear, Reeve Carney, Timothy Dalton, Josh Hartnett, Billie Piper', 'Language': 'English', 'Number Of Discs': '9', 'Is Discontinued By Manufacturer': 'No', 'MPAA rating': 'NR (Not Rated)', 'Product Dimensions': '0.7 x 7.5 x 5.4 inches; 9.74 Ounces', 'Media Format': 'AC-3, Box set, Dolby, Dubbed, Subtitled, Widescreen, NTSC', 'Run time': '24 hours and 22 minutes', 'Release date': 'July 18, 2017', 'Actors': 'Rory Kinnear, Josh Hartnett, Eva Green, Billie Piper, Harry Treadaway', 'Dubbed': 'Spanish', 'Subtitles': 'English', 'Studio': 'Paramount Pictures Home Entertainment', 'Country of Origin': 'USA', 'Number of discs': '9'}\nExcellent series. Really scary, superb acting and scenery. Too bad season 2 was too sexually graphic.\nGood series\n{'Content advisory': ['Violence', 'foul language', 'sexual content'], 'Audio languages': ['English'], 'Subtitles': ['English [CC]'], 'Directors': ['Haifaa Al-Mansour'], 'Producers': ['Amy Baer', 'Alan Moloney', 'Ruth Coady'], 'Starring': ['Elle Fanning', 'Maisie Williams', 'Bel Powley'], 'Studio': ['IFC Films']}\nThis is one of the best movies I have seen in a long time. I had no idea of the inspiration behind Mary Shelley's book Frankestein. It is remarkable how this intellectually gifted woman through life hardships could develop such book and character. Movie offers great depth. The actors are also remarkable\nI highly recommend it\n{'Audio languages': ['English Dialogue Boost: High', 'English', 'English Dialogue Boost: Medium'], 'Subtitles': ['English [CC]'], 'Directors': ['Steven Spielberg'], 'Producers': ['Steven Spielberg', 'Amy Pascal', 'Kristie Macosko Krieger'], 'Starring': ['Meryl Streep', 'Tom Hanks', 'Sarah Paulson'], 'Studio': ['20th Century Fox']}\nA very self serving account. I read an article from the NY times debating the facts related in the movie. Nevertheless, it is a refreshing story of courage. I guess feminism is in vogue so the movie caters to it. I felt movie was very slow, making a bit boring on some portions.\nNot very impressed\nBohemian Rhapsody\nDrama, Arts, Entertainment, and Culture, Bold, Electrifying\n['Bohemian Rhapsody celebrates the band Queen, their music, and their extraordinary lead singer Freddie Mercury, who defied convention to become one of the most beloved entertainers ever.']\n{'Audio languages': ['English', 'English [Audio Description]'], 'Subtitles': ['English [CC]'], 'Directors': ['Bryan Singer'], 'Producers': ['Graham King', 'Jim Beach'], 'Starring': ['Rami Malek', 'Lucy Boynton', 'Gwilym Lee']}\nIt is a sanitized version of Mercury's life. Not so accurate based on some reviews but it was great fun to watch. I love Queen's music. I would watch it again\nGreat movie\n{'Content advisory': ['Nudity', 'alcohol use', 'foul language', 'sexual content'], 'Audio languages': ['English', 'English [Audio Description]', 'Espa\u00f1ol', 'Portugu\u00eas', 'Fran\u00e7ais'], 'Subtitles': ['English [CC]', 'Espa\u00f1ol'], 'Directors': ['Damien Chazelle'], 'Producers': ['Jordan Horowitz', 'Marc Platt', 'Gary Gilbert', 'Fred Berger'], 'Starring': ['Ryan Gosling', 'Emma Stone', 'Amiee Conn'], 'Studio': ['Lionsgate']}\nIt was entertaining but not Oscar worthy. I remember musicals like Chicago and the classics: Fred Astaire, Judy Garland and others. This is not one of them\nNot Oscar worthy\n{'Audio languages': ['Espa\u00f1ol'], 'Subtitles': ['None available'], 'Directors': ['Asghar Farhadi'], 'Producers': ['Alexandre Mallet-Guy', '\u00c1lvaro Longoria'], 'Starring': ['Javier Bardem', 'Pen\u00e9lope Cruz', 'Ricardo Dar\u00edn']}\nThe acting from Penelope and her husband is great but the plot is not original. I love the setting in Spain.\nGreat acting not very original plot\n{'Content advisory': ['Violence', 'alcohol use', 'smoking', 'foul language'], 'Audio languages': ['English', 'English [Audio Description]'], 'Subtitles': ['English [CC]'], 'Directors': ['Damien Chazelle'], 'Producers': ['Damien Chazelle', 'Wyck Godfrey', 'Marty Bowen', 'Isaac Klausner'], 'Starring': ['Corey Stoll', 'Jason Clarke', 'Ciar\u00e1n Hinds'], 'Studio': ['Universal Pictures']}\nThis was a great historical account of the first moon landing. I am old enough to remember how unreal it felt. The whole world was riveted. I lived in Southamerica at the time and was just a little girl but I remember my family watching live on TV. Amazing US accomplishment\nGreat movie\nSully\nDrama, Cerebral, Inspiring, Serious\n['The story of Chesley Sullenberger, who became a hero after gliding his plane along the water in the Hudson River, saving all of his 155 passengers.']\n{'Content advisory': ['Violence', 'alcohol use', 'foul language'], 'Audio languages': ['English', 'English [Audio Description]'], 'Subtitles': ['English [CC]'], 'Directors': ['Clint Eastwood'], 'Producers': ['Clint Eastwood', 'Frank Marshall', 'Allyn Stewart', 'Tim Moore'], 'Starring': ['Tom Hanks', 'Aaron Eckhart', 'Laura Linney']}\nI lived this movie. Tom never disappoints. I could hardly believe that a man of such character who saved the lives of so many with sound judgement was embroiled in a review intended to show a fabricated negligence. Delighted that he was able to probe and defend his decision\nGreat movie\n{'Content advisory': ['Nudity', 'violence', 'alcohol use', 'smoking', 'foul language', 'sexual content'], 'Audio languages': ['English'], 'Subtitles': ['English [CC]'], 'Directors': ['David Cronenberg'], 'Producers': ['Marc Boyman', 'Mel Brooks', 'Stuart Cornfeld', 'Kip Ohman'], 'Starring': ['Jeff Goldblum', 'Geena Davis', 'John Getz'], 'Studio': ['The Walt Disney Studios']}\nWe watched this old movie with our grandson. Even though it\u2019s old, the plot has sound scientific grounds and the fly evolution is revoltingly credible. Good movie. He loved it\nOld but so good\n{'Content advisory': ['Violence', 'alcohol use', 'foul language'], 'Audio languages': ['English', 'English [Audio Description]'], 'Subtitles': ['English [CC]'], 'Directors': ['Osgood Perkins'], 'Studio': ['Metro-Goldwyn-Mayer (MGM)']}\nHorrible characters. Creepy and unauthentic with only aim to shock\nAwful\n{'Audio languages': ['English Dialogue Boost: High', 'English', 'English [Audio Description]', 'English Dialogue Boost: Medium', 'Italiano', 'Espa\u00f1ol', 'Portugu\u00eas', 'Fran\u00e7ais'], 'Subtitles': ['English [CC]', 'Espa\u00f1ol', 'Fran\u00e7ais', 'Italiano', 'Portugu\u00eas', 'Svenska'], 'Directors': ['Andy Tennant'], 'Producers': ['Robert Cort', 'Rhonda Byrne', 'Paul Hanson', 'Tri-G Films', 'Joe Gelchion', 'Matthew George', 'Robert Katz'], 'Starring': ['Katie Holmes', 'Josh Lucas', \"Jerry O'Connell\"], 'Studio': ['Lionsgate']}\nNice plot but Holmes is not a good actress. Lucas is very nice. But overall a good movie with a good message\nEntertaining\nAmerica's Untold Story DVD\nn/a  (Actor, Director)    Rated:    PG-13    Format: DVD\nMovies & TV, Featured Categories, DVD, Documentary\n[\"America's Untold Story DVD 2017 PG-13 - The first permanent European settlement in the United States was founded two generations before the Pilgrims arrived in 1565. America's Untold Story uncovers the story of America's past that never made it into textbooks.\"]\n{'MPAA rating': 'PG-13 (Parents Strongly Cautioned)', 'Product Dimensions': '0.7 x 7.5 x 5.4 inches; 2.93 Ounces', 'Media Format': 'NTSC, Widescreen', 'Run time': '4 hours', 'Release date': 'March 20, 2018', 'Studio': 'PBS (Direct)', 'Number of discs': '2'}\nFascinating series. It\u2019s interesting how this account doesn\u2019t make the history book. I had a friend from St Augustine that would always talk about the city being so old and keeping some Spanish parades to this day. Now I understand why\nGreat historical facts\n{'Content advisory': ['Nudity', 'violence', 'substance use', 'alcohol use', 'foul language', 'sexual content'], 'Audio languages': ['English', 'Espa\u00f1ol', 'Italiano', 'Espa\u00f1ol [descripci\u00f3n de audio]', '\u65e5\u672c\u8a9e', 'Portugu\u00eas', 'Espa\u00f1ol', 'Deutsch', 'Fran\u00e7ais'], 'Subtitles': ['English', '\u0627\u0644\u0639\u0631\u0628\u064a\u0629', '\u010ce\u0161tina', 'Dansk', 'Deutsch', '\u0395\u03bb\u03bb\u03b7\u03bd\u03b9\u03ba\u03ac', 'Espa\u00f1ol [CC]', 'Suomi', 'Filipino', 'Fran\u00e7ais', '\u05e2\u05d1\u05e8\u05d9\u05ea', '\u0939\u093f\u0928\u094d\u0926\u0940', 'Magyar', 'Indonesia', 'Italiano', '\u65e5\u672c\u8a9e', '\ud55c\uad6d\uc5b4', 'Bahasa Melayu', 'Norsk Bokm\u00e5l', 'Nederlands', 'Polski', 'Portugu\u00eas (Brasil)', 'Portugu\u00eas (Portugal)', 'Rom\u00e2n\u0103', '\u0420\u0443\u0441\u0441\u043a\u0438\u0439', 'Svenska', '\u0ba4\u0bae\u0bbf\u0bb4\u0bcd', '\u0c24\u0c46\u0c32\u0c41\u0c17\u0c41', '\u0e44\u0e17\u0e22', 'T\u00fcrk\u00e7e', '\u4e2d\u6587\uff08\u7b80\u4f53\uff09', '\u4e2d\u6587\uff08\u7e41\u9ad4\uff09'], 'Directors': ['Marco A. Castillo', 'Adolfo Mart\u00ednez P\u00e9rez', 'Miguel Alcantud', 'Arantxa Echevarr\u00eda', 'Luc\u00eda Valdivieso', 'Manuel Carballo', 'Alberto Ruiz Rojo'], 'Producers': ['Marco A. Castillo', 'Luis Arranz', 'Sara Fern\u00e1ndez-Velasco', 'Jos\u00e9 Velasco'], 'Starring': ['Jaime Lorente', 'Alicia Sanz', 'Francisco Ortiz'], 'Studio': ['Amazon Studios']}\nTerrible acting from main character. Dialogue was choppy. Was it dubbed? If so, bad job\nNot good\n{'Audio languages': ['English', 'English [Audio Description]'], 'Subtitles': ['English [CC]'], 'Directors': ['Michael Curtiz'], 'Producers': ['Robert Emmett Dolan'], 'Starring': ['Rosemary Clooney', 'Bing Crosby', 'Vera Ellen'], 'Studio': ['Paramount Pictures']}\nLove this movie. The colors, Crosby singing and pageantry is lovely. A must watch every season\nLove it\n{'Content advisory': ['Violence', 'substance use', 'foul language'], 'Audio languages': ['English', 'English [Audio Description]'], 'Subtitles': ['English [CC]', 'Espa\u00f1ol'], 'Directors': ['Derrick Borte'], 'Producers': ['Mark Gill', 'Andrew Gunn'], 'Starring': ['Russell Crowe', 'Caren Pistorius', 'Gabriel Bateman'], 'Studio': ['Solstice Studios']}\nRussell Crowe is amazing. So well acted and credible. There are so many cases of road rage triggered by similar personalities. In this case, an act of extreme rudeness and the inability to find common ground and apologize turns costly when the lady encounters an unstable man.\nBrutal and well acted\n{'Audio languages': ['English'], 'Subtitles': ['English [CC]'], 'Directors': ['Florian Zeller'], 'Producers': ['Jean-Louis Livi', 'David Parfitt', 'Philippe Carcassonne', 'Simon Friend'], 'Starring': ['Anthony Hopkins', 'Olivia Colman', 'Imogen Poots'], 'Studio': ['SONY PICTURES CLASSICS']}\nHopkins, a very gifted actor, delivers a sound performance. Movie subject is very sad.\nWell acted\n{'Content advisory': ['Violence', 'frightening scenes', 'substance use', 'alcohol use', 'smoking', 'foul language', 'sexual content'], 'Audio languages': ['English Dialogue Boost: High', 'English', 'English [Audio Description]', 'English Dialogue Boost: Medium', 'Fran\u00e7ais'], 'Subtitles': ['English [CC]', 'Dansk', 'Espa\u00f1ol', 'Suomi', 'Fran\u00e7ais', 'Norsk Bokm\u00e5l', 'Nederlands', 'Svenska'], 'Directors': ['Sam Donovan', 'Tracey Deer', 'Daniel Grou'], 'Producers': ['John Phillips', 'John Griffin', 'Rosalie Carew'], 'Starring': ['Alfred Molina', 'Rossif Sutherland', 'Elle-M\u00e1ij\u00e1 Tailfeathers'], 'Studio': ['Amazon Studios']}\nI have read every Louise Penny book and was excited about Amazon producing the series. Sadly, the magic of her books: 3-Pines scenery, the epicurean delights, the nuance of the characters, the humor, are missing. The Cruelest Month has barely any resemblance to the book. It\u2019s cheapened and lacks the sophisticated warmth so characteristic of Louise Penny.\nDisappointed\n{'Content advisory': ['Violence', 'alcohol use', 'smoking', 'foul language', 'sexual content'], 'Audio languages': ['English', 'English [Audio Description]', 'English Dialogue Boost: High', 'English Dialogue Boost: Medium', 'Espa\u00f1ol (Espa\u00f1a)', 'Italiano', 'Espa\u00f1ol (Latinoam\u00e9rica)', 'Polski', '\u65e5\u672c\u8a9e', 'Portugu\u00eas', 'Deutsch', 'Fran\u00e7ais'], 'Subtitles': ['English [CC]', '\u0627\u0644\u0639\u0631\u0628\u064a\u0629', '\u010ce\u0161tina', 'Dansk', 'Deutsch', '\u0395\u03bb\u03bb\u03b7\u03bd\u03b9\u03ba\u03ac', 'Espa\u00f1ol (Latinoam\u00e9rica)', 'Espa\u00f1ol (Espa\u00f1a)', 'Suomi', 'Filipino', 'Fran\u00e7ais', '\u05e2\u05d1\u05e8\u05d9\u05ea', '\u0939\u093f\u0928\u094d\u0926\u0940', 'Magyar', 'Indonesia', 'Italiano', '\u65e5\u672c\u8a9e', '\ud55c\uad6d\uc5b4', 'Bahasa Melayu', 'Norsk Bokm\u00e5l', 'Nederlands', 'Polski', 'Portugu\u00eas (Brasil)', 'Portugu\u00eas (Portugal)', 'Rom\u00e2n\u0103', '\u0420\u0443\u0441\u0441\u043a\u0438\u0439', 'Svenska', '\u0ba4\u0bae\u0bbf\u0bb4\u0bcd', '\u0c24\u0c46\u0c32\u0c41\u0c17\u0c41', '\u0e44\u0e17\u0e22', 'T\u00fcrk\u00e7e', '\u0423\u043a\u0440\u0430\u0457\u043d\u0441\u044c\u043a\u0430', 'Ti\u1ebfng Vi\u1ec7t', '\u4e2d\u6587\uff08\u7b80\u4f53\uff09', '\u4e2d\u6587\uff08\u7e41\u9ad4\uff09'], 'Directors': ['Will Yapp'], 'Producers': ['Expectation Entertainment', 'Condao Productions'], 'Starring': ['Jeremy Clarkson'], 'Studio': ['Amazon Studios']}\nThis my favorite season so far. Season 1 was great but Season 2 is the best. I can hardly wait for Season 3!\nLove it",
  "actual_interaction": {
    "rating": 5.0,
    "title": "Love it",
    "text": "This my favorite season so far. Season 1 was great but Season 2 is the best. I can hardly wait for Season 3!",
    "images": [],
    "asin": "B0B6VQ7FD7",
    "parent_asin": "B0B6VQ7FD7",
    "user_id": "AEYIFE4RMSBP5G2D7VOGSPV7BO3Q",
    "timestamp": "2023-02-23 20:33:32.956000",
    "helpful_vote": 0,
    "verified_purchase": true,
    "main_category": "Prime Video",
    "title_meta": null,
    "average_rating": 5.0,
    "rating_number": 2340,
    "features": null,
    "description": null,
    "price": null,
    "images_meta": [
      {
        "360w": "https://images-na.ssl-images-amazon.com/images/S/pv-target-images/8d9d9809944b0111b032115da520fc2dbaa074343d3bc14e142b037989de2718._RI_SX360_FMwebp_.jpg",
        "480w": "https://images-na.ssl-images-amazon.com/images/S/pv-target-images/8d9d9809944b0111b032115da520fc2dbaa074343d3bc14e142b037989de2718._RI_SX480_FMwebp_.jpg",
        "720w": "https://images-na.ssl-images-amazon.com/images/S/pv-target-images/8d9d9809944b0111b032115da520fc2dbaa074343d3bc14e142b037989de2718._RI_SX720_FMwebp_.jpg",
        "1080w": "https://images-na.ssl-images-amazon.com/images/S/pv-target-images/8d9d9809944b0111b032115da520fc2dbaa074343d3bc14e142b037989de2718._RI_SX1080_FMwebp_.jpg",
        "1440w": "https://images-na.ssl-images-amazon.com/images/S/pv-target-images/8d9d9809944b0111b032115da520fc2dbaa074343d3bc14e142b037989de2718._RI_SX1440_FMwebp_.jpg",
        "1920w": "https://images-na.ssl-images-amazon.com/images/S/pv-target-images/8d9d9809944b0111b032115da520fc2dbaa074343d3bc14e142b037989de2718._RI_SX1920_FMwebp_.jpg",
        "variant": "MAIN"
      }
    ],
    "videos": [],
    "store": null,
    "categories": null,
    "details": {
      "Content advisory": [
        "Violence",
        "alcohol use",
        "smoking",
        "foul language",
        "sexual content"
      ],
      "Audio languages": [
        "English",
        "English [Audio Description]",
        "English Dialogue Boost: High",
        "English Dialogue Boost: Medium",
        "Espa\u00f1ol (Espa\u00f1a)",
        "Italiano",
        "Espa\u00f1ol (Latinoam\u00e9rica)",
        "Polski",
        "\u65e5\u672c\u8a9e",
        "Portugu\u00eas",
        "Deutsch",
        "Fran\u00e7ais"
      ],
      "Subtitles": [
        "English [CC]",
        "\u0627\u0644\u0639\u0631\u0628\u064a\u0629",
        "\u010ce\u0161tina",
        "Dansk",
        "Deutsch",
        "\u0395\u03bb\u03bb\u03b7\u03bd\u03b9\u03ba\u03ac",
        "Espa\u00f1ol (Latinoam\u00e9rica)",
        "Espa\u00f1ol (Espa\u00f1a)",
        "Suomi",
        "Filipino",
        "Fran\u00e7ais",
        "\u05e2\u05d1\u05e8\u05d9\u05ea",
        "\u0939\u093f\u0928\u094d\u0926\u0940",
        "Magyar",
        "Indonesia",
        "Italiano",
        "\u65e5\u672c\u8a9e",
        "\ud55c\uad6d\uc5b4",
        "Bahasa Melayu",
        "Norsk Bokm\u00e5l",
        "Nederlands",
        "Polski",
        "Portugu\u00eas (Brasil)",
        "Portugu\u00eas (Portugal)",
        "Rom\u00e2n\u0103",
        "\u0420\u0443\u0441\u0441\u043a\u0438\u0439",
        "Svenska",
        "\u0ba4\u0bae\u0bbf\u0bb4\u0bcd",
        "\u0c24\u0c46\u0c32\u0c41\u0c17\u0c41",
        "\u0e44\u0e17\u0e22",
        "T\u00fcrk\u00e7e",
        "\u0423\u043a\u0440\u0430\u0457\u043d\u0441\u044c\u043a\u0430",
        "Ti\u1ebfng Vi\u1ec7t",
        "\u4e2d\u6587\uff08\u7b80\u4f53\uff09",
        "\u4e2d\u6587\uff08\u7e41\u9ad4\uff09"
      ],
      "Directors": [
        "Will Yapp"
      ],
      "Producers": [
        "Expectation Entertainment",
        "Condao Productions"
      ],
      "Starring": [
        "Jeremy Clarkson"
      ],
      "Studio": [
        "Amazon Studios"
      ]
    },
    "bought_together": null,
    "subtitle": null,
    "author": NaN
  }
}