{
  "interaction_number": 15,
  "interaction_summary": "=== Purchase Information ===\nProduct Title: Dead for a Dollar & Cain's Cutthroats (2 Movies on 1 disc)\nReview Date: 2021/03/13\nStore: John Ireland  (Actor),     Gordon Mitchell  (Actor)    Rated:    Unrated    Format: Unknown Binding\nCategories: Movies & TV, Genre for Featured Categories, Westerns\nProduct Description: ['This item is used and in good condition, Discs may show light scratches from normal use but are guaranteed to play perfectly and the cover may show wear. ** No Digital Code **']\nAverage Rating: 3.4\nProduct Details: {'Genre': 'Westerns', 'Format': 'Color', 'Contributor': 'John Carradine, Scott Brady, John Ireland, Gordon Mitchell', 'Language': 'English', 'Runtime': '3 hours and 15 minutes', 'Is Discontinued By Manufacturer': 'No', 'MPAA rating': 'Unrated (Not Rated)', 'Package Dimensions': '7.1 x 5.42 x 0.58 inches; 3.2 Ounces', 'Media Format': 'Color', 'Run time': '3 hours and 15 minutes', 'Actors': 'John Ireland, Gordon Mitchell, John Carradine, Scott Brady'}\nReview Text: Seller sent package quickly and securely.\nReview Title: Great third party seller. Awesome job\nRating: 5.0\n--------------------------------------------------",
  "reference_summary": "The Ghost Writer [Blu-ray]\nEwan McGregor  (Actor),     Pierce Brosnan  (Actor),     Roman Polanski  (Director, Writer)    &                   0                  more   Rated:    PG-13    Format: Blu-ray\nMovies & TV, Blu-ray, Movies\n['Following the mysterious death of an acclaimed ghost writer, a replacement writer is sent to an isolated compound to pen the memoirs of a former prime minister, and unknowingly becomes embroiled in a high stakes, international conspiracy that has deadly consequences.']\n{'Genre': 'mystery-and-suspense', 'Format': 'Multiple Formats, Blu-ray, Color, AC-3, Dolby, Widescreen, DTS Surround Sound, Subtitled, Dual Disc', 'Contributor': 'Timothy Hutton, Eli Wallach, Pierce Brosnan, Roman Polanski, James Belushi, Olivia Williams, Robert Harris, Ewan McGregor, Tom Wilkinson, Kim CattrallTimothy Hutton, Eli Wallach, Pierce Brosnan, Roman Polanski, James Belushi, Olivia Williams, Robert Harris, Ewan McGregor, Tom Wilkinson, Kim Cattrall  See more', 'Language': 'English', 'Runtime': '2 hours and 8 minutes', 'Is Discontinued By Manufacturer': 'No', 'MPAA rating': 'PG-13 (Parents Strongly Cautioned)', 'Product Dimensions': '0.5 x 5.4 x 6.7 inches; 2.4 Ounces', 'Item model number': 'SMIT66115508BR', 'Director': 'Roman Polanski', 'Media Format': 'Multiple Formats, Blu-ray, Color, AC-3, Dolby, Widescreen, DTS Surround Sound, Subtitled, Dual Disc', 'Run time': '2 hours and 8 minutes', 'Release date': 'August 3, 2010', 'Actors': 'Ewan McGregor, Pierce Brosnan, Kim Cattrall, Olivia Williams, Timothy Hutton', 'Subtitles': 'English', 'Studio': 'Summit Entertainment', 'Writers': 'Roman Polanski, Robert Harris', 'Country of Origin': 'USA', 'Number of discs': '2'}\nMovie was recommended and I enjoyed it.  Good twist\ngood movie\n{'Content advisory': ['Violence', 'alcohol use', 'foul language', 'sexual content'], 'Audio languages': ['English'], 'Subtitles': ['English [CC]'], 'Directors': ['Jack Bender', 'Peter Leto', 'David Barrett', 'Sergio Mimica-Gezzan', 'Kari Skogland', 'Eriq La Salle', 'Edward Ornelas', 'Peter Weller', 'Roxann Dawson', 'Paul A. Edwards'], 'Starring': ['Mike Vogel', 'Rachelle Lefevre', 'Natalie Martinez'], 'Studio': ['CBS']}\nLiked the premise. but then the plot turned into a series of totally unbelievable scenarios. The town has a population of what seems to be about 100 or so people turns into a city of thousands in the looting scene for instance.\nStarted out good then...\n{'Content advisory': ['Violence', 'substance use', 'alcohol use', 'smoking', 'foul language', 'sexual content'], 'Audio languages': ['English'], 'Subtitles': ['English [CC]'], 'Directors': ['Joe Chappelle', 'Ernest R. Dickerson', 'Clark Johnson', 'Ed Bianchi', 'Steve Shill', 'Daniel Attias', 'Timothy Van Patten', 'Agnieszka Holland', 'Brad Anderson', 'Clement Virgo'], 'Producers': ['David Simon', 'Robert F. Colesberry', 'Nina Kostroff Noble'], 'Starring': ['Dominic West', 'Sonja Sohn', 'Lance Reddick'], 'Studio': ['HBO']}\nbinge worthy\nBinge watch worthy\n{'Audio languages': ['English'], 'Subtitles': ['English [CC]'], 'Directors': ['Daniel Sackheim', 'Peter Markle', 'David Straiton', 'Elodie Keene', 'Adam Arkin', 'Paul McCrane', 'John Behring', 'Frederick King Keller', 'John Dahl', 'David Semel'], 'Studio': ['NBC']}\nVery entertaining. Good cast and good storyline, weekly cases usually have a slight twist but good overall.\nGood cast and good storyline\n{'Audio languages': ['English'], 'Subtitles': ['English [CC]'], 'Directors': ['Rand Ravich', 'Far Shariat', 'Dan Sackheim'], 'Producers': ['Rand Ravich', 'Far Shariat', 'David Semel', 'Dan Sackheim'], 'Studio': ['NBC']}\nLiked it a lot wished the show didn't end so soon.\nFour Stars\n{'Audio languages': ['English'], 'Subtitles': ['English [CC]'], 'Directors': ['Neil LaBute'], 'Producers': ['Gordon Bijelonic', 'Reggie Carter', 'Tim Chonacas', 'Michael Corrente', 'Forrest Crisman', 'Daryl Freimark', 'Tim Harms', 'Corey Large', 'Trent Othick'], 'Starring': ['Stanley Tucci', 'Alice Eve']}\nAnnoying show had to turn it off after fifteen minutes.\nAnnoying\n{'Content advisory': ['Violence', 'alcohol use', 'smoking', 'foul language', 'sexual content'], 'Audio languages': ['English'], 'Subtitles': ['English [CC]'], 'Directors': ['Adam McKay'], 'Producers': ['Judd Apatow', 'Shauna Robertson', 'David O. Russell', 'Shauna Weinberg', 'David B. Householter'], 'Starring': ['Will Ferrell', 'Christina Applegate', 'Steve Carell']}\nVery funny  LMFAO.  typical Will Farrell\ntypical Will\n{'Content advisory': ['Nudity', 'violence', 'alcohol use', 'smoking', 'foul language', 'sexual content'], 'Audio languages': ['English'], 'Subtitles': ['English [CC]'], 'Directors': ['Chris Long', 'Daniel Sackheim', 'Thomas Schlamme', 'Daniel Attias', 'Stefan Schwartz', 'Kevin Dowling', 'Nicole Kassell', 'Adam Arkin', 'Noah Emmerich', 'Matthew Rhys'], 'Starring': ['Keri Russell', 'Matthew Rhys', 'Maximiliano Hern\u00e1ndez']}\nMuch better on Amazon Prime instead of TV.  I didnt like it with all the commercials on tv but very good on AP\nMuch better on prime\n{'Content advisory': ['Nudity', 'violence', 'substance use', 'alcohol use', 'smoking', 'foul language', 'sexual content'], 'Audio languages': ['English Dialogue Boost: High', 'English', 'English [Audio Description]', 'English Dialogue Boost: Medium', 'English Dialogue Boost: Low', 'Italiano', '\u65e5\u672c\u8a9e', 'Portugu\u00eas', 'Deutsch', 'Espa\u00f1ol (Espa\u00f1a)', 'Espa\u00f1ol (Latinoam\u00e9rica)', 'Polski', 'Fran\u00e7ais'], 'Subtitles': ['English [CC]', '\u0627\u0644\u0639\u0631\u0628\u064a\u0629', '\u010ce\u0161tina', 'Dansk', 'Deutsch', '\u0395\u03bb\u03bb\u03b7\u03bd\u03b9\u03ba\u03ac', 'Espa\u00f1ol (Latinoam\u00e9rica)', 'Espa\u00f1ol (Espa\u00f1a)', 'Suomi', 'Filipino', 'Fran\u00e7ais', '\u05e2\u05d1\u05e8\u05d9\u05ea', '\u0939\u093f\u0928\u094d\u0926\u0940', 'Magyar', 'Indonesia', 'Italiano', '\u65e5\u672c\u8a9e', '\ud55c\uad6d\uc5b4', 'Bahasa Melayu', 'Norsk Bokm\u00e5l', 'Nederlands', 'Polski', 'Portugu\u00eas (Brasil)', 'Portugu\u00eas (Portugal)', 'Rom\u00e2n\u0103', '\u0420\u0443\u0441\u0441\u043a\u0438\u0439', 'Svenska', '\u0ba4\u0bae\u0bbf\u0bb4\u0bcd', '\u0c24\u0c46\u0c32\u0c41\u0c17\u0c41', '\u0e44\u0e17\u0e22', 'T\u00fcrk\u00e7e', '\u0423\u043a\u0440\u0430\u0457\u043d\u0441\u044c\u043a\u0430', 'Ti\u1ebfng Vi\u1ec7t', '\u4e2d\u6587\uff08\u7b80\u4f53\uff09', '\u4e2d\u6587\uff08\u7e41\u9ad4\uff09'], 'Directors': ['Rosemary Rodriguez', 'Sarah Pia Anderson', 'Seth Gordon', 'Laura Innes', 'Craig Zisk', 'Michael Pressman', 'Adam Arkin'], 'Producers': ['James Degus', 'Margo Myers Massey'], 'Starring': ['Marin Ireland', 'Shane Mcrae', 'Giovanni Ribisi'], 'Studio': ['Amazon Studios']}\nWe want episode 2. I missed the web adress at the end of the show to request more episodes.\nWe want episode 2.\n{'Content advisory': ['Nudity', 'violence', 'alcohol use', 'smoking', 'foul language', 'sexual content'], 'Audio languages': ['English'], 'Subtitles': ['English [CC]'], 'Directors': ['Chris Long', 'Daniel Sackheim', 'Thomas Schlamme', 'Daniel Attias', 'Stefan Schwartz', 'Kevin Dowling', 'Nicole Kassell', 'Adam Arkin', 'Noah Emmerich', 'Matthew Rhys'], 'Starring': ['Keri Russell', 'Matthew Rhys', 'Brandon J. Dirden'], 'Studio': ['FX']}\nAs always very entertaining. Brought everyone back from season 4. Now I have to wait until next week for episode 2.\nWatched the show not the trailer.\nGreat Cinema: 15 Classic Films (4 Disc Set)\nElizabeth Taylor  (Actor),     Bette Davis  (Actor)    Rated:    PG-13    Format: DVD\nMovies & TV, Genre for Featured Categories, Action & Adventure\n[\"Great novels inspired these 15 critically acclaimed films starring Hollywood's most important stars. From Shakespeare's Macbeth and F. Scott Fitzgerald's The Last Time I Saw Paris to Dickens' A Tale of Two Cities and Rudyard Kipling's The Jungle Book, Hollywood has captured the essence of these timeless stories on film. The Snows of Kilimanjaro, Anna Karenina, A Connecticut Yankee in King Arthur's Court, A Tale of Two Cities, Jayne Eyre, Legend of the Sea Wolf, Adventures of Huckleberry Finn, The Jungle Book, Macbeth, Call of the Wild, Of Human Bondage, Little Men, David Copperfield, The Last Time I Saw Paris, Cyrano De Bergerac\"]\n{'Genre': 'Action & Adventure', 'Format': 'NTSC', 'Contributor': 'Jose Ferrer, Bette Davis, Chuck Connors, Vivien Leigh, Boris Karloff, Elizabeth Taylor, Susan Hayward, Gregory Peck, Ava GardnerJose Ferrer, Bette Davis, Chuck Connors, Vivien Leigh, Boris Karloff, Elizabeth Taylor, Susan Hayward, Gregory Peck, Ava Gardner  See more', 'Language': 'English', 'Number Of Discs': '4', 'Aspect Ratio': '1.33:1', 'Is Discontinued By Manufacturer': 'No', 'MPAA rating': 'PG-13 (Parents Strongly Cautioned)', 'Product Dimensions': '7.5 x 5.5 x 0.5 inches; 3.5 Ounces', 'Item model number': 'DEC50899DVD', 'Media Format': 'NTSC', 'Run time': '16 hours', 'Release date': 'March 20, 2012', 'Actors': 'Elizabeth Taylor, Bette Davis, Susan Hayward, Gregory Peck, Jose Ferrer', 'Studio': 'TGG Direct', 'Number of discs': '4'}\nMovies are good but quality has much to be desired.\nClassic movies seem to be recorded with betamax player on an old sheet.\n{'Audio languages': ['English'], 'Subtitles': ['English [CC]'], 'Directors': ['Mark Waters'], 'Producers': ['Broad Green Pictures'], 'Starring': ['Billy Bob Thornton', 'Kathy Bates', 'Terry Cox'], 'Studio': ['Paramount Internal ViacomCBS']}\nTypical remake more vulgar, not as funny.\nTypical redo  milking the original\n{'Content advisory': ['Violence', 'alcohol use', 'foul language', 'sexual content'], 'Audio languages': ['English'], 'Subtitles': ['English [CC]'], 'Directors': ['Leigh Whannell'], 'Producers': ['Jason Blum', 'Kylie du Fresne'], 'Starring': ['Logan Marshall-Green', 'Betty Gabriel', 'Harrison Gilbertson'], 'Studio': ['Universal Pictures']}\nI really liked this movie. It is a combination of Matrix, 2001 Space Odysseys and Deadpool. Had good action and humor. I usually don't give out 5 ratings.\nGreat sci-fi AI movie.\n{'Audio languages': ['English'], 'Subtitles': ['English [CC]'], 'Directors': ['Stanley Brode'], 'Producers': ['Jessalyn Maguire', 'Stanley Brode', 'Sarah Brennan-Kolb'], 'Starring': ['Jessalyn Maguire', 'John Fugelsang', 'Chris Beetem'], 'Studio': ['Indie Rights']}\nIt was okay.\nEnded with questions .\nDead for a Dollar & Cain's Cutthroats (2 Movies on 1 disc)\nJohn Ireland  (Actor),     Gordon Mitchell  (Actor)    Rated:    Unrated    Format: Unknown Binding\nMovies & TV, Genre for Featured Categories, Westerns\n['This item is used and in good condition, Discs may show light scratches from normal use but are guaranteed to play perfectly and the cover may show wear. ** No Digital Code **']\n{'Genre': 'Westerns', 'Format': 'Color', 'Contributor': 'John Carradine, Scott Brady, John Ireland, Gordon Mitchell', 'Language': 'English', 'Runtime': '3 hours and 15 minutes', 'Is Discontinued By Manufacturer': 'No', 'MPAA rating': 'Unrated (Not Rated)', 'Package Dimensions': '7.1 x 5.42 x 0.58 inches; 3.2 Ounces', 'Media Format': 'Color', 'Run time': '3 hours and 15 minutes', 'Actors': 'John Ireland, Gordon Mitchell, John Carradine, Scott Brady'}\nSeller sent package quickly and securely.\nGreat third party seller. Awesome job",
  "actual_interaction": {
    "rating": 5.0,
    "title": "Great third party seller. Awesome job",
    "text": "Seller sent package quickly and securely.",
    "images": [],
    "asin": "B000X5XFV8",
    "parent_asin": "B000X5XFV8",
    "user_id": "AG5AM6XBM7HVPZWDWJ4NEPITXY5Q",
    "timestamp": "2021-03-13 21:45:05.776000",
    "helpful_vote": 0,
    "verified_purchase": true,
    "main_category": "Movies & TV",
    "title_meta": "Dead for a Dollar & Cain's Cutthroats (2 Movies on 1 disc)",
    "average_rating": 3.4,
    "rating_number": 7,
    "features": [],
    "description": [
      "This item is used and in good condition, Discs may show light scratches from normal use but are guaranteed to play perfectly and the cover may show wear. ** No Digital Code **"
    ],
    "price": 3.75,
    "images_meta": [
      {
        "thumb": "https://m.media-amazon.com/images/I/51gagctRGBL._SX38_SY50_CR,0,0,38,50_.jpg",
        "large": "https://m.media-amazon.com/images/I/51gagctRGBL.jpg",
        "variant": "MAIN",
        "hi_res": null
      },
      {
        "thumb": "https://m.media-amazon.com/images/I/51T2yXw5RCL._SX38_SY50_CR,0,0,38,50_.jpg",
        "large": "https://m.media-amazon.com/images/I/51T2yXw5RCL.jpg",
        "variant": "PT01",
        "hi_res": null
      }
    ],
    "videos": [],
    "store": "John Ireland  (Actor),     Gordon Mitchell  (Actor)    Rated:    Unrated    Format: Unknown Binding",
    "categories": [
      "Movies & TV",
      "Genre for Featured Categories",
      "Westerns"
    ],
    "details": {
      "Genre": "Westerns",
      "Format": "Color",
      "Contributor": "John Carradine, Scott Brady, John Ireland, Gordon Mitchell",
      "Language": "English",
      "Runtime": "3 hours and 15 minutes",
      "Is Discontinued By Manufacturer": "No",
      "MPAA rating": "Unrated (Not Rated)",
      "Package Dimensions": "7.1 x 5.42 x 0.58 inches; 3.2 Ounces",
      "Media Format": "Color",
      "Run time": "3 hours and 15 minutes",
      "Actors": "John Ireland, Gordon Mitchell, John Carradine, Scott Brady"
    },
    "bought_together": null,
    "subtitle": NaN,
    "author": NaN
  }
}